paper_id,creator_names,conf_abbrev,article_title,publication_yr
265,"s gatziu , m jeusfeld , m staudt , y vassiliou",sigmod record,design and management of data warehouses : report on the dmdw '99 workshop,1999
266,"h wang , s park , w fan , p yu",sigmod conference,vist : a dynamic index method for querying xml data by tree structures,2003
267,m franklin,sigmod record,editor 's notes,1999
268,"r sion , m atallah , s prabhakar",sigmod conference,rights protection for relational data,2003
269,"a eisenberg , j melton",sigmod record,sql standardization : the next steps,2000
270,,,reminiscences on influential papers,2000
271,"r agrawal , a evfimievski , r srikant",sigmod conference,information sharing across private databases,2003
272,"g dong , j su",sigmod record,incremental maintenance of recursive views using relational calculus/sql,2000
273,"s schleimer , d wilkerson , a aiken",sigmod conference,winnowing : local algorithms for document fingerprinting,2003
274,"t johnson , t dasu",sigmod conference,data quality and data cleaning : an overview,2003
275,"s ceri , l kalinichenko , m kitsuregawa , h lu , z жzsoyoglu , r snodgrass , v vianu",sigmod record,sigmod sister societies,2000
276,"a gupta , b ludфscher , m martone",sigmod conference,birn-m : a semantic mediator for solving real-world neuroscience problems,2003
277,"r agrawal , p haas , j kiernan",sigmod conference,a system for watermarking relational databases,2003
278,,,chair 's message,2000
279,"a paepcke , h garcia-molina , g rodrэguez-mulр , j cho",sigmod record,beyond document similarity : understanding value-based search and browsing technologies,2000
280,"d abadi , d carney , u чetintemel , m cherniack , c convey , c erwin , e galvez , m hatoun , a maskey , a rasin , a singer , m stonebraker , n tatbul , y xing , r yan , s zdonik",sigmod conference,aurora : a data stream management system,2003
281,j ullman,sigmod conference,improving the efficiency of database-system teaching,2003
282,"a bonifati , s ceri",sigmod record,comparative analysis of five xml query languages,2000
283,"h liefke , d suciu",sigmod record,an extensible compressor for xml data,2000
284,,,"proceedings of the 2003 acm sigmod international conference on management of data , san diego , california , usa , june 9-12 , 2003",2003
285,c vassilakis,sigmod record,an optimisation scheme for coalesce/valid time selection operator sequences,2000
286,n mamoulis,sigmod conference,efficient processing of joins on set-valued attributes,2003
287,"e pourabbas , m rafanelli",sigmod record,hierarchies and relative operators in the olap environment,2000
288,"a jagatheesan , a rajasekar",sigmod conference,data grid management systems,2003
289,"r cheng , d kalashnikov , s prabhakar",sigmod conference,evaluating probabilistic queries over imprecise data,2003
290,"j roddick , l al-jadir , l bertossi , m dumas , f estrella , h gregersen , k hornsby , j lufter , f mandreoli , t mфnnistі , e mayol , l wedemeijer",sigmod record,evolution and change in data management - issues and directions,2000
291,"c olston , j jiang , j widom",sigmod conference,adaptive filters for continuous queries over distributed data streams,2003
292,"a labrinidis , n roussopoulos",sigmod record,generating dynamic content at database-backed web servers : cgi-bin vs. mod_perl,2000
293,t palpanas,sigmod record,knowledge discovery in data warehouses,2000
294,"s abiteboul , a bonifati , g cobena , i manolescu , t milo",sigmod conference,dynamic xml documents with distribution and replication,2003
295,m franklin,sigmod record,editor 's notes,2000
296,"b babcock , s chaudhuri , g das",sigmod conference,dynamic sample selection for approximate query processing,2003
297,"j shen , a ngu , j shepherd , d huynh , q sheng",sigmod conference,cmvf : a novel dimension reduction scheme for efficient indexing in a large image database,2003
298,"t westmann , d kossmann , s helmer , g moerkotte",sigmod record,the implementation and performance of compressed databases,2000
299,"c bornhіvd , m altinel , s krishnamurthy , c mohan , h pirahesh , b reinwald",sigmod conference,dbcache : middle-tier database caching for highly scalable e-business architectures,2003
300,"t vetterli , a vaduva , m staudt",sigmod record,metadata standards for data warehousing : open information model vs. common warehouse metamodel,2000
301,"d dehaan , d toman , m consens , m жzsu",sigmod conference,a comprehensive xquery to sql translation using dynamic interval encoding,2003
302,"e clementini , p felice",sigmod record,spatial operators,2000
303,,,reminiscences on influential papers,2000
304,"c cranor , t johnson , o spatscheck , v shkapenyuk",sigmod conference,gigascope : a stream database for network applications,2003
305,g bierman,sigmod conference,formal semantics and analysis of object queries,2003
306,,,report on second international workshop on advanced issues of e-commerce and web-based information systems,2000
307,"s arpinar , a dogac",sigmod record,provision of market services for eco compliant electronic market places,2000
308,"c sun , d agrawal , a abbadi",sigmod conference,hardware acceleration for spatial selections and joins,2003
309,"f reiss , t kanungo",sigmod conference,a characterization of the sensitivity of query optimization to storage access cost parameters,2003
310,,,"workshop on performance and architecture of web servers ( paws-2000 , held in conjection with sigmetrics-2000 )",2000
311,"d lomet , m tuttle",sigmod conference,a theory of redo recovery,2003
312,,,report in isdo ' 00 : the caise * 00 workshop on infrastructures for dynamic business-to-business service outsourcinga,2000
313,,,sigmod digital symposium collection ( disc ) editor 's message,2000
314,"a deshpande , s nath , p gibbons , s seshan",sigmod conference,cache-and-query for wide area sensor databases,2003
315,"c li , p bohannon , h korth , p narayan",sigmod conference,composing xsl transformations with xml publishing views,2003
316,,,sigmod ' 2000 program chair 's message,2000
317,"d papadias , y tao , g fu , b seeger",sigmod conference,an optimal and progressive algorithm for skyline queries,2003
318,,,information director 's message,2000
319,,,sigmod anthology editor 's message,2000
320,"b cui , b ooi , j su , k tan",sigmod conference,contorting high dimensional data for efficient main memory processing,2003
321,,,chair 's message,2000
322,m stonebraker,sigmod conference,visionary : a next generation visualization system for databases,2003
323,"d lee , w chu",sigmod record,comparative analysis of six xml schema languages,2000
324,p raghavan,sigmod conference,extracting and exploiting structure in text search,2003
325,p seshadri,sigmod conference,building notification services with microsoft sqlserver,2003
326,,,vice chair 's message,2000
327,n shivakumar,sigmod conference,google in a box - building the google search appliance,2003
328,h zeller,sigmod conference,nonstop sql/mx publish/subscribe : continuous data streams in transaction processing,2003
329,m franklin,sigmod record,editor 's notes,2000
330,g colliat,sigmod conference,data management challenges in crm,2003
331,"m pіss , c floyd",sigmod record,new tpc benchmarks for decision support and web commerce,2000
332,"k goto , y kambayashi",sigmod conference,integration of electronic tickets and personal guide system for public transport using mobile terminals,2003
333,j bussche,sigmod record,constraint databases : a tutorial introduction,2000
334,"s padmanabhan , b bhattacharjee , t malkemus , l cranston , m huras",sigmod conference,multi-dimensional clustering : a new data layout scheme in db2,2003
335,"y theodoridis , m nascimento",sigmod record,generating spatiotemporal datasets on the www,2000
336,a halevy,sigmod record,theory of answering queries using views,2000
337,"h kriegel , s brecheisen , p krіger , m pfeifle , m schubert",sigmod conference,using sets of feature vectors for similarity search on voxelized cad objects,2003
338,"a rashid , p sawyer",sigmod record,object database evolution using separation of concerns,2000
339,c aggarwal,sigmod conference,a framework for change diagnosis of data streams,2003
340,"s chaudhuri , r kaushik , j naughton",sigmod conference,on relational support for xml publishing : beyond sorting and tagging,2003
341,a jhingran,sigmod record,moving up the food chain : supporting e-commerce applications on databases,2000
342,,,reminiscences on influential papers,2000
343,"d kim , c chung",sigmod conference,qcluster : relevance feedback using adaptive clustering for content-based image retrieval,2003
344,v krishnamurthy,sigmod conference,oracle xml db repository,2003
345,,,vldb workshop on technologies in e-services ( tes ),2000
346,,,sigmod program review,2000
347,a pruscino,sigmod conference,oracle rac : architecture and performance,2003
348,a bosworth,sigmod conference,the future of web services - i,2003
349,"b pєssas , w jr. , m carvalho , r resende",sigmod record,using quantitative information for efficient association rule generation,2000
350,f cabrera,sigmod conference,the future of web services - ii,2003
351,,,"research and practice in federated information systems , report of the efis ' 2000 international workshop",2000
352,"s ganguly , m garofalakis , r rastogi",sigmod conference,processing set expressions over continuous update streams,2003
353,m franklin,sigmod record,editor 's notes,2000
354,"j yuen , e chan , k lam , h leung",sigmod record,cache invalidation scheme for mobile computing systems with real-time data,2000
355,"s chaudhuri , k ganjam , v ganti , r motwani",sigmod conference,robust and efficient fuzzy match for online data cleaning,2003
356,"a kementsietsidis , m arenas , r miller",sigmod conference,mapping data in peer-to-peer systems : semantics and algorithmic issues,2003
357,"p bernstein , a halevy , r pottinger",sigmod record,a vision of management of complex models,2000
358,"e stolte , c praun , g alonso , t gross",sigmod conference,scientific data repositories : designing for a moving target,2003
359,,,chair 's message,2000
360,"a gupta , d suciu",sigmod conference,stream processing of xpath queries with predicates,2003
361,,,xml and information retrieval : a sigir 2000 workshop,2001
362,,,report on the fourth international conference on flexible query answering systems,2001
363,"f peng , s chawathe",sigmod conference,xpath queries on streaming data,2003
364,"j zhang , m zhu , d papadias , y tao , d lee",sigmod conference,location-based spatial queries,2003
365,"j melton , j michels , v josifovski , k kulkarni , p schwarz , k zeidenstein",sigmod record,sql and management of external data,2001
366,"r miller , m hernсndez , l haas , l yan , c ho , r fagin , l popa",sigmod record,the clio project : managing heterogeneity,2001
367,"s madden , m franklin , j hellerstein , w hong",sigmod conference,the design of an acquisitional query processor for sensor networks,2003
368,"j min , m park , c chung",sigmod conference,xpress : a queriable compression for xml data,2003
369,"e bertino , a elmagarmid , m hacid",sigmod record,quality of service in multimedia digital libraries,2001
370,"c qun , a lim , k ong",sigmod conference,d ( k ) - index : an adaptive structural summary for graph-structured data,2003
371,"l feng , m jeusfeld , j hoppenbrouwers",sigmod record,towards knowledge-based digital libraries,2001
372,c dyreson,sigmod conference,"temporal coalescing with now , granularity , and incomplete information",2003
373,,,reminiscences on influential papers,2001
374,,,report on xewa-00 : the xml enabled wide-area searches for bioinformatics workshop,2001
375,"y zhu , d shasha",sigmod conference,warping indexes with envelope transforms for query by humming,2003
376,,,chair 's message,2001
377,"s melnik , e rahm , p bernstein",sigmod conference,rondo : a programming platform for generic model management,2003
378,"j kang , j naughton",sigmod conference,on schema matching with opaque column names and data values,2003
379,c aggarwal,sigmod record,re-designing distance functions and distance-based applications for high dimensional data,2001
380,"b he , k chang",sigmod conference,statistical schema matching across web query interfaces,2003
381,"j lawder , p king",sigmod record,querying multi-dimensional data indexed using the hilbert space-filling curve,2001
382,"s cohen , y matias",sigmod conference,spectral bloom filters,2003
383,"c pu , k schwan , j walpole",sigmod record,infosphere project : system support for information flow applications,2001
384,"p bernstein , m brodie , s ceri , d dewitt , m franklin , h garcia-molina , j gray , g held , j hellerstein , h jagadish , m lesk , d maier , j naughton , h pirahesh , m stonebraker , j ullman",sigmod record,the asilomar report on database research,1998
385,"g luo , c ellmann , p haas , j naughton",sigmod conference,a scalable hash ripple join algorithm,2002
386,"h hacigќmќs , b iyer , c li , s mehrotra",sigmod conference,executing sql over encrypted data in the database-service-provider model,2002
387,"m christoffel , s pulkowski , b schmitt , p lockemann",sigmod record,electronic market : the roadmap for university libraries and members to survive in the information jungle,1998
388,"r kaushik , p bohannon , j naughton , h korth",sigmod conference,covering indexes for branching path queries,2002
389,"b meltzer , r glushko",sigmod record,xml and electronic commerce : enabling the network economy,1998
390,"c chung , j min , k shim",sigmod conference,apex : an adaptive path index for xml data,2002
391,"m bichler , a segev , j zhao",sigmod record,component-based e-commerce : assesment of current practices and future directions,1998
392,t grust,sigmod conference,accelerating xpath location steps,2002
393,m franklin,sigmod record,editor 's notes,1998
394,"v zadorozhny , l raschid , m vidal , t urhan , l bright",sigmod conference,efficient evaluation of queries in a mediator for websources,2002
395,"a eisenberg , j melton",sigmod record,"sqlj part 0 , now known as sql/olb ( object-language bindings )",1998
396,d ritter,sigmod record,the middleware muddle,1998
397,"c olston , j widom",sigmod conference,best-effort cache synchronization with source cooperation,2002
398,,,reminiscences on influential papers,1998
399,"s madden , m shah , j hellerstein , v raman",sigmod conference,continuously adaptive continuous queries over streams,2002
400,"p kalnis , w ng , b ooi , d papadias , k tan",sigmod conference,an adaptive peer-to-peer network for distributed caching of olap results,2002
401,"s boll , w klas , b battaglin",sigmod record,design and implementation of rmp - a virtual electronic market place,1998
402,"b reich , i ben-shaul",sigmod record,a componentized architecture for dynamic electronic markets,1998
403,"m riedewald , d agrawal , a abbadi",sigmod conference,efficient integration and aggregation of historical information,2002
404,"p buneman , s khanna , k tajima , w tan",sigmod conference,archiving scientific data,2002
405,"n jennings , t norman , p faratin",sigmod record,adept : an agent-based approach to business process management,1998
406,,,xquery : a query language for xml,2003
407,"a dogac , i durusoy , s arpinar , n tatbul , p koksal , i cingil , n dimililer",sigmod record,a workflow-based electronic marketplace on the web,1998
408,,,guest editor 's introduction,1998
409,"j gray , h schek , m stonebraker , j ullman",sigmod conference,the lowell report,2003
410,,,chair 's message,1998
411,"n koudas , d srivastava",sigmod conference,panel : querying networked databases,2003
412,"f korn , s muthukrishnan , y zhu",sigmod conference,ipsofacto : a visual correlation tool for aggregate network traffic data,2003
413,"j domingo-ferrer , j herrera-joancomartэ",sigmod record,an anonymous electronic commerce scheme with an off-line authority and untrusted agents,1998
414,"a bќchner , m mulvenna",sigmod record,discovering internet marketing intelligence through online analytical web usage mining,1998
415,"v sengar , j haritsa",sigmod conference,plastic : reducing query optimization overheads through plan recycling,2003
416,"p bohannon , x dong , s ganguly , h korth , c li , p narayan , p shenoy",sigmod conference,rolex : relational on-line exchange with xml,2003
417,"a sheth , c bertram , k shah",sigmod record,videoanywhere : a system for searching and managing distributed video assets,1999
418,,,reminiscences on influential papers,1999
419,"y zhu , d shasha , x zhao",sigmod conference,query by humming - in action with its technology revealed,2003
420,"x zhang , k dimitrova , l wang , m el-sayed , b murphy , b pielech , m mulchandani , l ding , e rundensteiner",sigmod conference,rainbow : multi-xquery optimization using materialized xml views,2003
421,,,report on the 13th brazilian symposium on database systems ( sbbd ' 98 ),1999
422,"s paparizos , s al-khalifa , a chapman , h jagadish , l lakshmanan , a nierman , j patel , d srivastava , n wiwatwattana , y wu , c yu",sigmod conference,timber : a native system for querying xml,2003
423,"m roantree , j murphy , w hasselbring",sigmod record,the oasis multidatabase prototype,1999
424,"s cho , s amer-yahia , l lakshmanan , d srivastava",sigmod conference,lockx : a system for efficiently querying secure xml,2003
425,m franklin,sigmod record,editor 's notes,1998
426,s danish,sigmod record,building database-driven electronic catalogs,1998
427,"a zhou , q wang , z guo , x gong , s zheng , h wu , j xiao , k yue , w fan",sigmod conference,trex : dtd-conforming xml to xml transformations,2003
428,,,nsf workshop on industrial/academic cooperation in database systems,1999
429,"a deshpande , s nath , p gibbons , s seshan",sigmod conference,irisnet : internet-scale resource-intensive sensor services,2003
430,"a eisenberg , j melton",sigmod record,"sql : 1999 , formerly known as sql 3",1999
431,"s chandrasekaran , o cooper , a deshpande , m franklin , j hellerstein , w hong , s krishnamurthy , s madden , f reiss , m shah",sigmod conference,telegraphcq : continuous dataflow processing,2003
432,d mackay,sigmod record,semantic integration of environmental models for application to global information systems and decision-making,1999
433,"s amer-yahia , m fernandez , d srivastava , y xu",sigmod conference,pix : exact and approximate phrase matching in xml,2003
434,"a arasu , b babcock , s babu , m datar , k ito , i nishizawa , j rosenstein , j widom",sigmod conference,stream : the stanford stream data manager,2003
435,"e forte , f haenni , k warkentyne , e duval , k cardinaels , e vervaet , k hendrikx , m forte , f simillion",sigmod record,semantic and pedagogic interoperability mechanisms in the ariadne educational repository,1999
436,e hanson,sigmod record,statement from the treasurer,1999
437,"p larson , j goldstein , j zhou",sigmod conference,transparent mid-tier database caching in sql server,2003
438,"a ouksel , a sheth",sigmod record,semantic interoperability in global information systems : a brief introduction to the research area and the special section,1999
439,"e agichtein , l gravano",sigmod conference,qxtract : a building block for efficient information extraction from plain-text databases,2003
440,"b ooi , k tan , a zhou , c goh , y li , c liau , b ling , w ng , y shu , x wang , m zhang",sigmod conference,peerdb : peering into personal databases,2003
441,"s bergamaschi , s castano , m vincini",sigmod record,semantic integration of semistructured and structured data sources,1999
442,"d liu , m franklin , d parekh",sigmod conference,griddb : a database interface to the grid,2003
443,a gal,sigmod record,semantic interoperability in information services : experiencing with coopware,1999
444,"k smith , l obrst",sigmod record,unpacking the semantics of source and usage to perform semantic reconciliation in large-scale information systems,1999
445,"c zuzarte , h pirahesh , w ma , q cheng , l liu , k wong",sigmod conference,winmagic : subquery elimination using window aggregation,2003
446,"l lakshmanan , j pei , y zhao",sigmod conference,socqet : semantic olap with compressed cube and summarization,2003
447,a hampapur,sigmod record,semantic video indexing : approach and issue,1999
448,"d shasha , p bonnet",sigmod conference,"database tuning : principles , experiments , and troubleshooting techniques ( part ii )",2002
449,"k sycara , m klusch , s widoff , j lu",sigmod record,dynamic service matchmaking among agents in open information environments,1999
450,"d shasha , p bonnet",sigmod conference,"database tuning : principles , experiments , and troubleshooting techniques ( part i )",2002
451,"m papazoglou , j hoppenbrouwers",sigmod record,contextualizing the information space in federated digital libraries,1999
452,"m souza , m sampaio",sigmod record,efficient materialization and use of views in data warehouses,1999
453,"s viglas , j naughton",sigmod conference,rate-based query optimization for streaming information sources,2002
454,,,"proceedings of the 2002 acm sigmod international conference on management of data , madison , wisconsin , june 3-6 , 2002",2002
455,"j fowler , b perry , m nodine , b bargmeyer",sigmod record,agent-based semantic interoperability in infosleuth,1999
456,"j kuan , p lewis",sigmod record,a study on data point search for hg-trees,1999
457,"a hinneburg , d keim , m wawryniuk",sigmod conference,hd-eye : visual clustering of high dimensional data,2002
458,"s ceri , p fraternali , s paraboschi",sigmod record,design principles for data-intensive web sites,1999
459,"j phan , r ng",sigmod conference,gea : a toolkit for gene expression analysis,2002
460,,,chair 's message,1999
461,p bonnet,sigmod conference,going public : open-source databases and database research,2002
462,w kim,,"message from editor-in-chief , acm transactions on database systems",1999
463,"j hellerstein , j widom",sigmod conference,data streams : fresh current or stagnant backwater ? ( panel ),2002
464,"l gruenwald , l brown , r dirckze , s guinepain , c sсnchez , b summers , s vanichayobon",sigmod record,database research at the university of oklahoma,1999
465,"c cranor , y gao , t johnson , v shkapenyuk , o spatscheck",sigmod conference,gigascope : high performance network monitoring with an sql interface,2002
466,"r domenig , k dittrich",sigmod record,an overview and classification of mediated query systems,1999
467,"s madden , j hellerstein",sigmod conference,distributing queries over low-power wireless sensor networks,2002
468,"s agrawal , s chaudhuri , g das",sigmod conference,dbxplorer : enabling keyword search over relational databases,2002
469,,,chair 's message,1999
470,,,vice chair 's message,1999
471,"j han , j wang , g dong , j pei , k wang",sigmod conference,cubeexplorer : online exploration of data cubes,2002
472,"p karbhari , m rabinovich , z xiao , f douglis",sigmod conference,acdn : a content delivery network for applications,2002
473,"s yau , h leong , d mcleod , a si",sigmod record,on multi-resolution document transmission in mobile web,1999
474,"m altinel , q luo , s krishnamurthy , c mohan , h pirahesh , b lindsay , h woo , l brown",sigmod conference,dbcache : database caching for web application servers,2002
475,,,"towards adaptive workflow systems , cscw-98 workshop report",1999
476,"w fung , d sun , j gehrke",sigmod conference,cougar : the network is the database,2002
477,m franklin,sigmod record,editor 's notes,1999
478,"t wang , s tang , d yang , j gao , y wu , j pei",sigmod conference,"commix : towards effective web information extraction , integration and query answering",2002
479,,,reminiscences on influential papers,1999
480,"a dogac , y tambag , p pembecioglu , s pektas , g laleci , g kurt , s toprak , y kabak",sigmod conference,an ebxml infrastructure implementation through uddi registries and rosettanet pips,2002
481,,sigmod record,"the active database central , er2000 , vldb 2000 , wise 2000 , books , acm dl",1999
482,"p bumbulis , i bowman",sigmod conference,a compact b-tree,2002
483,m franklin,sigmod record,editor 's notes,1999
484,a weininger,sigmod conference,efficient execution of joins in a star schema,2002
485,"s conrad , w hasselbring , u hohenstein , r kutsche , m roantree , g saake , f saltor",sigmod record,engineering federated information systems : report of efis '99 workshop,1999
486,"a frank , s grumbach , r gќting , c jensen , m koubarakis , n lorentzos , y manolopoulos , e nardelli , b pernici , h schek , m scholl , t sellis , b theodoulidis , p widmayer",sigmod record,chorochronos : a research network for spatiotemporal database systems,1999
487,"j rao , c zhang , n megiddo , g lohman",sigmod conference,automating physical database design in a parallel database,2002
488,"j boulos , k ono",sigmod record,cost estimation of user-defined methods in object-relational database systems,1999
489,c aggarwal,sigmod conference,"hierarchical subspace sampling : a unified framework for high dimensional data reduction , selectivity estimation and nearest neighbor search",2002
490,"a rosenthal , e sciore",sigmod record,first-class views : a key to user-centered computing,1999
491,"y sismanis , a deligiannakis , n roussopoulos , y kotidis",sigmod conference,dwarf : shrinking the petacube,2002
492,"p ram , l do , p drew",sigmod record,distributed transactions in practice,1999
493,"s chaudhuri , a gupta , v narasayya",sigmod conference,compressing sql workloads,2002
494,"m papiani , j wason , a dunlop , d nicole",sigmod record,"a distributed scientific data archive using the web , xml and sql/med",1999
495,"s bhattacharya , c mohan , k brannon , i narang , h hsiao , m subramanian",sigmod conference,coordinating backup/recovery and data consistency between database and file systems,2002
496,,,report on ngits ' 99 : the 4th international workshop on next generation information technologies and systems,1999
