paper_id,creator_names,conf_abbrev,article_title,publication_yr
497,"y moon , k whang , w han",sigmod conference,general match : a subsequence matching method in time-series databases based on generalized windows,2002
498,"h wang , w wang , j yang , p yu",sigmod conference,clustering by pattern similarity in large data sets,2002
499,"e hanson , l noronha",sigmod record,timer-driven database triggers and alerters : semantics and a challenge,1999
500,l libkin,sigmod record,"some remarks on variable independence , closure , and orthographic dimension in constraint databases",1999
501,"c procopiuc , m jones , p agarwal , t murali",sigmod conference,a monte carlo algorithm for fast projective clustering,2002
502,"n thaper , s guha , p indyk , n koudas",sigmod conference,dynamic multidimensional histograms,2002
503,l libkin,sigmod record,database principles column - introduction,1999
504,"n bruno , s chaudhuri",sigmod conference,exploiting statistics on query expressions for optimization,2002
505,s abiteboul,sigmod record,on views and xml,1999
506,p ramanan,sigmod conference,efficient algorithms for minimizing tree pattern queries,2002
507,,,reminiscences on influential papers,1999
508,"a vries , n mamoulis , n nes , m kersten",sigmod conference,efficient k-nn search on vertically decomposed data,2002
509,"r musick , t critchlow",sigmod record,practical lessons in supporting large-scale computational science,1999
510,"l gao , x wang",sigmod conference,continually evaluating similarity-based pattern queries on a streaming time series,2002
511,"a eisenberg , j melton",sigmod record,sqlj-part 1 : sql routines using the java programming language,1999
512,"a datta , k dutta , h thomas , d vandermeer , s suresha , k ramamritham",sigmod conference,proxy-based acceleration of dynamically generated content on the world wide web : an approach and implementation,2002
513,"j mchugh , j widom",sigmod record,integrating dynamically-fetched external information into a dbms for semistructured data,1997
514,"p atzeni , g mecca , p merialdo",sigmod record,semistructured und structured data in the web : going back and forth,1997
515,"a dobra , m garofalakis , j gehrke , r rastogi",sigmod conference,processing complex aggregate queries over data streams,2002
516,"s chen , p gibbons , t mowry , g valentin",sigmod conference,fractal prefetching bбtrees : optimizing both cache and disk performance,2002
517,,,intelligent access to heterogeneous information sources : report on the 4th workshop on knowledge representation meets databases,1997
518,"j zhou , k ross",sigmod conference,implementing database operations using simd instructions,2002
519,"s nestorov , s abiteboul , r motwani",sigmod record,infering structure in semistructured data,1997
520,,,chair 's message,1997
521,"j freire , j haritsa , m ramanath , p roy , j simщon",sigmod conference,statix : making xml count,2002
522,"r nado , s huffman",sigmod record,extracting entity profiles from semistructured information spaces,1997
