paper_id,creator_names,conf_abbrev,article_title,publication_yr
0,"m rusinkiewicz , w klas , t tesch , j wфsch , p muth",vldb,towards a cooperative transaction model - the cooperative activity model,1995
1,"a eisenberg , j melton",sigmod record,sql/xml is making good progress,2002
2,"p ammann , s jajodia , i ray",vldb,using formal methods to reason about semantics-based decompositions of transactions,1995
3,l liu,sigmod record,editor 's notes,2002
4,,,report on the acm fourth international workshop on data warehousing and olap ( dolap 2001 ),2002
5,"f ferrandina , t meyer , r zicari , g ferran , j madec",vldb,schema and database evolution in the o2 object database system,1995
6,"k subieta , y kambayashi , j leszczylowski",vldb,procedures in object-oriented query languages,1995
7,"r barga , d lomet",sigmod record,phoenix project : fault-tolerant applications,2002
8,,,mining the world wide web : an information search approach - book review,2002
9,"f moser , a kraiss , w klas",vldb,l/mrp : a buffer management strategy for interactive continuous data flows in a multimedia dbms,1995
10,,,report on the nsf workshop on building an infrastructure for mobile and wireless systems,2002
11,"s chaudhuri , s ghandeharizadeh , c shahabi",vldb,retrieval of composite multimedia objects,1995
12,h kosch,sigmod record,mpeg-7 and multimedia database systems,2002
13,"h lu , k tan , s dao",vldb,the fittest survives : an adaptive approach to query optimization,1995
14,,,reminiscences on influential papers,2002
15,"m tresch , n palmer , a luniewski",vldb,type classification of semi-structured documents,1995
16,j geller,sigmod record,data mining : practical machine learning tools and techniques - book review,2002
17,"m mehta , d dewitt",vldb,managing intra-operator parallelism in parallel database systems,1995
18,"a caplinskas , j eder , o vasilecas",sigmod record,advances in databases and information systems ( adbis ),2002
19,"r srikant , r agrawal",vldb,mining generalized association rules,1995
20,"p haas , j naughton , s seshadri , l stokes",vldb,sampling-based estimation of the number of distinct values of an attribute,1995
21,k aberer,sigmod record,book review column,2002
22,"s flodin , t risch",vldb,processing object-oriented queries with invertible late bound functions,1995
23,a kemper,sigmod record,databases and transaction processing : an application-oriented approach - book review,2002
24,"s hvasshovd , и torbjјrnsen , s bratsberg , p holager",vldb,"the clustra telecom database : high availability , high throughput , and real-time response",1995
25,h kim,sigmod record,conceptual modeling and specification generation for b2b business process based on ebxml,2002
26,"h lu , r setiono , h liu",vldb,neurorule : a connectionist approach to data mining,1995
27,"r erdur , o dikenelli",sigmod record,a multi-agent system infrastructure for software component market-place : an ontological perspective,2002
28,"r gallersdіrfer , m nicola",vldb,improving performance in replicated databases through relaxed coherency,1995
29,"m cilia , a buchmann",sigmod record,an active functionality service for e-business applications,2002
30,"w hќmmer , w lehner , h wedekind",sigmod record,contracting in the days of ebusiness,2002
31,"d lomet , m tuttle",vldb,redo recovery after system crashes,1995
32,y wang,vldb,db2 query parallelism : staging and implementation,1995
33,m winslett,ecord,david dewitt speaks out,2002
34,"k sumiya , k yasutake , h tanaka , n sanada , y imai",vldb,a product specification database for visual prototyping,1995
35,r camps,sigmod record,from ternary relationship to relational tables : a case against common beliefs,2002
36,"t didriksen , c galindo-legaria , e dahle",vldb,database de-centralization - a practical approach,1995
37,"m halkidi , y batistakis , m vazirgiannis",sigmod record,cluster validity methods : part i,2002
38,"e pourabbas , m rafanelli",sigmod record,a pictorial query language for querying geographic databases using positional and olap operators,2002
39,"e hoel , h samet",vldb,benchmarking spatial join operations with spatial output,1995
40,"g slivinskas , c jensen , r snodgrass",sigmod record,bringing order to query optimization,2002
41,"p brown , m stonebraker",vldb,bigsur : a system for the management of earth science data,1995
42,l liu,sigmod record,editor 's notes,2002
43,"h leslie , r jain , d birdsall , h yaghmai",vldb,efficient search of multi-dimensional b-trees,1995
44,"i cruz , a khokhar , b liu , a sistla , o wolfson , c yu",sigmod record,research activities in database management and information retrieval at the university of illinois at chicago,2002
45,"j orenstein , d kamber",vldb,accessing a relational database through an object-oriented database interface,1995
46,,,interviewing during a tight job market,2002
47,b lindsay,vldb,"db2 common server : technology , progress , & directions",1995
48,n wiegand,sigmod record,investigating xquery for querying across database object types,2002
49,"d konopnicki , o shmueli",vldb,w3qs : a query system for the world-wide web,1995
50,"r orlandic , j lukaszuk , c swietlik",sigmod record,the design of a retrieval technique for high-dimensional data on tertiary storage,2002
51,"j wiener , j naughton",vldb,oodb bulk loading revisited : the partitioned-list approach,1995
52,,,chair 's message,2002
53,h korth,vldb,the double life of the transaction abstraction : fundamental principle and evolving system concept,1995
54,r fagin,sigmod record,combining fuzzy information : an overview,2002
55,"a reuter , s ceri , j gray , b salzberg , g weikum",vldb,databases and workflow management : what is it all about ? ( panel ),1995
56,"b goyal , j haritsa , s seshadri , v srinivasan",vldb,index concurrency control in firm real-time database systems,1995
57,"a laender , b ribeiro-neto , a silva , j teixeira",sigmod record,a brief survey of web data extraction tools,2002
58,"a bestavros , s braoudakis",vldb,value-cognizant speculative concurrency control,1995
59,f goethals,sigmod record,data warehousing and business intelligence for e-commerce - book review,2002
60,"f galiano , n marэn",sigmod record,data mining : concepts and techniques - book review,2002
61,"k wu , p yu , j chung , j teng",vldb,a performance study of workfile disk management for concurrent mergesorts in a multiprocessor database system,1995
62,"k mogi , m kitsuregawa",vldb,hot block clustering for disk arrays with dynamic striping,1995
63,k aberer,sigmod record,book review column,2002
64,r snodgrass,sigmod record,tods perceptions and misconceptions,2002
65,"d jonscher , k dittrich",vldb,an approach for building secure database federations,1994
66,"y yao , j gehrke",sigmod record,the cougar approach to in-network query processing in sensor networks,2002
67,"h jagadish , d lieuwen , r rastogi , a silberschatz , s sudarshan",vldb,dalэ : a high performance main memory storage manager,1994
68,,,introduction to constraint databases - book review,2002
69,"c galindo-legaria , a pellenkoft , m kersten",vldb,"fast , randomized join-order selection - why use transformations ?",1994
70,,,foundations of statistical natural language processing - book review,2002
71,"j wiener , j naughton",vldb,bulk loading into an oodb : a performance study,1994
72,"r ng , j han",vldb,efficient and effective clustering methods for spatial data mining,1994
73,f neven,sigmod record,automata theory for xml researchers,2002
74,"m winslett , k chang , a doan , j han , c zhai , y zhou",sigmod record,database research at the university of illinois at urbana-champaign,2002
75,"e brown , j callan , w croft",vldb,fast incremental indexing for full-text information retrieval,1994
76,,,chair 's message,2002
77,"a fu , d cheung",vldb,a transaction replication scheme for a replicated database with node autonomy,1994
78,,,treasurer 's message,2002
79,"m ouzzani , m atroun , n belkhodja",vldb,a top-down approach for two level serializability,1994
80,"j frohn , g lausen , h uphoff",vldb,access to objects by path expressions and rules,1994
81,,,report on the mobile search workshop at www 2002,2002
82,r gќting,vldb,graphdb : modeling and querying graphs in databases,1994
83,,,report on the web dynamics workshop at www 2002,2002
84,,,report on the 24th european colloquium on information retrieval research,2002
85,"a gutiщrrez , p pucheral , h steffen , j thщvenin",vldb,database graph views : a practical model to manage persistent graphs,1994
86,"a kemper , d kossmann",vldb,dual-buffering strategies in object bases,1994
87,"j melton , j michels , v josifovski , k kulkarni , p schwarz",sigmod record,sql/med - a status report,2002
88,m winslett,,hector garcia-molina speaks out,2002
89,"t johnson , d shasha",vldb,2q : a low overhead high performance buffer management replacement algorithm,1994
90,"m barja , n paton , a fernandes , m williams , a dinn",vldb,an effective deductive object-oriented database through language integration,1994
91,"s lightstone , g lohman , d zilio",sigmod record,toward autonomic computing with db2 universal database,2002
92,,,reminiscences on influential papers,2002
93,"e baralis , j widom",vldb,an algebraic approach to rule analysis in expert database systems,1994
94,,,report on the semantic web workshop at www 2002,2002
95,"r agrawal , r srikant",vldb,fast algorithms for mining association rules in large databases,1994
96,,,ontologies : a silver bullet for knowledge management and electronic commerce - book review,2002
97,"e haber , y ioannidis , m livny",vldb,opossum : desk-top schema management through customizable visualization,1995
98,"c goble , d roure",sigmod record,the grid : an application of the semantic web,2002
99,"r agrawal , g psaila , e wimmers , m zaяt",vldb,querying shapes of histories,1995
100,,,interview with david maier,2002
101,"g evangelidis , d lomet , b salzberg",vldb,"the hbp-tree : a modified hb-tree supporting concurrency , recovery and node consolidation",1995
102,,,small worlds : the dynamics of networks between order and randomness - book review,2002
103,"c kalus , p dadam",vldb,flexible relations - operational support of variant relational structures,1995
104,s sarawagi,vldb,query processing in tertiary memory databases,1995
105,"t finin , a joshi",sigmod record,"agents , turst , and information access on the semantic web",2002
106,"y sure , s staab , r studer",sigmod record,methodology for development and employment of ontology based knowledge management applications,2002
107,s brin,vldb,near neighbor search in large metric spaces,1995
108,"r ramakrishnan , h garcia-molina , g rossbach , a silberschatz , g wiederhold , j zijlstra",vldb,scientific journals : extinction or explosion ? ( panel ),1995
109,h jagadish,sigmod record,acm-sigmod digital review,2000
110,"d buttler , m coleman , t critchlow , r fileto , w han , l liu , c pu , d rocco , l xiong",sigmod record,querying multiple bioinformatics data sources : can semantic web research help ?,2002
111,"k anyanwu , a sheth",sigmod record,the p operator : discovering and ranking associations on the semantic web,2002
112,"a sistla , c yu , c liu , k liu",vldb,similarity based retrieval of pictures using indices on spatial relationships,1995
113,"m halkidi , y batistakis , m vazirgiannis",sigmod record,clustering validity checking methods : part ii,2002
114,a meier,vldb,providing database migration tools - a practicioner 's approach,1995
115,l liu,sigmod record,editor 's notes,2002
116,"l seligman , n belkin , e neuhold , m stonebraker , g wiederhold",vldb,metrics for accessing heterogeneous data : is there any hope ? ( panel ),1995
117,d vaskevitch,vldb,"very large databases : how large , how different ?",1995
118,k aberer,sigmod record,book review column,2002
119,"s huang , i kwan , c li",sigmod record,a study on the management of semantic transaction for efficient data retrieval,2002
120,"e simon , a dittrich",vldb,promises and realities of active database systems,1995
121,"j catozzi , s rabinovici",vldb,os support for vldbs : unix enhancements for the teradata data base,1995
122,,,reminiscences on influential papers,2002
123,m grohe,sigmod record,parameterized complexity for the database theorist,2002
124,g fecteau,vldb,managing a db2 parallel edition database,1995
125,"m roantree , a smeaton",sigmod record,research in information managment at dublin city university,2002
126,g hallmark,vldb,the oracle warehouse,1995
127,h spintzik,vldb,informix-online xps : a dynamically scalable rdbms for open parallel platforms,1995
128,,,report on the edbt '02 panel on scientific data integration,2002
129,"e amiel , m bellosta , e dujardin , e simon",vldb,supporting exceptions to schema consistency to ease schema evolution in oodbms,1994
130,"w han , d buttler , c pu",sigmod record,wrapping web data into xml,2001
131,d suciu,sigmod record,on database theory and xml,2001
132,"c collet , t coupaye , t svensen",vldb,naos - efficient and modular reactive capabilities in an object-oriented database system,1994
133,p fankhauser,sigmod record,xquery formal semantics : state and challenges,2001
134,"k brown , m mehta , m carey , m livny",vldb,towards automated performance tuning for complex workloads,1994
135,"a schmidt , f waas , m kersten , d florescu , m carey , i manolescu , r busse",sigmod record,why and how to benchmark xml databases,2001
136,"a levy , i mumick , y sagiv",vldb,query optimization by predicate move-around,1994
137,d lomet,sigmod record,the evolution of effective b-tree : page organization and techniques : a personal account,2001
138,"w hasan , r motwani",vldb,optimization algorithms for exploiting the parallelism-communication tradeoff in pipelined parallelism,1994
139,"a tanaka , p valduriez",sigmod record,the ecobase project : database and web technologies for environmental information systems,2001
140,"m mohania , n sarda",vldb,some issues in design of distributed deductive databases,1994
141,"w li , c clifton",vldb,semantic integration in heterogeneous databases using neural networks,1994
142,"s chien , v tsotras , c zaniolo",sigmod record,xml document versioning,2001
143,"n idris , w gray , r churchhouse",vldb,providing dynamic security control in a federated database,1994
144,"b ludфscher , r marciano , r moore",sigmod record,"preservation of digital data with self-validating , self-instantiating knowledge-based archives",2001
145,,,"semantic web workshop : models , architectures and management",2001
146,"f ferrandina , t meyer , r zicari",vldb,implementing lazy database updates for an object database system,1994
147,"m teisseire , p poncelet , r cicchetti",vldb,towards event-driven modelling for database design,1994
148,,,reminiscences on influential papers,2001
149,,,"jeffrey d. ullman speaks out on the future of higher education , startups , database theory , and more",2001
150,"v setzer , a zisman",vldb,new concurrency control algorithms for accessing and compacting b-trees,1994
151,"n gehani , h jagadish , w roome",vldb,odefs : a file system interface to an object-oriented database,1994
152,,,report on the 2001 sigmod and pods awards,2001
153,"p buneman , w fan , j simщon , s weinstein",sigmod record,constraints for semi-structured data and xml,2001
154,"c kilger , g moerkotte",vldb,indexing multiple sets,1994
155,,,editor 's notes,2001
156,"b sreenath , s seshadri",vldb,the hcc-tree : an efficient index structure for object oriented databases,1994
157,"e hoel , h samet",vldb,performance of data-parallel spatial operations,1994
158,"a eisenberg , j melton",sigmod record,sql/xml and the sqlx informal group of companies,2001
159,"c biancheri , j pazzaglia , g paddeu",sigmod record,eiha ?!? : deploying web and wap services using xml technology,2001
160,"t brinkhoff , h kriegel",vldb,the impact of global clustering on spatial database systems,1994
161,"m shah , s madden , m franklin , j hellerstein",sigmod record,java support for data-intensive systems : experiences building the telegraph dataflow system,2001
162,"a muntz , c ramiller",vldb,a requirement-based approach to data modeling and re-engineering,1994
163,"j melton , a eisenberg",sigmod record,sql multimedia and application packages ( sql/mm ),2001
164,"h steenhagen , p apers , h blanken , r by",vldb,from nested-loop to join queries in oodb,1994
165,"d gunopulos , n koudas",sigmod record,dimacs summer school tutorial on new frontiers in data mining,2001
166,"s chakravarthy , v krishnaprasad , e anwar , s kim",vldb,"composite events for active databases : semantics , contexts and detection",1994
167,,,report on the 8th international workshop on knowledge representation meets databases ( krdb ),2001
168,"b жzden , a biliris , r rastogi , a silberschatz",vldb,a low-cost storage server for movie on demand databases,1994
169,l liu,sigmod record,editor 's notes,2001
170,t chiueh,vldb,content-based image indexing,1994
171,"d dewitt , n kabra , j luo , j patel , j yu",vldb,client-server paradise,1994
172,"a sheth , j miller , k kochut , i arpinar",sigmod record,research in multi-organizational processes and semantic information brokering at the lsdis lab,2001
173,u чetintemel,sigmod record,on the academic interview circuit : an end-to-end discussion,2001
174,"s sripada , b wќthrich",vldb,cumulative updates,1994
175,"a shatdal , c kant , j naughton",vldb,cache conscious algorithms for relational query processing,1994
176,a labrinidis,sigmod record,introduction to the career forum column,2001
177,"a levy , a silberschatz , d srivastava , m zemankova",vldb,challenges for global information systems,1994
178,"s babu , j widom",sigmod record,continuous queries over data streams,2001
179,n huyn,sigmod record,data analysis and mining in the life sciences,2001
180,"n goodman , s rozen , l stein",vldb,building a laboratory information system around a c++ - based object-oriented dbms,1994
181,"m cochinwala , j bradley",vldb,a multidatabase system for tracking and retrieval of financial data,1994
182,"j shanmugasundaram , e shekita , j kiernan , r krishnamurthy , s viglas , j naughton , i tatarinov",sigmod record,a general techniques for querying xml documents using a relational database system,2001
183,"p bernstein , u dayal",vldb,an overview of repository technology,1994
184,k aberer,sigmod record,advanced xml data processing - guest editor 's introduction,2001
185,"b iyer , d wilhite",vldb,data compression support in databases,1994
186,r snodgrass,sigmod record,accessibility of the database literature,2001
187,,,treasurer 's message,2001
188,"s anand , d bell , j hughes",vldb,an empirical performance study of the ingres search accelerator for a large property management database system,1994
189,,,chair 's message,2001
190,"a rosenthal , l seligman",vldb,data integration in the large : the challenge of reuse,1994
191,"a labrinidis , a mendelzon",sigmod record,career-enhancing services at sigmod online,2001
192,m lesk,vldb,experiments on access to digital libraries : how can images and text be used together,1994
193,p bernstein,vldb,pc database systems - present and future,1994
194,l liu,sigmod record,editor 's notes,2001
195,"s stolfo , w lee , p chan , w fan , e eskin",sigmod record,data mining-based intrusion detectors : an overview of the columbia ids project,2001
196,"b babcock , c olston",sigmod conference,distributed top-k monitoring,2003
197,"a das , j gehrke , m riedewald",sigmod conference,approximate join processing over data streams,2003
198,"d barbarс , j couto , s jajodia , n wu",sigmod record,adam : a testbed for exploring the use of data mining in intrusion detection,2001
199,"j cabrera , l lewis , r mehra",sigmod record,detection and classification of intrusions and faults using sequences of system calls,2001
200,"w wang , h jiang , h lu , j yu",sigmod conference,containment join size estimation : models and methods,2003
201,"b martin , r cattell",vldb,relating distributed objects,1994
202,k aberer,sigmod record,book review column,2001
203,"t yan , j annevelink",vldb,integrating a structured-text retrieval system with an object-oriented database system,1994
204,l cardelli,sigmod record,describing semistructured data,2001
205,,,chair 's message,2001
206,s spaccapietra,vldb,user interfaces ; who cares ?,1994
207,,,special issue on data mining for intrusion detection and threat analysis - guest editor 's introduction,2001
208,"m zemankova , y ioannidis",vldb,scientific databases - state of the art and future directions,1994
209,"w lee , w fan",sigmod record,mining system audit data : opportunities and challenges,2001
210,"r fagin , r kumar , d sivakumar",sigmod conference,efficient similarity search and classification via rank aggregation,2003
211,"y saygin , v verykios , c clifton",sigmod record,using unknowns to prevent discovery of association rules,2001
212,"a arasu , h garcia-molina",sigmod conference,extracting structured data from web pages,2003
213,"s chaudhuri , p ganesan , s sarawagi",sigmod conference,factorizing complex predicates in queries to exploit indexes,2003
214,"o vel , a anderson , m corney , g mohay",sigmod record,mining email content for author identification forensics,2001
215,,,transactional information systems - book review,2001
216,"i ilyas , j rao , g lohman , d gao , e lin",sigmod conference,estimating compilation time of a query optimizer,2003
217,"a deligiannakis , n roussopoulos",sigmod conference,extended wavelets for multiple measures,2003
218,,,information warfare and security - book review,2001
219,,,treasurer 's message,2000
220,,,"gio wiederhold speaks out on moving into academia in mid-career , how to be an effective consultant , why you should be a program manager as a funding agency , the need for ontology algebra and simulations , and more",2001
221,"b babcock , s babu , m datar , r motwani",sigmod conference,chain : operator scheduling for memory minimization in data stream systems,2003
222,"g lohman , c galindo-legaria , m franklin , l seligman",sigmod record,sigmod 2001 industry sessions,2001
223,"m benedikt , c chan , w fan , j freire , r rastogi",sigmod conference,capturing both types and constraints in data integration,2003
224,,,reminiscences on influential papers,2001
225,"t milo , s abiteboul , b amann , o benjelloun , f ngoc",sigmod conference,exchanging intensional xml data,2003
226,"o tsatalos , m solomon , y ioannidis",vldb,the gmap : a versatile tool for physical data independence,1994
227,"f tian , d dewitt , j chen , c zhang",sigmod record,the design and performance evaluation of alternative xml storage strategies,2002
228,,,guest editor 's introduction,2002
229,"s chaudhuri , k shim",vldb,including group-by in query optimization,1994
230,"f matthes , j schmidt",vldb,persistent threads,1994
231,"r sommer , t gulledge , d bailey",sigmod record,the n-tier hub technology,2002
232,i cingil,sigmod record,supporting global user profiles through trusted authorities,2002
233,"d davison , g graefe",vldb,memory-contention responsive hash joins,1994
234,"c quix , m schoop , m jeusfeld",sigmod record,business data management for b2b electronic commerce,2002
235,"m mediano , m casanova , m dreux",vldb,v-trees - a storage method for long vector data,1994
236,"t gaasterland , j lobo",vldb,qualified answers that reflect user needs and preferences,1994
237,"z cui , d jones , p o'brien",sigmod record,semantic b2b integration : issues in ontology-based applications,2002
238,"w litwin , m neimat , d schneider",vldb,rp * : a family of order preserving scalable distributed data structures,1994
239,c bussler,sigmod record,the role of b2b engines in b2b integration architectures,2002
240,"m ball , m ma , l raschid , z zhao",sigmod record,supply chain infrastructures : system integration and information sharing,2002
241,"s chawathe , m chen , p yu",vldb,on index selection schemes for nested object hierarchies,1994
242,,,interview with avi silberschatz,2002
243,"a sistla , c yu , r haddad",vldb,reasoning about spatial relationships in picture retrieval systems,1994
244,,,what will be - book review,2002
245,"h lu , b ooi , k tan",vldb,on spatially partitioned temporal join,1994
246,"r hjelsvold , r midtstraum",vldb,modelling and querying video data,1994
247,m stonebraker,sigmod record,too much middleware,2002
248,"a pirotte , e zimсnyi , d massart , t yakusheva",vldb,materialization : a powerful and ubiquitous abstraction pattern,1994
249,d suciu,sigmod record,the xml typechecking problem,2002
250,,,report on the 18th british national conference on databases ( bncod ),2002
251,"r ng , j yang",vldb,maximizing buffer and disk utilizations for news on-demand,1994
252,,,reminiscences on influential papers,2002
253,"a poulovassilis , c small",vldb,investigation of algebraic query optimisation techniques for database programming languages,1994
254,"z xie , j han",vldb,join index hierarchies for supporting efficient navigations in object-oriented databases,1994
255,n elderini,,letter to sigmod record editor,2002
256,"i kamel , c faloutsos",vldb,hilbert r-tree : an improved r-tree using fractals,1994
257,r snodgrass,sigmod record,why i like working in academia,2002
258,"p vassiliadis , t sellis",sigmod record,a survey of logical models for olap databases,1999
259,"l lakshmanan , j pei , y zhao",sigmod conference,qc-trees : an efficient summary structure for semantic olap,2003
260,"k jacob , d shasha",sigmod record,fintime - a financial time series benchmark,1999
261,"a witkowski , s bellamkonda , t bozkaya , g dorman , n folkert , a gupta , l sheng , s subramanian",sigmod conference,spreadsheets in rdbms for olap,2003
262,"l guo , f shao , c botev , j shanmugasundaram",sigmod conference,xrank : ranked keyword search over xml documents,2003
263,"t kempster , c stirling , p thanisch",sigmod record,diluting acid,1999
264,"s al-khalifa , c yu , h jagadish",sigmod conference,querying structured text in an xml database,2003
