unique_id,pub_title,publication_venue,authors_list,year_published
2040,xcerpt and visxcerpt : from pattern-based to visual querying of xml and semistructured data,vldb,"s berger , f bry , s schaffert , c wieser",2003
2041,illuminating the dark side of web services,vldb,m brodie,2003
2042,who needs xml databases ?,vldb,s cluet,2003
2043,a database striptease or how to manage your personal databases,vldb,"m kersten , g weikum , m franklin , d keim , a buchmann , s chaudhuri",2003
2044,the zero-delay data warehouse : mobilizing heterogeneous databases,vldb,e kќhn,2003
2045,commercial use of database technology,vldb,h schіning,2003
2046,grid and applications ( industrial session ),vldb,f leymann,2003
2047,web services ( industrial session ),vldb,f cabrera,2003
2048,privacy-enhanced data management for next-generation e-commerce,,,2003
2049,the semantic web : semantics for data on the web,,,2003
2050,irisnet : an architecture for internet-scale sensing services,vldb,"s nath , a deshpande , y ke , p gibbons , b karp , s seshan",2003
2051,"large-scale , standards-based earth observation imagery and web mapping services",vldb,p baumann,2003
2052,quiet : continuous query-driven index tuning,vldb,"k sattler , i geist , e schallehn",2003
2053,chip-secured data access : reconciling access rights with data encryption,vldb,"l bouganim , f ngoc , p pucheral , l wu",2003
2054,an interpolated volume data model,vldb,"t wang , s santini , a gupta",2003
2055,efficacious data cube exploration by semantic summarization and compression,vldb,"l lakshmanan , j pei , y zhao",2003
2056,atlas : a small but complete sql extension for data mining and data streams,vldb,"h wang , c zaniolo , c luo",2003
2057,business modelling using sql spreadsheets,vldb,"a witkowski , s bellamkonda , t bozkaya , n folkert , a gupta , l sheng , s subramanian",2003
2058,from focused crawling to expert information : an application framework for web exploration and portal generation,vldb,"s sizov , j graupmann , m theobald",2003
2059,cacheportal ii : acceleration of very large scale data center-hosted database-driven web applications,vldb,"w li , o po , w hsiung , k candan , d agrawal , y akca , k taniguchi",2003
2060,bibfinder/statminer : effectively mining and using coverage and overlap statistics in data integration,vldb,"z nie , s kambhampati , t hernandez",2003
2061,s-topss : semantic toronto publish/subscribe system,vldb,"m petrovic , i burcea , h jacobsen",2003
2062,"nexusscout : an advanced location-based application on a distributed , open mediation platform",vldb,"d nicklas , m groпmann , t schwarz",2003
2063,schema-driven customization of web services,vldb,"s abiteboul , b amann , j baumgarten , o benjelloun , f ngoc , t milo",2003
2064,integrating information for on demand computing,vldb,n mattos,2003
2065,a nanotechnology-based approach to data storage,vldb,"e eleftheriou , p bфchtold , g cherubini , a dholakia , c hagleitner , t loeliger , a pantazi , h pozidis , t albrecht , g binnig , m despont , u drechsler , u dќrig , b gotsmann , d jubin , w hфberle , m lantz , h rothuizen , r stutz , p vettiger , d wiesmann",2003
2066,the history of histograms ( abridged ),vldb,y ioannidis,2003
2067,the data-centric revolution in networking,vldb,s shenker,2003
2068,xsearch : a semantic search engine for xml,vldb,"s cohen , j mamou , y kanza , y sagiv",2003
2069,complex queries over web repositories,vldb,"s raghavan , h garcia-molina",2003
2070,efficient mining of xml query patterns for caching,vldb,"l yang , m lee , w hsu",2003
2071,an efficient and resilient approach to filtering and disseminating streaming data,vldb,"s shah , s dharmarajan , k ramamritham",2003
2072,phrase matching in xml,vldb,"s amer-yahia , m fernandez , d srivastava , y xu",2003
2073,rrxf : redundancy reducing xml storage in relations,vldb,"y chen , s davidson , c hara , y zheng",2003
2074,mars : a system for publishing xml from mixed and redundant storage,vldb,"a deutsch , v tannen",2003
2075,projecting xml documents,vldb,"a marian , j simщon",2003
2076,mixed mode xml query processing,vldb,"a halverson , j burger , l galanis , a kini , r krishnamurthy , a rao , f tian , s viglas , y wang , j naughton , d dewitt",2003
2077,from tree patterns to generalized tree patterns : on efficient evaluation of xquery,vldb,"z chen , h jagadish , l lakshmanan , s paparizos",2003
2078,efficient processing of expressive node-selecting queries on xml data in secondary storage : a tree automata-based approach,vldb,c koch,2003
2079,query processing for high-volume xml message brokering,vldb,"y diao , m franklin",2003
2080,a framework for clustering evolving data streams,vldb,"c aggarwal , j han , j wang , p yu",2003
2081,a regression-based temporal pattern mining scheme for data streams,vldb,"w teng , m chen , p yu",2003
2082,on the costs of multilingualism in database systems,vldb,"a kumaran , j haritsa",2003
2083,distributed top-n query processing with possibly uncooperative local systems,vldb,"c yu , g philip , w meng",2003
2084,optimized query execution in large search engines with global page ordering,vldb,"x long , t suel",2003
2085,path queries on compressed xml,vldb,"p buneman , m grohe , c koch",2003
2086,on the minimization of xpath queries,vldb,"s flesca , f furfaro , e masciari",2003
2087,covering indexes for xml queries : bisimulation - simulation = negation,vldb,p ramanan,2003
2088,buffering accesses to memory-resident index structures,vldb,"j zhou , k ross",2003
2089,balancing performance and data freshness in web database servers,vldb,"a labrinidis , n roussopoulos",2003
2090,vipas : virtual link powered authority search in the web,vldb,"c lin , m chen",2003
2091,sash : a self-adaptive histogram set for dynamically changing workloads,vldb,"l lim , m wang , j vitter",2003
