unique_id,pub_title,publication_venue,authors_list,year_published
1803,the impress ddt : a database design toolbox based on a formal specification language,sigmod conference,"j flokstra , m keulen , j skowronek",1994
1804,clustering techniques for minimizing external path length,vldb,"a diwan , s rane , s seshadri , s sudarshan",1996
1805,the medusa project : autonomous data management in a shared-nothing parallel database machine,sigmod conference,"g bryan , w moore , b curry , k lodge , j geyer",1994
1806,enterprise information architectures -- they 're finally changing,sigmod conference,w melling,1994
1807,fast nearest neighbor search in medical image databases,vldb,"f korn , n sidiropoulos , c faloutsos , e siegel , z protopapas",1996
1808,relaxed transaction processing,sigmod conference,"m singh , c tomlinson , d woelk",1994
1809,applying data mining techniques to a health insurance information system,vldb,"m viveros , j nearhos , m rothman",1996
1810,oracle 's symmetric replication technology and implications for application design,sigmod conference,"d daniels , l doo , a downing , c elsbernd , g hallmark , s jain , b jenkins , p lim , g smith , b souder , j stamos",1994
1811,coalescing in temporal databases,vldb,"m bіhlen , r snodgrass , m soo",1996
1812,sybase replication server,sigmod conference,"a gorelik , y wang , m deppe",1994
1813,effective & efficient document ranking without using a large lexicon,vldb,y ogawa,1996
1814,xsb as an efficient deductive database engine,sigmod conference,"k sagonas , t swift , d warren",1994
1815,a new sql-like operator for mining association rules,vldb,"r meo , g psaila , s ceri",1996
1816,parallel database systems in the 1990 's,sigmod conference,m carey,1994
1817,constructing efficient decision trees by using optimized numeric association rules,vldb,"t fukuda , y morimoto , s morishita , t tokuyama",1996
1818,odmg-93 : a standard for object-oriented dbmss,sigmod conference,r cattell,1994
1819,efficient snapshot differential algorithms for data warehousing,vldb,"w labio , h garcia-molina",1996
1820,eroc : a toolkit for building neato query optimizers,vldb,"w mckenna , l burger , c hoang , m truong",1996
1821,unisql/x unified relational and object-oriented database system,sigmod conference,w kim,1994
1822,filter trees for managing spatial data over a range of size granularities,vldb,"k sevcik , n koudas",1996
1823,oracle media server : providing consumer based interactive access to multimedia data,sigmod conference,"a laursen , j olkin , m porter",1994
1824,object-oriented extensions in sql3 : a status report,sigmod conference,k kulkarni,1994
1825,analysis of n-dimensional quadtrees using the hausdorff fractal dimension,vldb,"c faloutsos , v gaede",1996
1826,the design and implementation of a sequence database system,vldb,"p seshadri , m livny , r ramakrishnan",1996
1827,editor 's notes,sigmod record,l liu,2003
1828,optimization of queries with user-defined predicates,vldb,"s chaudhuri , k shim",1996
1829,open object database management systems,,,1994
1830,incremental maintenance of externally materialized views,vldb,"m staudt , m jarke",1996
1831,the myriad federated database prototype,sigmod conference,"s hwang , e lim , h yang , s musukula , k mediratta , m ganesh , d clements , j stenoien , j srivastava",1994
1832,watchman : a data warehouse intelligent cache manager,vldb,"p scheuermann , j shim , r vingralek",1996
1833,dblearn : a system prototype for knowledge discovery in relational databases,sigmod conference,"j han , y fu , y huang , y cai , n cercone",1994
1834,the x-tree : an index structure for high-dimensional data,vldb,"s berchtold , d keim , h kriegel",1996
1835,an environmental sensor network to determine drinking water quality and security,sigmod record,"a ailamaki , c faloutsos , p fischbeck , m small , j vanbriesen",2003
1836,bluetooth-based sensor networks,sigmod record,"p bonnet , a beaufour , m dydensborg , m leopold",2003
1837,of objects and databases : a decade of turmoil,vldb,"m carey , d dewitt",1996
1838,developments at acm tods,sigmod record,r snodgrass,2003
1839,the changing landscape of the software industry and its implications for india,vldb,u gupta,1996
1840,the ores temporal database management system,sigmod conference,"b theodoulidis , a ait-braham , g andrianopoulos , j chaudhary , g karvelis , s sou",1994
1841,database management systems and the internet,vldb,s malaika,1996
1842,dwms : data warehouse management system,vldb,n mohan,1996
1843,ptool : a scalable persistent object manager,sigmod conference,"r grossman , x qin",1994
1844,disnic-plan : a nicnet based distributed database for micro-level planning in india,vldb,m moni,1996
1845,a language based multidatabase system,sigmod conference,"e kќhn , t tschernko , k schwarz",1994
1846,mosaico - a system for conceptual modeling and rapid prototyping of object-oriented database application,sigmod conference,"m missikoff , m toiati",1994
1847,bellcore 's adapt/x harness system for managing information on internet and intranets,vldb,a sheth,1996
1848,cache coherency in oracle parallel server,vldb,b klots,1996
1849,query by diagram : a graphical environment for querying databases,sigmod conference,"t catarci , g santucci",1994
1850,extracting large data sets using db2 parallel edition,vldb,s padmanabhan,1996
1851,quest : a project on database mining,sigmod conference,"r agrawal , m carey , c faloutsos , s ghosh , m houtsma , t imielinski , b iyer , a mahboob , h miranda , r srikant , a swami",1994
1852,metu object-oriented dbms,sigmod conference,"a dogac , i arpinar , c evrendilek , c ozkan , i altintas , i durusoy , m altinel , t okay , y saygin",1994
1853,further improvements on integrity constraint checking for stratifiable deductive databases,vldb,"s lee , t ling",1996
1854,estimation of query-result distribution and its application in parallel-join load balancing,vldb,"v poosala , y ioannidis",1996
1855,xsb as a deductive database,sigmod conference,"k sagonas , t swift , d warren",1994
1856,power efficient data gathering and aggregation in wireless sensor networks,sigmod record,"h tan , i korpeoglu",2003
1857,to weave the web,vldb,"p atzeni , g mecca , p merialdo",1997
1858,multimedia streaming in large-scale sensor networks with mobile swarms,sigmod record,"m gerla , k xu",2003
1859,using probabilistic information in data integration,vldb,"d florescu , d koller , a levy",1997
1860,reasoning on regular path queries,sigmod record,"d calvanese , g giacomo , m lenzerini , m vardi",2003
1861,on-demand data elevation in hierarchical multimedia storage servers,vldb,"p triantafillou , t papadakis",1997
1862,interview with pat selinger,,,2003
1863,principles of optimally placing data in tertiary storage libraries,vldb,"s christodoulakis , p triantafillou , f zioga",1997
1864,reminiscences on influential papers,,,2003
1865,materialized views selection in a multidimensional database,vldb,"e baralis , s paraboschi , e teniente",1997
1866,review of web caching and replication by michael rabinovich and oliver spatscheck . addison wesley 2002,,,2003
1867,parallel algorithms for high-dimensional similarity joins for data mining applications,vldb,"j shafer , r agrawal",1997
1868,sting : a statistical information grid approach to spatial data mining,vldb,"w wang , j yang , r muntz",1997
1869,"review of data on the web : from relational to semistructured data and xml by serge abiteboul , peter buneman , and dan suciu . morgan kaufmann 1999",,,2003
1870,"review of spatial databases with application to gis by philippe rigaux , michel scholl , and agnes voisard . morgan kaufmann 2002",,,2003
1871,merging ranks from heterogeneous internet sources,vldb,"l gravano , h garcia-molina",1997
1872,energy and rate based mac protocol for wireless sensor networks,sigmod record,"r kannan , r kalidindi , s iyengar , v kumar",2003
1873,the case for enhanced abstract data types,vldb,"p seshadri , m livny , r ramakrishnan",1997
1874,integrating reliable memory in databases,vldb,"w ng , p chen",1997
1875,distributed deviation detection in sensor networks,sigmod record,"t palpanas , d papadopoulos , v kalogeraki , d gunopulos",2003
1876,logical and physical versioning in main memory databases,vldb,"r rastogi , s seshadri , p bohannon , d leinbaugh , a silberschatz , s sudarshan",1997
1877,book review column,sigmod record,k aberer,2003
1878,sensor : the atomic computing particle,sigmod record,v kumar,2003
1879,using versions in update transactions : application to integrity checking,vldb,"f llirbat , e simon , d tombroff",1997
1880,incremental organization for data recording and warehousing,vldb,"h jagadish , p narayan , s seshadri , s sudarshan , r kanneganti",1997
1881,"the sensor spectrum : technology , trends , and requirements",sigmod record,"j hellerstein , w hong , s madden",2003
1882,understanding the semantics of sensor data,sigmod record,m mani,2003
1883,multiple-view self-maintenance in data warehousing environments,vldb,n huyn,1997
1884,recovering information from summary data,vldb,"c faloutsos , h jagadish , n sidiropoulos",1997
1885,managing uncertainty in sensor database,sigmod record,"r cheng , s prabhakar",2003
1886,implementing abstract objects with inheritance in datalogneg,vldb,h jamil,1997
1887,the cougar project : a work-in-progress report,sigmod record,"a demers , j gehrke , r rajaraman , a trigoni , y yao",2003
1888,dbglobe : a service-oriented p2p system for global computing,sigmod record,"e pitoura , s abiteboul , d pfoser , g samaras , m vazirgiannis",2003
1889,mining insurance data at swiss life,vldb,"j kietz , u reimer , m staudt",1997
1890,facilitating multimedia database exploration through visual interfaces and perpetual query reformulations,vldb,"w li , k candan , k hirata , y hara",1997
1891,toward network data independence,sigmod record,j hellerstein,2003
1892,design issues and challenges for rdf - and schema-based peer-to-peer systems,sigmod record,"w nejdl , w siberski , m sintek",2003
1893,treasurer 's message,,,2003
1894,the oracle universal server buffer,vldb,"w bridge , a joshi , m keihl , t lahiri , j loaiza , n macnaughton",1997
1895,chair 's message,,,2003
1896,"the network as a global database : challenges of interoperability , proactivity , interactiveness , legacy",vldb,"p lockemann , u kіlsch , a koschel , r kramer , r nikolai , m wallrath , h walter",1997
1897,selectivity estimation without the attribute value independence assumption,vldb,"v poosala , y ioannidis",1997
1898,journal relevance,sigmod record,r snodgrass,2003
1899,towards an odmg-compliant visual object query language,vldb,"m chavda , p wood",1997
1900,2003 sigmod innovations award speech,sigmod record,d chamberlin,2003
1901,guest editor 's introduction,,,2003
1902,integrating sql databases with content-specific search engines,vldb,"s deпloch , n mattos",1997
1903,resource scheduling in enhanced pay-per-view continuous media databases,vldb,"m garofalakis , b жzden , a silberschatz",1997
1904,learning about data integration challenges from day one,sigmod record,a halevy,2003
1905,spatial joins using r-trees : breadth-first traversal with global optimizations,vldb,"y huang , n jing , e rundensteiner",1997
1906,agent-oriented software engineering report on the 4th aose workshop ( aose 2003 ),,,2003
1907,the complexity of transformation-based join enumeration,vldb,"a pellenkoft , c galindo-legaria , m kersten",1997
1908,report on the 5th international workshop on the design and management of data warehouses ( dmdw ' 03 ),,,2003
1909,"using taxonomy , discriminants , and signatures for navigating in text databases",vldb,"s chakrabarti , b dom , r agrawal , p raghavan",1997
1910,information integration on the web : a view from ai and databases ( report on iiweb-03 ),sigmod record,"s kambhampati , c knoblock",2003
1911,report on fqas 2002 : fifth international conference on flexible query answering systems,,,2003
1912,m-tree : an efficient access method for similarity search in metric spaces,vldb,"p ciaccia , m patella , p zezula",1997
1913,optimizing queries across diverse data sources,vldb,"l haas , d kossmann , e wimmers , j yang",1997
1914,editor 's notes,sigmod record,l liu,2003
1915,vertical data migration in large near-line document archives based on markov-chain predictions,vldb,"a kraiss , g weikum",1997
1916,research in database engineering at the university of namur,sigmod record,j hainaut,2003
1917,exposing undergraduate students to database system internals,sigmod record,"a ailamaki , j hellerstein",2003
1918,parallel query scheduling and optimization with time - and space-shared resources,vldb,"m garofalakis , y ioannidis",1997
1919,analysis of sigmod 's co-authorship graph,sigmod record,"m nascimento , j sander , j pound",2003
1920,optimizing queries with universal quantification in object-oriented and object-relational databases,vldb,"j clauпen , a kemper , g moerkotte , k peithner",1997
1921,a performance evaluation of oid mapping techniques,vldb,"a eickler , c gerlhof , d kossmann",1995
1922,editor 's notes,sigmod record,l liu,2003
1923,efficient incremental garbage collection for client-server object database systems,vldb,"l amsaleg , m franklin , o gruber",1995
1924,closing the key loophole in mls databases,sigmod record,"n jukic , s nestorov , s vrbsky",2003
1925,report on the 4th international conference on mobile data management,,,2003
1926,document management as a database problem,vldb,r bayer,1995
1927,in memory of gэsli r. hjaltason,,,2003
1928,from vldb to vmldb ( very many large data bases ) : dealing with large-scale semantic heterogenity,vldb,s madnick,1995
1929,declustering databases on heterogeneous disk systems,vldb,"l chen , d rotem , s seshadri",1995
1930,standards for databases on the grid,sigmod record,"s malaika , a eisenberg , j melton",2003
1931,"review of the data warehouse toolkit : the complete guide to dimensional modeling ( 2nd edition ) by ralph kimball , margy ross . john wiley & sons , inc. 2002",,,2003
1932,high-concurrency locking in r-trees,vldb,"m kornacker , d banks",1995
1933,duplicate removal in information system dissemination,vldb,"t yan , h garcia-molina",1995
1934,interview with rakesh agrawal,,,2003
1935,reminiscences on influential papers,,,2003
1936,generalizing gloss to vector-space databases and broker hierarchies,vldb,"l gravano , h garcia-molina",1995
1937,in-context peer-to-peer information filtering on the web,sigmod record,a ouksel,2003
1938,tribeca : a stream database manager for network traffic analysis,vldb,m sullivan,1996
1939,selective information dissemination in p2p networks : problems and solutions,sigmod record,"m koubarakis , c tryfonopoulos , s idreos , y drougas",2003
1940,mineset ( tm ) : a system for high-end data mining and visualization,vldb,,1996
1941,the query optimizer in tandem 's new serverware sql product,vldb,p celis,1996
1942,the hyperion project : from data integration to data coordination,sigmod record,"m arenas , v kantere , a kementsietsidis , i kiringa , r miller , j mylopoulos",2003
1943,"tpc-d : the challenges , issues and results",vldb,r bhashyam,1996
1944,relational data sharing in peer-based data management systems,sigmod record,"b ooi , y shu , k tan",2003
1945,performance of future database systems : bottlenecks and bonananzas,vldb,c baru,1996
1946,what is the data warehousing problem ? ( are materialized views the answer ? ),vldb,"a gupta , i mumick",1996
1947,the piazza peer data management project,sigmod record,"i tatarinov , z ives , j madhavan , a halevy , d suciu , n dalvi , x dong , y kadiyska , g miklau , p mork",2003
1948,peer-to-peer research at stanford,sigmod record,"m bawa , b cooper , a crespo , n daswani , p ganesan , h garcia-molina , s kamvar , s marti , m schlosser , q sun , p vinograd , b yang",2003
1949,the structured information manager : a database system for sgml documents,vldb,r sacks-davis,1996
1950,loading the data warehouse across various parallel architectures,vldb,v raghavan,1996
1951,p-grid : a self-organizing structured p2p system,sigmod record,"k aberer , p cudrщ-mauroux , a datta , z despotovic , m hauswirth , m punceva , r schmidt",2003
1952,"report on the 10th conference on database systems for business , technology , and the web ( btw 2003 )",,,2003
1953,an efficient algorithm for mining association rules in large databases,vldb,"a savasere , e omiecinski , s navathe",1995
1954,discovery of multiple-level association rules from large databases,vldb,"j han , y fu",1995
1955,reminiscences on influential papers,,,2003
1956,a mapping mechanism to support bitmap index and other auxiliary structures on tables stored as primary b + - trees,sigmod record,"e chong , j srinivasan , s das , c freiwald , a yalamanchi , m jagannath , a tran , r krishnan , r jiang",2003
1957,dynamic multi-resource load balancing in parallel database systems,vldb,"e rahm , r marek",1995
1958,interview with michael stonebraker,,,2003
1959,a non-uniform data fragmentation strategy for parallel main-menory database systems,vldb,"n bassiliades , i vlahavas",1995
1960,information rules,sigmod record,d stirling,2003
1961,applying database technology in the adsm mass storage system,vldb,"l cabrera , r rees , w hineman",1995
1962,peer-to-peer : harnessing the power of disruptive technologies,sigmod record,m nascimento,2003
1963,generalized search trees for database systems,vldb,"j hellerstein , j naughton , a pfeffer",1995
1964,fundamentals of data warehouses : 2nd revised and extended edition,sigmod record,v hoffner,2003
1965,a scalable architecture for autonomous heterogeneous database interactions,vldb,"s milliner , a bouguettaya , m papazoglou",1995
1966,"fast similarity search in the presence of noise , scaling , and translation in time-series databases",vldb,"r agrawal , k lin , h sawhney , k shim",1995
1967,towards a database body of knowledge : a study from spain,sigmod record,"c calero , m piattini , f ruiz",2003
1968,research issues for data communication in mobile ad-hoc network database systems,sigmod record,"l fife , l gruenwald",2003
1969,coloring away communication in parallel query optimization,vldb,"w hasan , r motwani",1995
1970,bypassing joins in disjunctive queries,vldb,"m steinbrunn , k peithner , g moerkotte , a kemper",1995
1971,modelling temporal thematic map contents,sigmod record,"a d'onofrio , e pourabbas",2003
1972,xpath processing in a nutshell,,,2003
1973,a practical and modular implementation of extended transaction models,vldb,"r barga , c pu",1995
1974,a data transformation system for biological data sources,vldb,"p buneman , s davidson , k hart , g overton , l wong",1995
1975,issues in data stream management,sigmod record,"l golab , m жzsu",2003
1976,chair 's message,,,2003
1977,aggregate-query processing in data warehousing environments,vldb,"a gupta , v harinarayan , d quass",1995
1978,a web odyssey : from codd to xml,sigmod record,v vianu,2003
1979,eager aggregation and lazy aggregation,vldb,"w yan , p larson",1995
1980,book review column,sigmod record,k aberer,2003
1981,a cost model for clustered object-oriented databases,vldb,"g gardarin , j gruser , z tang",1995
1982,estimating the selectivity of spatial queries using the ` correlation ' fractal dimension,vldb,"a belussi , c faloutsos",1995
1983,an approach to confidence based page ranking for user oriented web search,sigmod record,"d mukhopadhyay , d giri , s singh",2003
1984,acm tods in this internet age,sigmod record,r snodgrass,2003
1985,zoo : a desktop experiment management environment,vldb,"y ioannidis , m livny , s gupta , n ponnekanti",1996
1986,querying multiple features of groups in relational databases,vldb,"d chatziantoniou , k ross",1996
1987,performing jobs without decompression in a compressed database system,sigmod record,"s o'connell , n winterbottom",2003
1988,modeling skewed distribution using multifractals and the ` 80-20 ' law,vldb,"c faloutsos , y matias , a silberschatz",1996
1989,xpath processing in a nutshell,sigmod record,"g gottlob , c koch , r pichler",2003
1990,semantic data caching and replacement,vldb,"s dar , m franklin , b jѓnsson , d srivastava , m tan",1996
1991,interview with jim gray,,,2003
1992,a database approach to quality of service specification in video databases,sigmod record,"e bertino , a elmagarmid , m hacid",2003
1993,implementation and analysis of a parallel collection query language,vldb,d suciu,1996
1994,ansi sql hierarchical processing can fully integrate native xml,sigmod record,m david,2003
1995,obtaining complete answers from incomplete databases,vldb,a levy,1996
1996,object fusion in mediator systems,vldb,"y papakonstantinou , s abiteboul , h garcia-molina",1996
1997,analysis of existing databases at the logical level : the dba companion project,sigmod record,"f marchi , s lopes , j petit , f toumani",2003
1998,database research at ut arlington,sigmod record,"s chakravarthy , y aslandogan , r elmasri , l fegaras , j oh",2003
1999,the role of integrity constraints in database interoperation,vldb,"m vermeer , p apers",1996
2000,multiscale histograms : summarizing topological relations in large spatial datasets,vldb,"x lin , q liu , y yuan , x zhou",2003
2001,query processing in spatial network databases,vldb,"d papadias , j zhang , n mamoulis , y tao",2003
2002,merging models based on given correspondences,vldb,"r pottinger , p bernstein",2003
2003,avoiding ordering and grouping in query processing,vldb,"x wang , m cherniack",2003
2004,anipqo : almost non-intrusive parametric query optimization for nonlinear cost functions,vldb,"a hulgeri , s sudarshan",2003
2005,supporting top-k join queries in relational databases,vldb,"i ilyas , w aref , a elmagarmid",2003
2006,the tpr * - tree : an optimized spatio-temporal access method for predictive queries,vldb,"y tao , d papadias , j sun",2003
2007,efficient approximation of optimization queries under parametric aggregation constraints,vldb,"s guha , d gunopulos , n koudas , d srivastava , m vlachos",2003
2008,cache tables : paving the way for an adaptive database cache,vldb,"m altinel , c bornhіvd , s krishnamurthy , c mohan , h pirahesh , b reinwald",2003
2009,lachesis : robust database storage management based on device-specific performance characteristics,vldb,"j schindler , a ailamaki , g ganger",2003
2010,a dependability benchmark for oltp application environments,vldb,"m vieira , h madeira",2003
2011,primitives for workload summarization and implications for sql,vldb,"s chaudhuri , p ganesan , v narasayya",2003
2012,bhunt : automatic discovery of fuzzy algebraic constraints in relational data,vldb,"p brown , p haas",2003
2013,estimating the output cardinality of partial preaggregation with a measure of clusteredness,vldb,"s helmer , t neumann , g moerkotte",2003
2014,memory requirements for query execution in highly constrained devices,vldb,"n anciaux , l bouganim , p pucheral",2003
2015,tabular placement of relational data on mems-based storage devices,vldb,"h yu , d agrawal , a abbadi",2003
2016,capturing global transactions from multiple recovery log files in a partitioned database system,vldb,"c liu , b lindsay , s bourbonnais , e hamel , t truong , j stankiewitz",2003
2017,the bea/xqrl streaming xquery processor,vldb,"d florescu , c hillery , d kossmann , p lucas , f riccardi , t westmann , m carey , a sundararajan , g agrawal",2003
2018,xml schemas in oracle xml db,vldb,"r murthy , s banerjee",2003
2019,integrated data management for mobile services in the real world,vldb,"c hage , c jensen , t pedersen , l speicys , i timko",2003
2020,improving performance with bulk-inserts in oracle r-trees,vldb,"n an , k kanth , s ravada",2003
2021,statistics on views,vldb,"c galindo-legaria , m joshi , f waas , m wu",2003
2022,efficient query processing for multi-dimensionally clustered tables in db2,vldb,"b bhattacharjee , s padmanabhan , t malkemus , t lai , l cranston , m huras",2003
2023,a platform based on the multi-dimensional data model for analysis of bio-molecular structures,vldb,"s srinivasa , s kumar",2003
2024,controlling access to published data using cryptography,vldb,"g miklau , d suciu",2003
2025,oasis : an online and accurate technique for local-alignment searches on biological sequences,vldb,"c meek , j patel , s kasetty",2003
2026,privacy-preserving indexing of documents on the network,vldb,"m bawa , r jr. , r agrawal",2003
2027,data compression in oracle,vldb,"m pіss , d potapov",2003
2028,operator scheduling in a data stream manager,vldb,"d carney , u чetintemel , a rasin , s zdonik , m cherniack , m stonebraker",2003
2029,efficient ir-style keyword search over relational databases,vldb,"v hristidis , l gravano , y papakonstantinou",2003
2030,locating data sources in large distributed systems,vldb,"l galanis , y wang , s jeffery , d dewitt",2003
2031,robust estimation with sampling and approximate pre-aggregation,vldb,c jermaine,2003
2032,chameleon : an extensible and customizable tool for web data translation,vldb,"r torlone , p atzeni",2003
2033,webservice composition with o'grape and osiris,vldb,"r weber , c schuler , p neukomm , h schuldt , h schek",2003
2034,implementing xquery 1.0 : the galax experience,vldb,"m fernandez , j simщon , b choi , a marian , g sur",2003
2035,xiss/r : xml indexing and storage system using rdbms,vldb,"p harding , q li , b moon",2003
2036,a system for keyword proximity search on xml databases,vldb,"a balmin , v hristidis , n koudas , y papakonstantinou , d srivastava , t wang",2003
2037,xquec : pushing queries to compressed xml data,vldb,"a arion , a bonifati , g costa , s d'aguanno , i manolescu , a pugliese",2003
2038,managing distributed workspaces with active xml,vldb,"s abiteboul , j baumgarten , a bonifati , g cobena , c cremarenco , f dragan , i manolescu , t milo , n preda",2003
2039,orientstore : a schema based native xml storage system,vldb,"x meng , d luo , m lee , j an",2003
