unique_id,pub_title,publication_venue,authors_list,year_published
1569,directv and oracle rdb : the challenges of vldb transaction processing,sigmod conference,w gettys,1995
1570,"enterprise objects framework , a second generation object-relational enabler",sigmod conference,c kleissner,1995
1571,low-cost compensation-based query processing,vldb,"и grјvlen , s hvasshovd , и torbjјrnsen",1998
1572,an overview of db2 parallel edition,sigmod conference,"c baru , g fecteau , a goyal , h hsiao , a jhingran , s padmanabhan , w wilson",1995
1573,a quantitative analysis and performance study for similarity-search methods in high-dimensional spaces,vldb,"r weber , h schek , s blott",1998
1574,data extraction and transformation for the data warehouse,sigmod conference,c squire,1995
1575,reducing the braking distance of an sql query engine,vldb,"m carey , d kossmann",1998
1576,cover your assets,sigmod conference,m olson,1995
1577,querying continuous time sequences,vldb,"l lin , t risch",1998
1578,recovery protocols for shared memory database systems,sigmod conference,"l molesky , k ramamritham",1995
1579,edgar f. codd : a tribute and personal memoir,sigmod record,c date,2003
1580,nd-sql : a multi-dimensional language for interoperability and olap,vldb,"f gingras , l lakshmanan",1998
1581,the lyric language : querying constraint objects,sigmod conference,"a brodsky , y kornatzky",1995
1582,the heterogeneity problem and middleware technology : experiences with and performance of database gateways,vldb,"f rezende , k hergula",1998
1583,evaluating functional joins along nested reference sets in object-relational and object-oriented databases,vldb,"r braumandl , j clauпen , a kemper",1998
1584,datamine - interactive rule discovery system,sigmod conference,"t imielinski , a virmani",1995
1585,using schema matching to simplify heterogeneous data translation,vldb,"t milo , s zohar",1998
1586,efendi : federated database system of cadlab,sigmod conference,"e radeke , r bіttger , b burkert , y engel , g kachel , s kolmschlag , d nolte",1995
1587,nearest neighbor queries,sigmod conference,"n roussopoulos , s kelley , f vincent",1995
1588,on optimal node splitting for r-trees,vldb,"y garcэa , m lopez , s leutenegger",1998
1589,r-tree based indexing of now-relative bitemporal data,vldb,"r bliujute , c jensen , s saltenis , g slivinskas",1998
1590,topological relations in the world of minimum bounding rectangles : a study with r-trees,sigmod conference,"d papadias , y theodoridis , t sellis , m egenhofer",1995
1591,towards an effective calculus for object query languages,sigmod conference,"l fegaras , d maier",1995
1592,optimal histograms with quality guarantees,vldb,"h jagadish , n koudas , s muthukrishnan , v poosala , k sevcik , t suel",1998
1593,ofl : a functional execution model for object query languages,sigmod conference,"g gardarin , f machuca , p pucheral",1995
1594,incremental clustering for mining in a data warehousing environment,vldb,"m ester , h kriegel , j sander , m wimmer , x xu",1998
1595,inferring function semantics to optimize queries,vldb,"m cherniack , s zdonik",1998
1596,oodb indexing by class-division,sigmod conference,"s ramaswamy , p kanellakis",1995
1597,the handwritten trie : indexing electronic ink,sigmod conference,"w aref , d barbarс , p vallabhaneni",1995
1598,"topaz : a cost-based , rule-driven , multi-phase parallelizer",vldb,"c nippl , b mitschang",1998
1599,improving adaptable similarity query processing by using approximations,vldb,"m ankerst , b braunmќller , h kriegel , t seidl",1998
1600,parallel evaluation of multi-join queries,sigmod conference,"a wilschut , j flokstra , p apers",1995
1601,mindreader : querying databases through multiple examples,vldb,"y ishikawa , r subramanya , c faloutsos",1998
1602,the merge/purge problem for large databases,sigmod conference,"m hernсndez , s stolfo",1995
1603,semantic assumptions and query evaluation in temporal databases,sigmod conference,"c bettini , x wang , e bertino , s jajodia",1995
1604,"what do those weird xml types want , anyway ?",vldb,s derose,1999
1605,online dynamic reordering for interactive data processing,vldb,"v raman , b raman , j hellerstein",1999
1606,implementing crash recovery in quickstore : a performance study,sigmod conference,"s white , d dewitt",1995
1607,hyper-programming in java,vldb,"e zirintsis , g kirby , r morrison",1999
1608,reducing multidatabase query response time by tree balancing,sigmod conference,"w du , m shan , u dayal",1995
1609,"industrial panel on data warehousing technologies : experiences , challenges , and directions",vldb,u dayal,1999
1610,temporal conditions and integrity constraints in active database systems,sigmod conference,"a sistla , o wolfson",1995
1611,"pm3 : an orthogonal persistent systems programming language - design , implementation , performance",vldb,"a hosking , j chen",1999
1612,view maintenance in a warehousing environment,sigmod conference,"y zhuge , h garcia-molina , j hammer , j widom",1995
1613,implementation of sql3 structured types with inheritance and value substitutability,vldb,"y fuh , s deпloch , w chen , n mattos , b tran , b lindsay , l demichel , s rielau , d mannhaupt",1999
1614,hypergraph based reorderings of outer join queries with complex predicates,sigmod conference,"g bhargava , p goel , b iyer",1995
1615,the spiffi scalable video-on-demand system,sigmod conference,"c freedman , d dewitt",1995
1616,implementation of two semantic query optimization techniques in db2 universal database,vldb,"q cheng , j gryz , f koo , t leung , l liu , x qian , k schiefer",1999
1617,optimization of run-time management of data intensive web-sites,vldb,"d florescu , a levy , d suciu , k yagoub",1999
1618,incremental maintenance of views with duplicates,sigmod conference,"t griffin , l libkin",1995
1619,join queries with external text sources : execution and optimization techniques,sigmod conference,"s chaudhuri , u dayal , t yan",1995
1620,determining text databases to search in the internet,vldb,"w meng , k liu , c yu , x wang , y chang , n rishe",1998
1621,an online video placement policy based on bandwith to space ratio ( bsr ),sigmod conference,"a dan , d sitaram",1995
1622,atomicity versus anonymity : distributed transactions for electronic commerce,vldb,j tygar,1998
1623,diag-join : an opportunistic join algorithm for 1 : n relationships,vldb,"s helmer , t westmann , g moerkotte",1998
1624,upsizing from file server to clent server architectures,sigmod conference,t team,1995
1625,"object-oriented , rapid application development in a pc database environment",sigmod conference,f team,1995
1626,hash joins and hash teams in microsoft sql server,vldb,"g graefe , r bunker , s cooper",1998
1627,the data that you wo n't find in databases : tutorial panel on data exchange formats,sigmod conference,"p buneman , d maier",1995
1628,spatio-temporal retrieval with rasdaman,vldb,"p baumann , a dehmel , p furtado , r ritsch , n widmann",1999
1629,using the calanda time series management system,sigmod conference,"w dreyer , a dittrich , d schmidt",1995
1630,xml repository and active views demonstration,vldb,"s abiteboul , v aguilera , s ailleret , b amann , s cluet , b hills , f hubert , j mamou , a marian , l mignet , t milo , c santos , b tessier , a vercoustre",1999
1631,the lotus notes storage system,sigmod conference,k moore,1995
1632,the mirror mmdbms architecture,vldb,"a vries , m doorn , h blanken , p apers",1999
1633,keynote address,,,1995
1634,miro web : integrating multiple data sources through semistructured data types,vldb,"l bouganim , t chan-sine-ying , t dang-ngoc , j darroux , g gardarin , f sha",1999
1635,parallel database systems 101,sigmod conference,j gray,1995
1636,clustering categorical data : an approach based on dynamical systems,vldb,"d gibson , j kleinberg , p raghavan",1998
1637,keynote address,,,1995
1638,things every update replication customer should know,sigmod conference,r golding,1995
1639,fast high-dimensional data search in incomplete databases,vldb,"b ooi , c goh , k tan",1998
1640,algorithms for mining association rules for binary segmentations of huge categorical databases,vldb,"y morimoto , t fukuda , h matsuzawa , t tokuyama , k yoda",1998
1641,versant replication : supporting fault-tolerant object databases,sigmod conference,"y shyy , h au-yeung , c chou",1995
1642,research and products : are they relevant to each other ? ( panel ),sigmod conference,h edelstein,1995
1643,algorithms for mining distance-based outliers in large datasets,vldb,"e knorr , r ng",1998
1644,real world requirements for decision support - implications for rdbms,sigmod conference,s bansal,1995
1645,design and analysis of parametric query optimization algorithms,vldb,s ganguly,1998
1646,filtering with approximate predicates,vldb,"n shivakumar , h garcia-molina , c chekuri",1998
1647,`` one size fits all '' database architectures do not work for dds,sigmod conference,c french,1995
1648,binding propagation in disjunctive databases,vldb,s greco,1998
1649,leveraging the information asset,sigmod conference,j perna,1995
1650,use of a component architecture in integrating relational and non-relational storage systems,sigmod conference,r atkinson,1995
1651,computing iceberg queries efficiently,vldb,"m fang , n shivakumar , h garcia-molina , r motwani , j ullman",1998
1652,bulk-loading techniques for object databases and an application to relational data,vldb,"s amer-yahia , s cluet , c delobel",1998
1653,informix online xps,sigmod conference,r gerber,1995
1654,order-of-magnitude advantage of tpc-c though massive parallelism,sigmod conference,c levine,1995
1655,algorithms for querying by spatial structure,vldb,"d papadias , n mamoulis , v delis",1998
1656,a raster approximation for processing of spatial joins,vldb,"g zimbrao , j souza",1998
1657,objects and sql : strange relations ? panel,sigmod conference,d deutsch,1995
1658,bank of america case study : the information currency advantage,vldb,"f cariёo , m jahnke",1998
1659,indexing multimedia databases ( tutorial ),,,1995
1660,an asynchronous avoidance-based cache consistency algorithm for client caching dbmss,vldb,"m жzsu , k voruganti , r unrau",1998
1661,an overview of the emerging third-generation sql standard ( tutorial ),,,1995
1662,"workflow automation : applications , technology , and research ( tutorial )",,,1995
1663,"design , implementation , and performance of the lham log-structured history data access method",vldb,"p muth , p o'neil , a pick , g weikum",1998
1664,integration approaches for cim,,,1995
1665,expiring data in a warehouse,vldb,"h garcia-molina , w labio , j yang",1998
1666,storage technology : raid and beyond,,,1995
1667,buffering and read-ahead strategies for external mergesort,vldb,"w zhang , p larson",1998
1668,an efficient cost-driven index selection tool for microsoft sql server,vldb,"s chaudhuri , v narasayya",1997
1669,the samos active dbms prototype,sigmod conference,"s gatziu , a geppert , k dittrich",1995
1670,design and implementation of advanced knowledge processing in the kdms krisys ( demonstration description ),sigmod conference,"j thomas , s deпloch , n mattos",1995
1671,algorithms for materialized view design in data warehousing environment,vldb,"j yang , k karlapalem , q li",1997
1672,data warehouse configuration,vldb,"d theodoratos , t sellis",1997
1673,infoharness : a system for search and retrieval of heterogeneous information,sigmod conference,"l shklar , a sheth , v kashyap , s thatte",1995
1674,fast computation of sparse datacubes,vldb,"k ross , d srivastava",1997
1675,qbi : query by icons,sigmod conference,"a massari , s pavani , l saladini , p chrysanthis",1995
1676,1-safe algorithms for symmetric site configurations,vldb,"r humborstad , m sabaratnam , s hvasshovd , и torbjјrnsen",1997
1677,the reach active oodbms,sigmod conference,"a buchmann , a deutsch , j zimmermann , m higa",1995
1678,"do n't scrap it , wrap it ! a wrapper architecture for legacy data sources",vldb,"m roth , p schwarz",1997
1679,the query by image content ( qbic ) system,sigmod conference,"j ashley , m flickner , j hafner , d lee , w niblack , d petkovic",1995
1680,the naos system,sigmod conference,"c collet , t coupaye",1995
1681,describing and using query capabilities of heterogeneous sources,vldb,"v vassalos , y papakonstantinou",1997
1682,efficient construction of regression trees with range and region splitting,vldb,"y morimoto , h ishii , s morishita",1997
1683,the algres testbed of chimera : an active object-oriented database system,sigmod conference,"s ceri , p fraternali , s paraboschi , g psaila",1995
1684,concurrent garbage collection in o2,vldb,"m skubiszewski , p valduriez",1997
1685,ptool : a light weight persistent object manager,sigmod conference,"r grossman , d hanley , x qin",1995
1686,a one-pass algorithm for accurately estimating quantiles for disk-resident data,vldb,"k alsabti , s ranka , v singh",1997
1687,finding data in the neighborhood,vldb,"a eickler , a kemper , d kossmann",1997
1688,"pattern matching and pattern discovery in scientific , program , and document databases",sigmod conference,"j wang , k zhang , d shasha",1995
1689,adaptive data broadcast in hybrid networks,vldb,"k stathatos , n roussopoulos , j baras",1997
1690,shore : combining the best features of oodbms and file systems,sigmod conference,s team,1995
1691,a generic approach to bulk loading multidimensional index structures,vldb,"j bercken , b seeger , p widmayer",1997
1692,paradise : a database system for gis applications,sigmod conference,p team,1995
1693,evaluation of main memory join algorithms for joins with set comparison join predicates,vldb,"s helmer , g moerkotte",1997
1694,semint : a system prototype for semantic integration in heterogeneous databases,sigmod conference,"w li , c clifton",1995
1695,dynamic memory adjustment for external mergesort,vldb,"w zhang , p larson",1997
1696,"information translation , mediation , and mosaic-based browsing in the tsimmis system",sigmod conference,"j hammer , h garcia-molina , k ireland , y papakonstantinou , j ullman , j widom",1995
1697,garbage collection in object oriented databases using transactional cyclic reference counting,vldb,"s ashwin , p roy , s seshadri , a silberschatz , s sudarshan",1997
1698,visdb : a system for visualizing large databases,sigmod conference,"d keim , h kriegel",1995
1699,data modeling of time-based media,sigmod conference,"s gibbs , c breiteneder , d tsichritzis",1994
1700,fast incremental maintenance of approximate histograms,vldb,"p gibbons , y matias , v poosala",1997
1701,groupwise processing of relational queries,vldb,"d chatziantoniou , k ross",1997
1702,combinatorial pattern discovery for scientific data : some preliminary results,sigmod conference,"j wang , g chirn , t marr , b shapiro , d shasha , k zhang",1994
1703,a region splitting strategy for physical database design of multidimensional file organizations,vldb,"j lee , y lee , k whang , i song",1997
1704,aries/csa : a method for database recovery in client-server architectures,sigmod conference,"c mohan , i narang",1994
1705,ensuring relaxed atomicity for flexible transactions in multidatabase systems,sigmod conference,"a zhang , m nodine , b bhargava , o bukhres",1994
1706,dataguides : enabling query formulation and optimization in semistructured databases,vldb,"r goldman , j widom",1997
1707,energy efficient indexing on air,sigmod conference,"t imielinski , s viswanathan , b badrinath",1994
1708,geo/environmental and medical data management in the rasdaman system,vldb,"p baumann , p furtado , r ritsch , n widmann",1997
1709,asset : a system for supporting extended transactions,sigmod conference,"a biliris , s dar , n gehani , h jagadish , k ramamritham",1994
1710,gte superpages : using ir techniques for searching complex objects,vldb,"s whitehead , h sinha , m murphy",1997
1711,effective memory use in a media server,vldb,"e chang , h garcia-molina",1997
1712,the ecrc multi database system,sigmod conference,"w jonker , h schќtz",1995
1713,data replication for mobile computers,sigmod conference,"y huang , a sistla , o wolfson",1994
1714,efficient user-adaptable similarity search in large multimedia databases,vldb,"t seidl , h kriegel",1997
1715,fine-grained sharing in a page server oodbms,sigmod conference,"m carey , m franklin , m zaharioudakis",1994
1716,critical database technologies for high energy physics,vldb,"d malon , e may",1997
1717,fast subsequence matching in time-series databases,sigmod conference,"c faloutsos , m ranganathan , y manolopoulos",1994
1718,caprera : an activity framework for transaction processing on wide-area networks,vldb,"s kumar , e kwang , d agrawal",1997
1719,distributing a search tree among a growing number of processors,sigmod conference,"b krіll , p widmayer",1994
1720,data manager for evolvable real-time command and control systems,vldb,"e hughes , r ginis , b thuraisingham , p krupp , j maurer",1997
1721,distributed processing over stand-alone systems and applications,vldb,"g alonso , c hagen , h schek , m tresch",1997
1722,from structured documents to novel query facilities,sigmod conference,"v christophides , s abiteboul , s cluet , m scholl",1994
1723,alphasort : a risc machine sort,sigmod conference,"c nyberg , t barclay , z cvetanovic , j gray , d lomet",1994
1724,the microsoft repository,vldb,"p bernstein , b harry , p sanders , d shutt , j zander",1997
1725,distributed file organization with scalable cost/performance,sigmod conference,"r vingralek , y breitbart , g weikum",1994
1726,multidimensional access methods : trees have grown everywhere,vldb,"t sellis , n roussopoulos , c faloutsos",1997
1727,adaptive selectivity estimation using query feedback,sigmod conference,"c chen , n roussopoulos",1994
1728,efficient testing of high performance transaction processing systems,vldb,"d wildfogel , r yerneni",1997
1729,innovation in database management : computer science vs. engineering,vldb,k jacobs,1997
1730,estimating page fetches for index scans with finite lru buffers,sigmod conference,"a swami , k schiefer",1994
1731,public : a decision tree classifier that integrates building and pruning,vldb,"r rastogi , k shim",1998
1732,genesys : a system for efficient spatial query processing,sigmod conference,"t brinkhoff , h kriegel , r schneider , b seeger",1994
1733,eos : an extensible object store,sigmod conference,"a biliris , e panagos",1994
1734,on the discovery of interesting patterns in association rules,vldb,"s ramaswamy , s mahajan , a silberschatz",1998
1735,wavecluster : a multi-resolution clustering approach for very large spatial databases,vldb,"g sheikholeslami , s chatterjee , a zhang",1998
1736,databases for networks,sigmod conference,h jagadish,1994
1737,a survey and critique of advanced transaction models,sigmod conference,c mohan,1994
1738,rainforest - a framework for fast decision tree construction of large datasets,vldb,"j gehrke , r ramakrishnan , v ganti",1998
1739,dec data distributor : for data replication and data warehousing,sigmod conference,d dietterich,1994
1740,small materialized aggregates : a light weight index structure for data warehousing,vldb,g moerkotte,1998
1741,secure buffering in firm real-time database systems,vldb,"b george , j haritsa",1998
1742,a performance study of transitive closure algorithms,sigmod conference,"s dar , r ramakrishnan",1994
1743,safely and efficiently updating references during on-line reorganization,vldb,"c zou , b salzberg",1998
1744,database in crisis and transition : a technical agenda for the year 2001,sigmod conference,d vaskevitch,1994
1745,coss : the common object services specifications,sigmod conference,b martin,1994
1746,materialized view selection for multidimensional datasets,vldb,"a shukla , p deshpande , j naughton",1998
1747,the effectiveness of gloss for the text database discovery problem,sigmod conference,"l gravano , h garcia-molina , a tomasic",1994
1748,"ratio rules : a new paradigm for fast , quantifiable data mining",vldb,"f korn , a labrinidis , y kotidis , c faloutsos",1998
1749,implementation of magic-sets in a relational database system,sigmod conference,"i mumick , h pirahesh",1994
1750,scalable sweeping-based spatial join,vldb,"l arge , o procopiuc , s ramaswamy , t suel , j vitter",1998
1751,mining surprising patterns using temporal description length,vldb,"s chakrabarti , s sarawagi , b dom",1998
1752,optimization of dynamic query evaluation plans,sigmod conference,"r cole , g graefe",1994
1753,incomplete path expressions and their disambiguation,sigmod conference,"y ioannidis , y lashkari",1994
1754,scalable techniques for mining causal structures,vldb,"c silverstein , s brin , r motwani , j ullman",1998
1755,sleepers and workaholics : caching strategies in mobile environments,sigmod conference,"d barbarс , t imielinski",1994
1756,selectivity estimation in extensible databases - a neural network approach,vldb,"m lakshmi , s zhou",1998
1757,evolving teradata decision support for massively parallel processing with unix,sigmod conference,c ballinger,1994
1758,massive stochastic testing of sql,vldb,d slutz,1998
1759,issues in developing very large data warehouses,vldb,"l do , p drew , w jin , v jumani , d rossum",1998
1760,staggered striping in multimedia information systems,sigmod conference,"s berson , s ghandeharizadeh , r muntz , x ju",1994
1761,database issues in telecommunications network management,sigmod conference,i ahn,1994
1762,the drill down benchmark,vldb,"p boncz , t rќhl , f kwakkel",1998
1763,the national medical knowledge bank,vldb,w sterling,1998
1764,quickly generating billion-record synthetic databases,sigmod conference,"j gray , p sundaresan , s englert , k baclawski , p weinberger",1994
1765,experiences in federated databases : from iro-db to miro-web,vldb,"p fankhauser , g gardarin , m lopez , j muёoz , a tomasic",1998
1766,predictive dynamic load balancing of parallel and distributed rule and query processing,sigmod conference,"h dewan , s stolfo , m hernсndez , j hwang",1994
1767,materialized views in oracle,vldb,"r bello , k dias , a downing , j jr. , j finnerty , w norcott , h sun , a witkowski , m ziauddin",1998
1768,incremental updates of inverted lists for text document retrieval,sigmod conference,"a tomasic , h garcia-molina , k shoens",1994
1769,koda - the architecture and interface of a data model independent kernel,vldb,"g arun , a joshi",1998
1770,optimizing queries on files,sigmod conference,"m consens , t milo",1994
1771,on parallel execution of multiple pipelined hash joins,sigmod conference,"h hsiao , m chen , p yu",1994
1772,the adabas buffer pool manager,vldb,h schіning,1998
1773,multi-step processing of spatial joins,sigmod conference,"t brinkhoff , h kriegel , r schneider , b seeger",1994
1774,plan-per-tuple optimization solution - parallel execution of expensive user-defined functions,vldb,"f cariёo , w o'connell",1998
1775,spatial joins using seeded trees,sigmod conference,"m lo , c ravishankar",1994
1776,is web-site management a database problem ?,vldb,"d florescu , a levy , d suciu",1998
1777,managing memory for real-time queries,sigmod conference,"h pang , m carey , m livny",1994
1778,"information , communication , and money : for what can we charge and how can we meter it ?",vldb,"s blott , h korth , a silberschatz",1998
1779,starting ( and sometimes ending ) a database company,vldb,j orenstein,1998
1780,shoring up persistent applications,sigmod conference,"m carey , d dewitt , m franklin , n hall , m mcauliffe , j naughton , d schuh , m solomon , c tan , o tsatalos , s white , m zwilling",1994
1781,the cubetree storage organization,vldb,"n roussopoulos , y kotidis",1998
1782,quickstore : a high performance mapped object store,sigmod conference,"s white , d dewitt",1994
1783,"self-adaptive , on-line reclustering of complex object data",sigmod conference,"w jr. , r king",1994
1784,ibm 's db2 universal database demonstrations at vldb '98,vldb,"k schiefer , j kleewein , k brannon , g lohman , g fuh",1998
1785,sequence query processing,sigmod conference,"p seshadri , m livny , r ramakrishnan",1994
1786,mapinfo spatialware : a spatial information server for rdbms,vldb,c mina,1998
1787,practical predicate placement,sigmod conference,j hellerstein,1994
1788,optimizing disjunctive queries with expensive predicates,sigmod conference,"a kemper , g moerkotte , k peithner , m steinbrunn",1994
1789,oracle industrial exhibit,vldb,a pogue,1998
1790,a language for manipulating arrays,vldb,"a marathe , k salem",1997
1791,outerjoins as disjunctions,sigmod conference,c galindo-legaria,1994
1792,a foundation for multi-dimensional databases,vldb,"m gyssens , l lakshmanan",1997
1793,partition selection policies in object database garbage collection,sigmod conference,"j cook , a wolf , b zorn",1994
1794,cost-based selection of path expression processing algorithms in object-oriented databases,vldb,"g gardarin , j gruser , z tang",1996
1795,nonstop sql : scalability and availability for decision support,sigmod conference,s englert,1994
1796,dynamic load balancing in hierarchical parallel database systems,vldb,"l bouganim , d florescu , p valduriez",1996
1797,red brick warehouse : a read-mostly rdbms for open smp platforms,sigmod conference,p fernandez,1994
1798,disseminating updates on broadcast disks,vldb,"s acharya , m franklin , s zdonik",1996
1799,the montage extensible datablade achitecture,sigmod conference,m ubell,1994
1800,object-oriented features of db2 client/server,sigmod conference,h pirahesh,1994
1801,"calibrating the query optimizer cost model of iro-db , an object-oriented federated database system",vldb,"g gardarin , f sha , z tang",1996
1802,answering queries with aggregation using views,vldb,"d srivastava , s dar , h jagadish , a levy",1996
