product_key,p_title,base_price,detailed_info
218,lg electronics lrbp1031w 10 cu . ft. refrigerator,,
219,lg navy blue steamwasher 27 ',,
220,sony 17-in-1 external usb memory card reader and writer mrw62e/s1/181,,"17-in-1 memory stick duo , memory stick magicgate duo , memory stick pro , memory stick pro magicgate , minisd card , multimediacard ( mmc ) , rs-mmc , compactflash ( cf ) card , secure digital ( sd ) card , smar"
221,directdeck universal cassette adapter for mp3 players 7256-ddeck,,
222,"ddw1805w 18-in . portable dishwasher ( white , energy star )",474.36,
223,white .5 cu . ft 1500 watt convection/broiler/toaster oven,149.0,
224,delonghi 6-pc . replacement filters for deep fryer,,
225,delonghi 4-cup drip coffee makers,,
226,"harmony el6985a vacuum ( canister , hepa )",,
227,cuisinart gr-4 griddler four multifunctional cooking options,129.0,
228,cuisinart brew & serve stainless therm black 10-cup coffee maker,99.95,
229,belkin cushtop f8n044-org,,- orange
230,belkin cushtop f8n044-grn,,- green
231,belkin cushtop f8n044-slv,,- silver
232,canon pg-40 black ink cartridge pg-40-bk-twin,41.46,black
233,"dcc-2000 coffee maker ( 12 cup , stainless steel )",99.95,
234,"hoover empower u5269-900 vacuum ( upright , hepa , bagless )",,
235,olympus neoprene soft camera case 202066,11.89,top loading neoprene black
236,canon battery and charger kit 1169b001,,power accessory kit
237,directed electronics sportster 4 sirius satellite radio receiver sp4tk1,169.99,xs fm transmitter 6 lines lcd
238,panasonic kx-flb801 multifunction printer kx-flb801,,panasonic all-in-one all-in-one flatbed laser fax
239,denon dvd-2930ci dvd player dvd2930ci,448.0,"dvd + rw , dvd-rw , cd-rw dvd video , dvd audio , sacd , video cd , picture cd , jpeg , wma , pcm , hdcd , mp3 , mpeg-1 , mpeg-2 , mpeg-4 , divx playback 1 disc ( s ) progressive scan black"
240,omnimount mwfs moda collection 2 shelf wall mounted furniture system espresso,158.16,
241,directed electronics supv1 car kit,,sirius satellite radio receiver
242,sirius suph1 sirius universal home kit,44.99,sirius satellite radio receiver
243,logitech harmony 1000 advanced universal remote control 966230-0403,,
244,logitech dinovo edge keyboard 967685-0403,,usb
245,nikon en-el3e lithium ion digital camera battery 25334,34.24,nikon en-el3e rechargeable li-ion battery
246,nikon 55-200mm f/4 -5.6 g ed af-s dx telephoto zoom lens 55200mmlens,124.95,0.28 x 55mm to 200mm f/4 to 5.6
247,sony lcs-csh soft camera case lcscsh,,top loading polypropylene black
248,olympus slim leather case 202087,18.99,leather black
249,canon ef 75-300mm f/4 -5.6 iii telephoto zoom lens 6473a003,159.95,f/4 to 5.6
250,canon mini dv camcorder starter kit 9582a008,69.95,camcorder starter kit
251,lg electronics dle0442w xl load capacity with neverust stainless steel drum,,
252,lg electronics dlg0452w 7.3 cu . ft. 9-cycle gas dryer,,
253,lg electronics wdp3 laundry pedestal with drawer - w / b / s / n wdp3r wild cherry,,
254,lg electronics wm0642hw front load washing machine with 7 washing programs,,
255,canon bci-6 color ink cartridges 4705a018,59.99,"black , cyan , magenta , yellow , light cyan , light magenta"
256,directed electronics starmate 4 sirius satellite radio receiver st4tk1,104.93,xs fm transmitter 5 lines lcd
257,omnimount 3-shelf large-component tower stellarg303g,,
258,olympus li-42b lithium ion digital camera battery 202034,,lithium ion ( li-ion ) 3.7 v dc photo battery
259,canon cb-2lx battery charger 1133b001,,
260,nikon nikkor 70-300mm f/4 .5 -5.6 g ed-if af-s vr telephoto zoom lens 2161,449.0,f/4 .5 to 5.6
261,fellowes microshred ms-450cs shredder 3245001,185.99,micro cut 7 per pass
262,fellowes powershred personal sb-97cs confetti cut shredder 3219701,240.67,cross cut 17 per pass
263,playstation 3 chargelink usb charging cable by nyko 83000,,
264,nyko ps3 dual ac charger 83015,,
265,sony 1gb memory stick micro ( m2 ) card msa1gd,21.47,1 gb
266,monster game 127961 gamelink ( tm ) 2m hdmi digital video/audio cable for ps3,45.79,
267,bose in-ear earphone inearheadphones,99.95,- black
268,panasonic kx-fp145 plain paper thermal transfer fax/copier kxfp145,94.88,panasonic slim cabinet plain paper fax/copier with all-digital answering system
269,oregon scientific helmet video camera atc-2000,81.74,
270,waring pro deep fryer 3qt - black,,
271,canon cli-8 red ink tank for pixma pro9000 printer 0626b002,15.75,red
272,canon cli-8 green ink tank for pixma pro 9000 printer 0627b002,12.85,green
273,linksys wpsm54g wireless-g usb print server,,"1 x 10/100base-tx network , 1 x usb wi-fi ieee 802.11 b/g"
274,monster cable gamelink component video and fiber optic digital audio cable for playstation 3 3 x rca toslink 10ft ps3 cv/fo -10,,
275,garmin suction cup mount 010-10823-00,24.84,
276,directed electronics sch1 siriusconnect home tuner,54.92,sirius sch1 siriusconnect home tuner
277,panasonic srtmb10/rice cooker/5 .5 cup/fuzzy sr-tmb10,,
278,kitchenaid 5-speed blender red finish ksb560er,106.98,
279,"abs48 wood tv stand ( avalon series , 48-in . max )",,
280,techcraft swp60 classic wood tone credenza tv stand,,wood walnut
281,"pld4375rfc professional speedclean 24-in . under counter dishwasher ( 14 place settings , stainless steel )",543.29,
282,monster cable gamelink hdmi digital video/audio cable for playstation 3 1 x hdmi 6.56 ft ps3 hdmi-2m,55.79,
283,bose sl2 wireless surround link,249.0,
284,pioneer ibus interface cable for ipod cd-i200,26.5,"6.56 ft 1 x ip-bus , 1 x proprietary audio cable"
285,sirius fmda25 wired fm relay kit,,
286,sony playstation 3 blu-ray dvd remote 98046,18.44,
287,peerless sglb01 flat panel tv stand,,glass black
288,transcend 8gb jetflash v10 usb flash drive ts8gjfv10,14.5,
289,transcend 4gb secure digital high capacity ( sdhc ) card class 6 ts4gsdhc6,5.74,transcend 4gb sdhc class 6 secure digital high capacity card
290,sharp plasmacluster fp-p35cx air purifier 129sq . ft.,,
291,transcend 2gb microsd card ts2gusd,1.75,2 gb
292,polkaudio tci series tc60i in-ceiling loudspeaker tc60iw,132.83,2-way speaker 125w ( rms ) white
293,omnimount wishbone large/x-large premium cantilever mount and universal adapter ucl-xb,292.92,200 lb
294,nikon en-el9 lithium ion digital camera battery pack 25353,35.65,lithium ion ( li-ion ) 7.4 v dc photo battery
295,garmin leather carry case for nuvi 660 010-10823 -01,9.28,top loading leather
296,tomtom gps receiver accessory kit 9n00 .101,35.64,tomtom windshield mount and usb car charger
297,sanus flat panel ceiling mount sc1a-b1,,25 lb
298,coby electronics tf-dvd7006 portable dvd player tfdvd7006,70.32,coby tf-dvd7006 7 ' widescreen portable dvd player
299,panasonic kx-tg1032s dual handset digital cordless phone,61.14,1 x phone line ( s ) headset jack silver
300,panasonic kx-tg1033s digital cordless phone with three handsets,,1 x phone line ( s ) headset jack silver
301,panasonic kx-tg1034s dect 6.0 cordless phone kx-tg1034s,89.45,panasonic dect 6.0 series 4 handset cordless phone system with answering system
302,panasonic kx-tga101s dect 6.0 expansion handset,36.04,
303,garmin suction cup mount 010-10936-00,13.02,
304,canon e-p100 photo pack for selphy es1 printer 1335b001,21.23,photo paper
305,olympus vn-4100pc 256mb digital voice recorder 141927,44.95,256mb flash memory lcd portable
306,omnimount cmk-mini mini wall mounted cable management system,,
307,sanus lrf118-b1 full motion wall tv mount,,130 lb black
308,sanus mf209-b1 full motion wall tv mount,,60 lb
309,case logic universal vertical pda leather pouch clp104bb,9.99,leather
310,sanus mf215-b1 extending full motion mount,,60 lb
311,blueant supertooth light compact bluetooth speakerphone black 093744,,
312,sony infolithium h-series np-fh70 camcorder battery npfh70,57.0,lithium ion ( li-ion ) 8.4 v dc photo battery
313,sony dvpns57p dvd player dvpns57ps,45.32,"dvd-r , dvd + r , dvd + rw , dvd-rw , cd-rw dvd video , svcd , video cd , jpeg , mp3 playback 1 disc ( s ) progressive scan silver"
314,"pld4555rfc professional speedclean 24-in . under counter dishwasher ( 14 place settings , stainless steel , energy star )",549.0,
315,panasonic sr-na18 10-cup rice cooker/warmer with advanced fuzzy logic technology,,
316,frigidaire electric dryer feq1442wh 5.8 cubic foot super capacity drum,499.0,
317,frigidaire electric dryer feq332wh 5.7 cu.ft . super capacity drum,420.29,
318,wed6400sb cabrio super capacity plus electric black dryer,,
319,genesis series 3741001 60 ' freestanding gas grill with 637 sq. in . cooking surface & 3 stainless steel burners : black lp gas,636.61,
320,weber genesis series 3770001 60 ' freestanding gas grill,,
321,weber genesis series s-310 60 ' freestanding gas grill,,
322,"weber summit series s-450 74 1/10 ' freestanding gas grill with 838 sq. in . cooking surface , 6 stainless steel burners , rotisserie burner , stainless steel smoker box & stainless steel work surface : lp gas",,
323,audiovox ve927 9 ' tv/dvd combo,279.99,"9 ' lcd atsc , ntsc 16:9 stereo sound hdtv dvd-r , cd-r , cd-rw"
324,garmin portable friction mount,,garmin 010-10908-00 portable friction mount
325,weber genesis s-320 3780001 60 ' freestanding gas grill,,
326,weber genesis series e-310 3841001 60 ' freestanding gas grill with 637 sq. in . cooking surface & 3 stainless steel burners : black natural gas,679.61,
327,"weber genesis s-320 3880001 60 ' freestanding gas grill with 637 sq. in . cooking surface , 3 stainless steel burners , flush-mounted side burner & stainless steel shroud : natural gas",754.29,
328,sony np-fh100 lithium ion camcorder battery npfh100,,lithium ion ( li-ion ) 8.4 v dc photo battery
329,panasonic 2gb sd card prohispd 20 mb/sec rp-sdv02gu1a,11.99,
330,"case logic 10 ' in-car dvd player case 11 ' x 9.25 ' x 4 ' nylon , koskin black ( black )",18.98,
331,sony stereo bluetooth headset * nic * tmrbt10/tmrbt10a,41.99,
332,panasonic 4gb sdhc card class 6 20 mb/sec * nic * rp-sdv04gu1k,23.12,
333,transcend 8gb secure digital high capacity ( sdhc ) card class 6 ts8gsdhc6,11.45,transcend 8gb sdhc secure digital high capacity card
334,garmin lightweight gps case 010-10704-00,,clam shell
335,panasonic kx-tg6702b cordless telephone kx-tg6702b,159.92,panasonic 5.8 ghz 2 line expandable phone with extra handset
336,olympus ps-bls1 lithium ion digital camera battery 260236,,lithium ion ( li-ion ) photo battery
337,sony noise cancelling earphone mdrnc22/blk,,- black
338,gn jabra bt5010 wireless earset,26.37,jabra bt5010 bluetooth headset
339,olympus ds-40 512mb digital voice recorder 141910,110.24,512mb flash memory lcd portable
340,panasonic nn-sd377s 0.8 cu.ft . 800 watt microwave oven,,
341,netgear prosafe gs724tp 24 port smart switch with poe gs724tp-100nas,,"22 x 10/100/1000base-t lan , 2 x 10/100/1000base-t lan"
342,d-link dwa-130 wireless n usb adapter,,
343,tomtom one xl additional mount kit 9s00 .006,29.95,
344,panasonic nnsd667s 1.2 cu . ft. countertop microwave oven in stainless steel,,
345,panasonic nnsd767s 1.6 cu . ft. stainless steel countertop microwave oven,,
346,panasonic nnsd797s 1.6 cu . ft. genius prestige inverter stainless steel microwave oven,,
347,panasonic 2.2 cu . ft. stainless steel luxury full size countertop microwave oven nnsd967ss,,
348,panasonic nnsn667b 1.2 cu . ft. countertop microwave oven in black,108.63,
349,panasonic nnsn667w 1.2 cu . ft. countertop microwave oven in white,107.81,
350,sony slvd380p dvd/vcr combo,,"vhs , dvd-r , cd-r dvd video , mp3 playback progressive scan"
351,sony dvpns57p dvd player dvpns57pb,39.0,"dvd + rw , dvd-rw , dvd + r , dvd-r , cd-rw dvd video , svcd , video cd , jpeg , mp3 playback 1 disc ( s ) progressive scan black"
352,pioneer cd-r55 wireless remote for avic-d3 / 4900dvd cdr55,14.05,
353,whirlpool duet sport 27 '' electric dryer wed8300swh 6.7 cubic foot capacity,673.29,
354,frigidaire 27 '' electric stack washer dryer combo fex831wh extra-large capacity wash tub,895.39,
355,nikon 18-200mm 3.5-5 .6 g ed dx afs vr zoom wide angle nikkor lens niko_215930348,629.0,
356,universal remote control mrf-350 addressable narrow band rf base station with rfx-250 antenna,174.72,
357,nikon en-el10 no-mem lithium-ion camera battery 25752,21.26,lithium ion ( li-ion ) 3.7 v dc photo battery
358,nikon 55-200mm f/4 -5.6 g ed if af-s dx vr zoom telephoto nikkor lens niko_216687518,189.95,
359,kensington combosaver ultra notebook lock k64516us,,combosaver ultra combination notebook lock
360,hoover company #u5140900 wide path bag up vac,,
361,electrolux homecare #el012a electro h12 hepa filter,,
362,irobot roomba scooba robot floor washer,,
363,canon speedlite 580ex ii flash light 1946b002,,"ttl , e-ttl"
364,altec lansing inmotion im600 portable audio speaker system im600,,
365,canon fax-jx200 fax machine 1735b002aa,,monochrome copier 1.33 cpm mono inkjet
366,canon pg-40 twin pack black ink cartridge 0615b013,,black
367,logitech v220 cordless optical mouse for notebooks 910-000153,,
368,yamaha nx-u10 usb powered stereo speaker nx-u10sl,,2.0-channel silver
369,lacie big disk ethernet network storage server 301239u,,lacie ethernet big disk 2tb usb 2.0 16mb 7200rpm network attached storage
370,tivo 80 hour dvr recorder,,
371,tvio wireless usb network adpator,,
372,plantronics voyager 510 bluetooth headset,,
373,kenwood ipod direct cable kcaip200,19.72,"1 x proprietary 1 x mini-phone stereo , 1 x type a"
374,kenwood ipod-video direct adapter kcaip300v,26.0,"proprietary male to type a male usb , 2 x mini-phone male 4.92 ft"
375,"lg electronics lsc21943st 21.0 cu . ft. counter-depth side-by-side refrigerator with 3 spill-protector glass shelves , spaceplus ice system , digital led display and customcube automatic ice maker",,
376,lg electronics dle2516w 27 ' electric dryer,,
377,"lg electronics dlg2526w 27 ' gas dryer with 7.0 cu . ft. capacity , 5 dry programs , 5 temperature controls , 5 drying levels and sensor dry system",,
378,"lg electronics wm2016cw 27 ' front-load washer with 3.5 cu . ft. capacity , 5 wash programs , 5 temperature levels , 1050 rpm maximum and senseclean system",699.0,
379,computer speakers srsa212/blk,22.53,
380,sony mdr-q68lw stereo earphone mdrq68lw,19.05,- stereo
381,sony srs-btm30 wireless stereo bluetooth speaker srsbtm30,,
382,logitech digital precision pc gaming headset 981-000040,31.99,logitech digital precision pc headset
383,logitech quickcam pro 9000 webcam 960-000048,,logitech quickcam pro 9000
384,sirius scc1 universal vehicle tuner,64.72,
385,audiovox xmck5p expressez satellite radio xmck5p,,audiovox xpress ez xm radio receiver with vehicle kit
386,audiovox xpress r xm radio receiver with vehicle kit xmck20p,76.42,
387,monster cable ifreeplay cordless headphone ai sh hphone,,connectivity : wireless stereo behind-the-neck
388,lacie big disk extreme + hard drive 301199u,,lacie big disk extreme 1tb hard drive triple interface ( usb 2.0 & firewire 400/800 ) external hard drive
389,audiovox satellite radio tuner,,terk xmrvrfm002 commandermt universal in-car xm receiver
390,sirius 14230 50-ft antenna extension cable dei14230,,
391,logitech cordless desktop wave 920-000264,,
392,uniden dect 6.0 1.9 ghz cordless phone dect2080-2,46.72,1 x phone line ( s )
393,uniden dcx200 dect 6.0 accessory handset & charger,,
394,sharp 1100 watt over the counter microwave,,
395,garmin suction cup mount/12-volt adapter kit 010-10979-00,,navigator starter kit
396,sony psp core system ( piano black ) ( slim model with av video out port ) 98510,,
397,unreal tournament iii 26991,,
398,tivo hd digital video recorder up to 20 hours in hd ! tcd652160,259.99,
399,nikon digital camera leather case 5811,7.99,leather black
400,logitech v470 cordless laser mouse for notebooks 910-000298,,logitech v470 bluetooth notebook mouse blue
401,sony vrdmc5 digital video recorder,166.29,"dvd + rw , dvd-rw , dvd + r , memory stick , memory stick duo , secure digital ( sd ) card , xd-picture card , compactflash ( cf ) dvd video , mp3 1 disc 12hour recording"
402,logitech mx air rechargeable cordless air mouse 931633-0403,,laser usb
403,monster cable icable a ic mini ip-3 s audio stereo cable 123870,,1 x mini-phone stereo 1 x mini-phone stereo 3ft
404,bracketron ipod docking kit,4.65,bracketron ipm-202-bl pro series ipod docking kit
405,bracketron nav-mat portable gps dash mount ufm-100-bl,,bracketron nav-mat portable gps dash mount
406,233xsgg skagen,70.0,
407,seiko sxda04,138.0,
408,canon pixma mx310 multifunction photo printer 2184b002,89.99,"canon pixma mx310 office all-in-one printer , scanner , copier and fax with high-speed auto document feeder"
409,canon pixma mx700 multifunction photo printer 2186b002,,canon pixma mx700 office all-in-one printer
410,canon canonscan 8800f flatbed scanner 2168b002,235.5,canon canoscan 8800f
411,peerless smartmount 700 series articulating wall arm,,peerless sa745pu articulating wall arm for 32 ' to 45 ' lcd and plasma screens piano black
412,peerless smartmount 700 series articulating wall arm,,peerless sa750pu articulating wall arm for 32 ' to 50 ' lcd and plasma screens piano black
413,belkin orange cushtop,,
414,sony lcs-twa/r cyber-shot camera case,27.92,top loading leather red
415,sony lcs-twa/b cyber-shot camera case lcstwa/b,34.0,top loading leather black
416,denon avr-3808ci a/v receiver avr3808ci,1698.0,"dolby pro logic iix , dolby digital surround , dts-es , dts neo :6 , dts 96/24 , neural surroundfm , am , xm"
417,denon avr-4308ci a/v receiver avr4308ci,1849.77,"dolby pro logic iix , dolby digital surround , dts-es , dts neo :6 , dts 96/24 , neural surroundfm , am , xm"
418,canon eos 40d digital slr camera 1901b004,849.95,canon eos 40d 10 megapixel digital slr camera body only
419,canon eos 40d digital slr camera with ef 28-135mm f/3 .5 -5.6 is usm lens 1901b017,1029.88,canon eos 40d digital slr camera with 28-135mm lens
420,ge 24775 amplified quantum hdtv antenna,,
421,canon psc-1000 semi-hard leather case 2350b001,16.97,leather burgundy
422,"lg 7.3 cu.ft . front control , st drum , chrome door trim ( pearl gray )",,
423,lg electric dryer with 9 drying programs,,
424,lg xl capacity electric dryer,,
425,lg 3.8 cu . ft. 7-cycle extra-large capacity washer white,,
426,lg 4.0 cu . ft. capacity front load washer w / sanitary cycle,,
427,tivo tiv652160 tivo high definition,,
428,nintendo ds lite ( crimson & black ) usgsrmkb,,
429,sony mdrex81lp comfort fit ear hanger headphones - choose color ( black ),,
430,lacie little disk hard drive 301278,79.99,lacie little disk 250gb usb 2.0 5400rpm portable external hard drive
431,apple ipod shuffle 1gb mp3 player mb226ll/a,,1gb flash memory silver
432,speck products toughskin for ipod classic ic-blk-ts,12.95,rubber black
433,sony universal remote control rm-ez4,12.72,"tv , cable box universal remote"
434,klipsch roomgroove wireless ipod speaker system 1006602,199.99,black
435,sony 2gb memory stick micro ( m2 ) msa2gd,,2 gb
