record_id,document_title,author_list,venue_name,creation_year
2288,information integration : the momis project demonstration,"michele melchiori , silvana castano , g. malvezzi , domenico beneventano , r. guidetti , alberto corni , sonia bergamaschi , maurizio vincini",vldb,2000
2289,on the cost of monitoring and reorganization of object bases for clustering,"guido moerkotte , alfons kemper , carsten andreas gerlhof",sigmod record,1996
2290,florida international university high performance database research center,"leonard loureiro , yi deng , carlos ordonez 0002 , mario sanchez , cyril u. orji , wei sun , artyom shaposhnikov , naphtali rishe , michael alexopoulos , david barton",sigmod record,1995
2291,using versions in update transactions : application to integrity checking,"dimitri tombroff , eric simon , françois llirbat",vldb,1997
2292,an array-based algorithm for simultaneous multidimensional aggregates,"jeffrey f. naughton , yihong zhao , prasad deshpande",sigmod conference,1997
2293,query previews for networked information systems : a case study with nasa environmental data,"khoa doan , catherine plaisant , ben shneiderman , tom bruns",sigmod record,1997
2294,integrating mining with relational database systems : alternatives and implications,"shiby thomas , rakesh agrawal , sunita sarawagi",sigmod conference,1998
2295,min-max compression methods for medical image databases,"john m. tyler , kosmas karadimitriou",sigmod record,1997
2296,the mariposa distributed database management system,jeff sidell,sigmod record,1996
2297,"o-o , what have they done to db2 ?","bennet vance , richard swagerman , michael j. carey , srinivasa narayanan , nelson mendonça mattos , donald d. chamberlin , doug doole , serge rielau",vldb,1999
2298,two techniques for on-line index modification in shared nothing parallel databases,"shamkant b. navathe , kiran j. achyutuni , edward omiecinski",sigmod conference,1996
2299,query engines for web-accessible xml data,"ramez elmasri , leonidas fegaras",vldb,2001
2300,capturing global transactions from multiple recovery log files in a partitioned database system,"elizabeth hamel , serge bourbonnais , bruce g. lindsay , tuong c. truong , chengfei liu , jens stankiewitz",vldb,2003
2301,an internet-based negotiation server for e-commerce,"joachim hammer , youzhong liu , chunbo huang , yihua huang , herman lam , liu wang , haifei li , stanley y. w. su , charnyote pluempitiwiriyawej , minsoo lee",vldb j.,2001
2302,a logical foundation for deductive object-oriented databases,"mengchi liu , tok wang ling , gillian dobbie",acm trans . database syst .,2002
2303,a layered architecture for querying dynamic web content,"hasan davulcu , michael kifer , i. v. ramakrishnan , juliana freire",sigmod conference,1999
2304,unpacking the semantics of source and usage to perform semantic reconciliation in large-scale information systems,"ken smith , leo obrst",sigmod record,1999
2305,analysis of navigation behaviour in web sites integrating multiple information systems,"myra spiliopoulou , bettina berendt",vldb j.,2000
2306,vice chair 's message,z. meral özsoyoglu,sigmod record,1999
2307,a normal form for precisely characterizing redundancy in nested relations,"yiu-kai ng , david w. embley , wai yin mok",acm trans . database syst .,1996
2308,approximate query processing using wavelets,"kyuseok shim , kaushik chakrabarti , minos n. garofalakis , rajeev rastogi",vldb,2000
2309,actiview : adaptive data presentation using supersql,"motomichi toyama , yoko maeda",vldb,2001
2310,bypassing joins in disjunctive queries,"alfons kemper , guido moerkotte , klaus peithner , michael steinbrunn",vldb,1995
2311,applying data mining techniques to a health insurance information system,"michael j. rothman , john p. nearhos , marisa s. viveros",vldb,1996
2312,on views and xml,serge abiteboul,sigmod record,1999
2313,mining fuzzy association rules in databases,"ada wai-chee fu , man hon wong , chan man kuok",sigmod record,1998
2314,self-tuning database technology and information services : from wishful thinking to viable engineering,"peter zabback , christof hasse , gerhard weikum , axel mönkeberg",vldb,2002
2315,deeds towards a distributed and active real-time database system,"joakim eriksson , jonas mellin , sten andler , mikael berndtsson , bengt eftring , jörgen hansson",sigmod record,1996
2316,experiences in mining aviation safety data,"zohreh nazeri , paul ostwald , eric bloedorn",sigmod conference,2001
2317,adaptive filters for continuous queries over distributed data streams,"jennifer widom , chris olston , jing jiang",sigmod conference,2003
2318,semantic assumptions and query evaluation in temporal databases,"sushil jajodia , xiaoyang sean wang , elisa bertino , claudio bettini",sigmod conference,1995
2319,hardware acceleration for spatial selections and joins,"chengyu sun , divyakant agrawal , amr el abbadi",sigmod conference,2003
2320,data partitioning and load balancing in parallel disk systems,"gerhard weikum , peter zabback , peter scheuermann",vldb j.,1998
2321,dictionary-based order-preserving string compression,gennady antoshenkov,vldb j.,1997
2322,"a response to r. camps ' article `` domains , relations and religious wars ''",c. j. date,sigmod record,1996
2323,chair 's message,m. tamer özsu,sigmod record,2001
2324,an alternative storage organization for rolap aggregate views based on cubetrees,"yannis kotidis , nick roussopoulos",sigmod conference,1998
2325,editor 's notes,michael j. franklin,sigmod record,1999
2326,capturing both types and constraints in data integration,"juliana freire , rajeev rastogi , michael benedikt , wenfei fan , chee yong chan",sigmod conference,2003
2327,"preservation of digital data with self-validating , self-instantiating knowledge-based archives","reagan moore , bertram ludäscher , richard marciano",sigmod record,2001
2328,tools and transformations - rigorous and otherwise - for practical database design,"david s. reiner , arnon rosenthal",acm trans . database syst .,1994
2329,normalization in oodb design,byung suk lee,sigmod record,1995
2330,scientific journals : extinction or explosion ? ( panel ),"gio wiederhold , abraham silberschatz , gerhard rossbach , raghu ramakrishnan , jaco zijlstra , hector garcia-molina",vldb,1995
2331,using schema matching to simplify heterogeneous data translation,"tova milo , sagit zohar",vldb,1998
2332,an asynchronous avoidance-based cache consistency algorithm for client caching dbmss,"ronald c. unrau , kaladhar voruganti , m. tamer özsu",vldb,1998
2333,multi-dimensional clustering : a new data layout scheme in db2,"bishwaranjan bhattacharjee , sriram padmanabhan , matthew huras , leslie cranston , timothy malkemus",sigmod conference,2003
2334,incorporating xsl processing into database engines,guido moerkotte,vldb,2002
2335,streaming queries over streaming data,"michael j. franklin , sirish chandrasekaran",vldb,2002
2336,e.piphany epicenter technology overview,sridhar ramaswamy,vldb,2000
2337,a unified framework for enforcing multiple access control policies,"v. s. subrahmanian , elisa bertino , pierangela samarati , sushil jajodia",sigmod conference,1997
2338,a case for fractured mirrors,"david j. dewitt , ravishankar ramamurthy , qi su",vldb j.,2003
2339,building notification services with microsoft sqlserver,praveen seshadri,sigmod conference,2003
2340,mining deviants in a time series database,"s. muthukrishnan , h. v. jagadish , nick koudas",vldb,1999
2341,querying multiple features of groups in relational databases,"damianos chatziantoniou , kenneth a. ross",vldb,1996
2342,hypothetical queries in an olap environment,"thanos papadimitriou , andrey balmin , yannis papakonstantinou",vldb,2000
2343,mining email content for author identification forensics,"george m. mohay , m. corney , a. anderson , olivier y. de vel",sigmod record,2001
2344,computing capabilities of mediators,"chen li , ramana yerneni , jeffrey d. ullman , hector garcia-molina",sigmod conference,1999
2345,the strip rule system for efficiently maintaining derived data,"hector garcia-molina , jennifer widom , brad adelberg",sigmod conference,1997
2346,adaptive index structures,"yufei tao , dimitris papadias",vldb,2002
2347,functional properties of information filtering,"masahiko tsukamoto , shojiro nishio , tsutomu terada , rie sawai , yin-huei loh",vldb,2001
2348,incremental updates of inverted lists for text document retrieval,"hector garcia-molina , anthony tomasic , kurt a. shoens",sigmod conference,1994
2349,recovery protocols for shared memory database systems,"lory d. molesky , krithi ramamritham",sigmod conference,1995
2350,hyperstorm - administering structured documents using object-oriented database technology,"karl aberer , klemens böhm",sigmod conference,1996
2351,multi-dimensional resource scheduling for parallel queries,"yannis e. ioannidis , minos n. garofalakis",sigmod conference,1996
2352,"industrial panel on data warehousing technologies : experiences , challenges , and directions",umeshwar dayal,vldb,1999
2353,2q : a low overhead high performance buffer management replacement algorithm,"dennis shasha , theodore johnson",vldb,1994
2354,hd-eye : visual clustering of high dimensional data,"daniel a. keim , markus wawryniuk , alexander hinneburg",sigmod conference,2002
2355,intelligent rollups in multidimensional olap data,"sunita sarawagi , gayatri sathe",vldb,2001
2356,theory of dependence values,rosa meo,acm trans . database syst .,2000
2357,a multi-similarity algebra,"v. s. subrahmanian , sibel adali , maria luisa sapino , piero a. bonatti",sigmod conference,1998
2358,the challenge of process data warehousing,"matthias jarke , jörg köller , thomas list",vldb,2000
2359,report on ngits ' 99 : the 4th international workshop on next generation information technologies and systems,opher etzion,sigmod record,1999
2360,scientist 's called upon to take actions,xiaolei qian,sigmod record,1996
2361,temporal queries in olap,"alberto o. mendelzon , alejandro a. vaisman",vldb,2000
2362,temporal fds on complex objects,jef wijsen,acm trans . database syst .,1999
2363,condition handling in sql persistent stored modules,jeff richey,sigmod record,1995
2364,materialized view selection and maintenance using multi-query optimization,"krithi ramamritham , hoshi mistry , prasan roy , s. sudarshan",sigmod conference,2001
2365,wave-indices : indexing evolving databases,"hector garcia-molina , narayanan shivakumar",sigmod conference,1997
2366,phrase matching in xml,"sihem amer-yahia , mary f. fernandez , yu xu , divesh srivastava",vldb,2003
2367,similarity query processing using disk arrays,"apostolos papadopoulos , yannis manolopoulos",sigmod conference,1998
2368,interview with jim gray,marianne winslett,sigmod record,2003
2369,selectivity estimation in spatial databases,"viswanath poosala , sridhar ramaswamy , swarup acharya",sigmod conference,1999
2370,chip-secured data access : confidential data on untrusted servers,"philippe pucheral , luc bouganim",vldb,2002
2371,editorial,richard t. snodgrass,acm trans . database syst .,2001
2372,diag-join : an opportunistic join algorithm for 1 : n relationships,"sven helmer , guido moerkotte , till westmann",vldb,1998
2373,demonstration : enabling scalable online personalization on the web,"debra e. vandermeer , krithi ramamritham , anindya datta , kaushik dutta , helen m. thomas",vldb,2000
2374,the garlic project,"manish arya , mary tork roth , laura m. haas , joachim thomas ii , michael j. carey , edward l. wimmers , peter m. schwarz , william f. cody , ronald fagin",sigmod conference,1996
2375,database de-centralization - a practical approach,"césar a. galindo-legaria , eirik dahle , tor didriksen",vldb,1995
2376,towards an odmg-compliant visual object query language,"manoj chavda , peter t. wood",vldb,1997
2377,timer-driven database triggers and alerters : semantics and a challenge,"eric n. hanson , lloyd noronha",sigmod record,1999
2378,recovering information from summary data,"nikolaos sidiropoulos , christos faloutsos , h. v. jagadish",vldb,1997
2379,efficient construction of regression trees with range and region splitting,"shinichi morishita , yasuhiko morimoto , hiromu ishii",vldb,1997
2380,interview with pat selinger,marianne winslett,sigmod record,2003
2381,belief reasoning in mls deductive databases,hasan m. jamil,sigmod conference,1999
2382,"using taxonomy , discriminants , and signatures for navigating in text databases","byron dom , rakesh agrawal , prabhakar raghavan , soumen chakrabarti",vldb,1997
2383,experiences in federated databases : from iro-db to miro-web,"anthony tomasic , peter fankhauser , j. muñoz , m. lopez , georges gardarin",vldb,1998
2384,data stream query processing : a tutorial,"divesh srivastava , nick koudas",vldb,2003
2385,erratum : a database model for object dynamics,"mike p. papazoglou , bernd j. krämer",vldb j.,1997
2386,data extraction and transformation for the data warehouse,cass squire,sigmod conference,1995
2387,secure and portable database extensibility,"tobias mayr , thorsten von eicken , michael w. godfrey , praveen seshadri",sigmod conference,1998
2388,balancing histogram optimality and practicality for query result size estimation,"yannis e. ioannidis , viswanath poosala",sigmod conference,1995
2389,niagaracq : a scalable continuous query system for internet databases,"yuan wang , feng tian , david j. dewitt , jianjun chen",sigmod conference,2000
2390,fast incremental indexing for full-text information retrieval,"w. bruce croft , james p. callan , eric w. brown",vldb,1994
2391,reminiscences on influential papers,"kenneth a. ross , beng chin ooi , frank neven",sigmod record,2003
2392,the hcc-tree : an efficient index structure for object oriented databases,"b. sreenath , s. seshadri",vldb,1994
2393,medical information systems : characterization and challenges,"lynn l. peterson , jorge c. g. ramirez , lon a. smith",sigmod record,1994
2394,concept based design of data warehouses : the dwq demonstrators,"panos vassiliadis , spyros ligoudistianos , diego calvanese , christoph quix , maurizio lenzerini , matthias jarke , enrico franconi , yannis vassiliou",sigmod conference,2000
2395,webdb ' 98 : international workshop on the web and databases,"alberto o. mendelzon , paolo atzeni",sigmod record,1998
2396,"response to the march 1994 odmg-93 commentary written by dr. won kim of unisql , inc",object database management group,sigmod record,1994
2397,selectivity estimation without the attribute value independence assumption,"viswanath poosala , yannis e. ioannidis",vldb,1997
2398,the history of histograms ( abridged ),yannis e. ioannidis,vldb,2003
2399,evolution and change in data management - issues and directions,"kathleen hornsby , heidi gregersen , lex wedemeijer , tomi männistö , john f. roddick , florida estrella , federica mandreoli , marlon dumas , lina al-jadir , enric mayol , leopoldo e. bertossi , jens lufter",sigmod record,2000
2400,an efficient method for performing record deletions and updates using index scans,c. mohan,vldb,2002
2401,a study on the management of semantic transaction for efficient data retrieval,"chih-he li , irene s. y. kwan , shi-ming huang",sigmod record,2002
2402,relational data sharing in peer-based data management systems,"beng chin ooi , yanfeng shu , kian-lee tan",sigmod record,2003
2403,views in a large scale xml repository,"dan vodislav , sophie cluet , pierangelo veltri",vldb,2001
2404,a database model for object dynamics,"mike p. papazoglou , bernd j. krämer",vldb j.,1997
2405,the bea/xqrl streaming xquery processor,"geetika agrawal , paul lucas , arvind sundararajan , fabio riccardi , michael j. carey , daniela florescu , donald kossmann , till westmann , chris hillery",vldb,2003
2406,describing and using query capabilities of heterogeneous sources,"yannis papakonstantinou , vasilis vassalos",vldb,1997
2407,the asilomar report on database research,"gerald held , hector garcia-molina , michael lesk , jim gray , philip a. bernstein , david maier , h. v. jagadish , michael stonebraker , stefano ceri , joseph m. hellerstein , david j. dewitt , jeffrey d. ullman , michael l. brodie , jeffrey f. naughton , michael j. franklin , hamid pirahesh",sigmod record,1998
2408,public : a decision tree classifier that integrates building and pruning,"kyuseok shim , rajeev rastogi",vldb,1998
2409,efficient exploration of large scientific databases,"gustavo alonso , etzard stolte",vldb,2002
2410,a predicate-based caching scheme for client-server database architectures,"julie basu , arthur m. keller",vldb j.,1996
2411,a database approach to quality of service specification in video databases,"mohand-said hacid , elisa bertino , ahmed k. elmagarmid",sigmod record,2003
2412,on optimal node splitting for r-trees,"yván j. garcía , scott t. leutenegger , mario a. lopez",vldb,1998
2413,an overview of repository technology,"philip a. bernstein , umeshwar dayal",vldb,1994
2414,hypergraph based reorderings of outer join queries with complex predicates,"gautam bhargava , balakrishna r. iyer , piyush goel",sigmod conference,1995
2415,amalgamating knowledge bases,v. s. subrahmanian,acm trans . database syst .,1994
2416,filtering with approximate predicates,"hector garcia-molina , narayanan shivakumar , chandra chekuri",vldb,1998
2417,semantic compression and pattern extraction with fascicles,"j. madar , raymond t. ng , h. v. jagadish",vldb,1999
2418,picodbms : scaling down database techniques for the smartcard,"patrick valduriez , philippe pucheral , christophe bobineau , luc bouganim",vldb j.,2001
2419,relating distributed objects,"r. g. g. cattell , bruce e. martin",vldb,1994
2420,an adaptive hybrid server architecture for client caching odbmss,"m. tamer özsu , kaladhar voruganti , ronald c. unrau",vldb,1999
2421,"integrating temporal , real-time , and active databases","john a. stankovic , krithi ramamritham , ming xiong , rajendran m. sivasankaran , donald f. towsley",sigmod record,1996
2422,efficient view maintenance at data warehouses,"tolga yurek , divyakant agrawal , amr el abbadi , ambuj k. singh",sigmod conference,1997
2423,efficient dynamic mining of constrained frequent sets,"laks v. s. lakshmanan , raymond t. ng , carson kai-sang leung",acm trans . database syst .,2003
2424,"agents , turst , and information access on the semantic web","timothy w. finin , anupam joshi",sigmod record,2002
2425,template-based wrappers in the tsimmis system,"joachim hammer , hector garcia-molina , svetlozar nestorov , ramana yerneni , markus m. breunig , vasilis vassalos",sigmod conference,1997
2426,geo/environmental and medical data management in the rasdaman system,"norbert widmann , paula furtado , peter baumann , roland ritsch",vldb,1997
2427,journal relevance,richard t. snodgrass,sigmod record,2003
2428,holistic twig joins : optimal xml pattern matching,"divesh srivastava , nick koudas , nicolas bruno",sigmod conference,2002
2429,maintenance of automatic summary tables,"richard sidle , wolfgang lehner , hamid pirahesh , roberta cochrane",sigmod conference,2000
2430,challenges for global information systems,"alon y. levy , divesh srivastava , abraham silberschatz , maria zemankova",vldb,1994
2431,mediator languages - a proposal for a standard,"peter buneman , louiqa raschid , jeffrey d. ullman",sigmod record,1997
2432,xml repository and active views demonstration,"bruno tessier , amélie marian , brendan hills , sophie cluet , jean-claude mamou , bernd amann , anne-marie vercoustre , frédéric hubert , vincent aguilera , laurent mignet , serge abiteboul , sébastien ailleret , tova milo , cassio souza dos santos",vldb,1999
2433,semantic b2b integration : issues in ontology-based applications,"zhan cui , paul o'brien , dean m. jones",sigmod record,2002
2434,estimating page fetches for index scans with finite lru buffers,"k. bernhard schiefer , arun n. swami",vldb j.,1995
2435,a language based multidatabase system,"konrad schwarz , eva kühn , thomas tschernko",sigmod conference,1994
2436,a pattern-based object calculus,"stanley y. w. su , nabil kamel , ping wu",vldb j.,1994
2437,title,?,vldb j.,1995
2438,sql/cli - a new binding style for sql,"murali venkatrao , michael pizzo",sigmod record,1995
2439,a study on data point search for hg-trees,"paul h. lewis , joseph kuan",sigmod record,1999
2440,object fusion in mediator systems,"yannis papakonstantinou , hector garcia-molina , serge abiteboul",vldb,1996
2441,serviceglobe : distributing e-services across the internet,"konrad stocker , alfons kemper , stefan seltzsam , markus keidl",vldb,2002
2442,massive stochastic testing of sql,donald r. slutz,vldb,1998
2443,efficiently mining long patterns from databases,roberto j. bayardo jr.,sigmod conference,1998
2444,"design , implementation , and performance of the lham log-structured history data access method","gerhard weikum , peter muth , patrick e. o'neil , achim pick",vldb,1998
2445,oasis : an online and accurate technique for local-alignment searches on biological sequences,"shruti kasetty , colin meek , jignesh m. patel",vldb,2003
2446,incremental computation of nested relational query expressions,"leo mark , lars bækgaard",acm trans . database syst .,1995
2447,indexing the positions of continuously moving objects,"mario a. lopez , simonas saltenis , christian s. jensen , scott t. leutenegger",sigmod conference,2000
2448,exploratory mining via constrained frequent set queries,"jiawei han , teresa mah , laks v. s. lakshmanan , raymond t. ng",sigmod conference,1999
2449,real world requirements for decision support - implications for rdbms,sanju k. bansal,sigmod conference,1995
2450,mind your vocabulary : query mapping across heterogeneous information sources,"kevin chen-chuan chang , hector garcia-molina",sigmod conference,1999
2451,fast incremental maintenance of approximate histograms,"viswanath poosala , phillip b. gibbons , yossi matias",acm trans . database syst .,2002
2452,temporal conditions and integrity constraints in active database systems,"ouri wolfson , a. prasad sistla",sigmod conference,1995
2453,the rubicon of smart data,roger king,vldb,2002
2454,practical lessons in supporting large-scale computational science,"terence critchlow , ron musick",sigmod record,1999
2455,on database theory and xml,dan suciu,sigmod record,2001
2456,seeking the truth about ad hoc join costs,"amit shukla , miron livny , michael j. carey , laura m. haas",vldb j.,1997
2457,a framework for clustering evolving data streams,"philip s. yu , charu c. aggarwal , jiawei han , jianyong wang",vldb,2003
2458,"title , foreword , special issue editorial",?,vldb j.,1994
2459,vipas : virtual link powered authority search in the web,"ming-syan chen , chi-chun lin",vldb,2003
2460,very large databases in a commercial application environment,karl-heinz hess,vldb,1996
2461,mil primitives for querying a fragmented world,"martin l. kersten , peter a. boncz",vldb j.,1999
2462,efficiently publishing relational data as xml documents,"bruce g. lindsay , hamid pirahesh , berthold reinwald , michael j. carey , rimon barr , jayavel shanmugasundaram , eugene j. shekita",vldb j.,2001
2463,"enterprise objects framework , a second generation object-relational enabler",charly kleissner,sigmod conference,1995
2464,enabling dynamic content caching for database-driven web sites,"qiong luo , divyakant agrawal , wen-syan li , wang-pin hsiung , k. selçuk candan",sigmod conference,2001
2465,memory management during run generation in external sorting,"goetz graefe , per-åke larson",sigmod conference,1998
2466,dynamic resource brokering for multi-user query execution,"diane l. davison , goetz graefe",sigmod conference,1995
2467,acdn : a content delivery network for applications,"michael rabinovich , pradnya karbhari , fred douglis , zhen xiao",sigmod conference,2002
2468,updates for structure indexes,"jeffrey f. naughton , pradeep shenoy , raghav kaushik , philip bohannon",vldb,2002
2469,an efficient and resilient approach to filtering and disseminating streaming data,"krithi ramamritham , shyamshankar dharmarajan , shetal shah",vldb,2003
2470,editorial,richard t. snodgrass,acm trans . database syst .,2001
2471,shooting stars in the sky : an online algorithm for skyline queries,"donald kossmann , frank ramsak , steffen rost",vldb,2002
2472,metrics for accessing heterogeneous data : is there any hope ? ( panel ),"michael stonebraker , nicholas j. belkin , gio wiederhold , erich j. neuhold , leonard j. seligman",vldb,1995
2473,"research and practice in federated information systems , report of the efis ' 2000 international workshop","ralf-detlef kutsche , geert-jan houben , mark roantree , bodo rieger , wilhelm hasselbring , kazimierz subieta , willem-jan van den heuvel",sigmod record,2000
2474,on the semantics of `` now '' in databases,"christian s. jensen , tomás isakowitz , richard t. snodgrass , curtis e. dyreson , james clifford",acm trans . database syst .,1997
2475,efficient numerical error bounding for replicated network services,"haifeng yu , amin vahdat",vldb,2000
2476,extracting large-scale knowledge bases from the web,"andrew tomkins , prabhakar raghavan , ravi kumar , sridhar rajagopalan",vldb,1999
2477,the microsoft database research group,"roger s. barga , david b. lomet , per-åke larson , surajit chaudhuri , vivek r. narasayya",sigmod record,1998
2478,database research : achievements and opportunities into the 21st century,"jeffrey d. ullman , abraham silberschatz , michael stonebraker",sigmod record,1996
2479,flexible and scalable digital library search,"peter m. g. apers , milan petkovic , roelof van zwol , menzo windhouwer , henk ernst blok , martin l. kersten , willem jonker",vldb,2001
2480,databases on the web : technologies for federation architectures and case studies ( tutorial ),ralf kramer,sigmod conference,1997
2481,editor 's notes,michael j. franklin,sigmod record,1997
