record_id,document_title,author_list,venue_name,creation_year
2092,xpath queries on streaming data,"sudarshan s. chawathe , feng peng",sigmod conference,2003
2093,sigmod anthology editor 's message,michael ley,sigmod record,2000
2094,query evaluation in deductive databases with alternating fixpoint semantics,weidong chen,acm trans . database syst .,1995
2095,query caching and optimization in distributed mediator systems,"sibel adali , yannis papakonstantinou , k. selçuk candan , v. s. subrahmanian",sigmod conference,1996
2096,managing intra-operator parallelism in parallel database systems,"david j. dewitt , manish mehta",vldb,1995
2097,continuous k-nearest neighbor queries for continuously moving points with updates,"hanan samet , ken smith , glenn s. iwerks",vldb,2003
2098,the network is the database : data management for highly distributed systems,"michael j. wynblatt , julio c. navas",sigmod conference,2001
2099,amicalola report : database and information system research challenges and opportunities in semantic web and enterprises,"robert meersman , amit p. sheth",sigmod record,2002
2100,building a laboratory information system around a c++ - based object-oriented dbms,"nathan goodman , steve rozen , lincoln stein",vldb,1994
2101,xxl - a library approach to supporting efficient implementations of advanced database queries,"björn blohsfeld , jens-peter dittrich , martin schneider , bernhard seeger , tobias schäfer , jochen van den bercken , jürgen krämer",vldb,2001
2102,querying continuous time sequences,"tore risch , ling lin",vldb,1998
2103,xiss/r : xml indexing and storage system using rdbms,"philip j. harding , bongki moon , quanzhong li",vldb,2003
2104,implementation of sql3 structured types with inheritance and value substitutability,"nelson mendonça mattos , serge rielau , bruce g. lindsay , stefan deßloch , you-chin fuh , brian t. tran , danko mannhaupt , linda demichel , weidong chen",vldb,1999
2105,accelerating xpath location steps,torsten grust,sigmod conference,2002
2106,indexing multiple sets,"christoph kilger , guido moerkotte",vldb,1994
2107,improved query performance with variant indexes,"patrick e. o'neil , dallan quass",sigmod conference,1997
2108,"olap , relational , and multidimensional database systems",george colliat,sigmod record,1996
2109,new concurrency control algorithms for accessing and compacting b-trees,"andrea zisman , v. w. setzer",vldb,1994
2110,update propagation strategies for improving the quality of data on the web,"nick roussopoulos , alexandros labrinidis",vldb,2001
2111,information director 's message,alberto o. mendelzon,sigmod record,2000
2112,a performance study of transitive closure algorithms,"raghu ramakrishnan , shaul dar",sigmod conference,1994
2113,"data management in ecommerce : the good , the bad , and the ugly",avigdor gal,sigmod conference,2000
2114,efficiently publishing relational data as xml documents,"berthold reinwald , jayavel shanmugasundaram , michael j. carey , eugene j. shekita , hamid pirahesh , bruce g. lindsay , rimon barr",vldb,2000
2115,on parallel processing of aggregate and scalar functions in object-relational dbms,"michael jaedicke , bernhard mitschang",sigmod conference,1998
2116,performing jobs without decompression in a compressed database system,"n. winterbottom , s. j. o'connell",sigmod record,2003
2117,"replication : db2 , oracle , or sybase ?",doug stacey,sigmod record,1995
2118,query processing techniques for multiversion access methods,"jochen van den bercken , bernhard seeger",vldb,1996
2119,garbage collection in object oriented databases using transactional cyclic reference counting,"s. sudarshan , prasan roy , abraham silberschatz , s. seshadri , srinivas ashwin",vldb,1997
2120,"information , communication , and money : for what can we charge and how can we meter it ?","henry f. korth , stephen blott , abraham silberschatz",vldb,1998
2121,an axiomatic model of dynamic schema evolution in objectbase systems,"m. tamer özsu , randal j. peters",acm trans . database syst .,1997
2122,lightweight flexible isolation for language-based extensible systems,"laurent daynès , grzegorz czajkowski",vldb,2002
2123,the wasa2 object-oriented workflow management system,"mathias weske , gottfried vossen",sigmod conference,1999
2124,plan-per-tuple optimization solution - parallel execution of expensive user-defined functions,"felipe cariño , william o'connell",vldb,1998
2125,efficient schemes for managing multiversionxml documents,"shu-yao chien , carlo zaniolo , vassilis j. tsotras",vldb j.,2002
2126,active views for electronic commerce,"laurent mignet , serge abiteboul , tova milo , adi eyal , bernd amann , sophie cluet",vldb,1999
2127,implementing xquery 1.0 : the galax experience,"gargi sur , mary f. fernandez , amélie marian , jérôme siméon , byron choi",vldb,2003
2128,rainbow : multi-xquery optimization using materialized xml views,"brian murphy , elke a. rundensteiner , bradford pielech , maged el-sayed , mukesh mulchandani , luping ding , katica dimitrova , ling wang , xin zhang",sigmod conference,2003
2129,promises and realities of active database systems,"eric simon , angelika kotz dittrich",vldb,1995
2130,editor 's notes,ling liu,sigmod record,2003
2131,the trigs active object-oriented database system - an overview,"gerti kappel , werner retschitzegger",sigmod record,1998
2132,constructing efficient decision trees by using optimized numeric association rules,"takeshi fukuda , yasuhiko morimoto , takeshi tokuyama , shinichi morishita",vldb,1996
2133,improving data access of j2ee applications by exploiting asynchronous messaging and caching services,"samuel kounev , alejandro p. buchmann",vldb,2002
2134,addressing techniques used in database object managers o2 and orion,"nadjiba sahraoui , andré gamache",sigmod record,1995
2135,complex relationships and knowledge discovery support in the infoquilt system,"amit p. sheth , sanjeev thacker , shuchi patel",vldb j.,2003
2136,dyda : data warehouse maintenance in fully concurrent environments,"songting chen , andreas koeller , elke a. rundensteiner , xin zhang , jun chen",sigmod conference,2001
2137,processing sliding window multi-joins in continuous queries over data streams,"lukasz golab , m. tamer özsu",vldb,2003
2138,user-cognizant multidimensional analysis,sunita sarawagi,vldb j.,2001
2139,bluetooth-based sensor networks,"philippe bonnet , allan beaufour , mads bondo dydensborg , martin leopold",sigmod record,2003
2140,active storage for large-scale data mining and multimedia,"garth a. gibson , erik riedel , christos faloutsos",vldb,1998
2141,the evolution of the web and implications for an incremental crawler,"junghoo cho , hector garcia-molina",vldb,2000
2142,managing distributed workspaces with active xml,"angela bonifati , cosmin cremarenco , tova milo , gregory cobena , ioana manolescu , florin dragan , jérôme baumgarten , nicoleta preda , serge abiteboul",vldb,2003
2143,data warehouse configuration,"timos k. sellis , dimitri theodoratos",vldb,1997
2144,database principles column - introduction,leonid libkin,sigmod record,1999
2145,a language for manipulating arrays,"arunprasad p. marathe , kenneth salem",vldb,1997
2146,extracting large data sets using db2 parallel edition,sriram padmanabhan,vldb,1996
2147,the whips prototype for data warehouse creation and maintenance,"hector garcia-molina , himanshu gupta , wilburt labio , yue zhuge , janet l. wiener , jennifer widom",sigmod conference,1997
2148,reminiscences on influential papers,"gerhard weikum , alon y. levy , divesh srivastava , eric simon , patrick e. o'neil , victor vianu , kenneth a. ross , christos faloutsos",sigmod record,2000
2149,mixed mode xml query processing,"stratis viglas , josef burger , leonidas galanis , jeffrey f. naughton , alan halverson , rajasekar krishnamurthy , david j. dewitt , feng tian , ameet kini , yuan wang , ajith nagaraja rao",vldb,2003
2150,adaptive selectivity estimation using query feedback,"chung-min chen , nick roussopoulos",sigmod conference,1994
2151,secure bufering in firm real-time database systems,"jayant r. haritsa , binto george",vldb j.,2000
2152,the impact of technology on commercial transaction processing,edward e. cobb,vldb j.,1997
2153,garlic : a new flavor of federated query processing for db2,"peter m. schwarz , laura m. haas , vanja josifovski , eileen tien lin",sigmod conference,2002
2154,graphical interaction with heterogeneous databases,"tiziana catarci , john cardiff , giuseppe santucci",vldb j.,1997
2155,knowledge discovery in data warehouses,themistoklis palpanas,sigmod record,2000
2156,nd-sql : a multi-dimensional language for interoperability and olap,"laks v. s. lakshmanan , frédéric gingras",vldb,1998
2157,quiet : continuous query-driven index tuning,"eike schallehn , ingolf geist , kai-uwe sattler",vldb,2003
2158,implementing crash recovery in quickstore : a performance study,"seth j. white , david j. dewitt",sigmod conference,1995
2159,the microsoft repository,"david shutt , jason zander , brian harry , paul sanders , philip a. bernstein",vldb,1997
2160,an annotated bibliography of benchmarks for object databases,akmal b. chaudhri,sigmod record,1995
2161,efficient structural joins on indexed xml documents,"zografoula vagena , shu-yao chien , vassilis j. tsotras , carlo zaniolo , donghui zhang",vldb,2002
2162,foundations of preferences in database systems,werner kießling,vldb,2002
2163,data mining : concepts and techniques - book review,"fernando berzal galiano , nicolás marín",sigmod record,2002
2164,bifocal sampling for skew-resistant join size estimation,"abraham silberschatz , sumit ganguly , yossi matias , phillip b. gibbons",sigmod conference,1996
2165,a transducer-based xml query processor,"bertram ludäscher , pratik mukhopadhyay , yannis papakonstantinou",vldb,2002
2166,alias : an active learning led interactive deduplication system,"anuradha bhamidipaty , sunita sarawagi , chandra mouli , alok kirpal",vldb,2002
2167,topological relations in the world of minimum bounding rectangles : a study with r-trees,"dimitris papadias , timos k. sellis , yannis theodoridis , max j. egenhofer",sigmod conference,1995
2168,experience report : exploiting advanced database optimization features for large-scale sap r/3 installations,"bernhard zeller , alfons kemper",vldb,2002
2169,an annotated bibliography on active databases,"johann christoph freytag , ulrike jaeger",sigmod record,1995
2170,optimizing view queries in rolex to support navigable result trees,"pradeep shenoy , philip bohannon , p. p. s. narayan , henry f. korth , sumit ganguly",vldb,2002
2171,miro web : integrating multiple data sources through semistructured data types,"fei sha , tatiana chan-sine-ying , georges gardarin , tuyet-tram dang-ngoc , jean-luc darroux , luc bouganim",vldb,1999
2172,ofl : a functional execution model for object query languages,"georges gardarin , fernando machuca , philippe pucheral",sigmod conference,1995
2173,"information visualization , guest editors ' foreword","tiziana catarci , isabel f. cruz",sigmod record,1996
2174,a critique of ansi sql isolation levels,"philip a. bernstein , patrick e. o'neil , hal berenson , elizabeth j. o'neil , jim melton , jim gray",sigmod conference,1995
2175,issues and evaluations of caching solutions for web application acceleration,"oliver po , divyakant agrawal , radu sion , wen-syan li , wang-pin hsiung , dmitri v. kalashnikov , k. selçuk candan",vldb,2002
2176,generating dynamic content at database-backed web servers : cgi-bin vs. mod_perl,"alexandros labrinidis , nick roussopoulos",sigmod record,2000
2177,database performance in the real world - tpc-d and sap r/3 ( experience paper ),"jochen doppelhammer , donald kossmann , thomas höppler , alfons kemper",sigmod conference,1997
2178,advances in real-time database systems research,azer bestavros,sigmod record,1996
2179,opt + + : an object-oriented implementation for extensible database query optimization,"david j. dewitt , navin kabra",vldb j.,1999
2180,comparing hierarchical data in external memory,sudarshan s. chawathe,vldb,1999
2181,standards in practice,"jim melton , andrew eisenberg",sigmod record,1998
2182,dalí : a high performance main memory storage manager,"s. sudarshan , h. v. jagadish , rajeev rastogi , abraham silberschatz , daniel f. lieuwen",vldb,1994
2183,odefs : a file system interface to an object-oriented database,"narain h. gehani , william d. roome , h. v. jagadish",vldb,1994
2184,"some remarks on variable independence , closure , and orthographic dimension in constraint databases",leonid libkin,sigmod record,1999
2185,further improvements on integrity constraint checking for stratifiable deductive databases,"sin yeung lee , tok wang ling",vldb,1996
2186,fast algorithms for maintaining replica consistency in lazy master replicated databases,"eric simon , esther pacitti , pascale minet",vldb,1999
2187,scalablity and availability in oracle7 7.3,dieter gawlick,vldb,1996
2188,algorithms for mining distance-based outliers in large datasets,"raymond t. ng , edwin m. knorr",vldb,1998
2189,automating physical database design in a parallel database,"chun zhang , guy m. lohman , jun rao , nimrod megiddo",sigmod conference,2002
2190,fast time sequence indexing for arbitrary lp norms,"christos faloutsos , byoung-kee yi",vldb,2000
2191,on the issue of valid time ( s ) in temporal databases,"themis panayiotopoulos , efstathios v. ioannidis , constantine d. spyropoulos , stavros kokkotos",sigmod record,1995
2192,an algebraic approach to rule analysis in expert database systems,"jennifer widom , elena baralis",vldb,1994
2193,a formal perspective on the view selection problem,"dan suciu , rada chirkova , alon y. halevy",vldb,2001
2194,semantic and pedagogic interoperability mechanisms in the ariadne educational repository,"erik duval , eddy forte , kris cardinaels , koen hendrikx , florence haenni , maria wentland forte , florence simillion , ken warkentyne , e. vervaet",sigmod record,1999
2195,concurrency and recovery in generalized search trees,"c. mohan , joseph m. hellerstein , marcel kornacker",sigmod conference,1997
2196,parametric query optimization for linear and piecewise linear cost functions,"s. sudarshan , arvind hulgeri",vldb,2002
2197,approximate string joins in a database ( almost ) for free,"luis gravano , h. v. jagadish , panagiotis g. ipeirotis , s. muthukrishnan , divesh srivastava , nick koudas",vldb,2001
2198,editor 's ( farewell ) notes,arie segev,sigmod record,1995
2199,histogram-based approximation of set-valued query-answers,"viswanath poosala , yannis e. ioannidis",vldb,1999
2200,to weave the web,"paolo merialdo , giansalvatore mecca , paolo atzeni",vldb,1997
2201,the oracle universal server buffer,"ashok joshi , n. macnaughton , juan loaiza , m. keihl , tirthankar lahiri , william bridge",vldb,1997
2202,discovery of influence sets in frequently updated databases,"ioana stanoi , amr el abbadi , divyakant agrawal , mirek riedewald",vldb,2001
2203,editor 's notes,ling liu,sigmod record,2001
2204,maintenance of implication integrity constraints under updates to constraints,"naci ishakbeyoglu , z. meral özsoyoglu",vldb j.,1998
2205,redo recovery after system crashes,"mark r. tuttle , david b. lomet",vldb,1995
2206,middle-tier database caching for e-business,"hamid pirahesh , c. mohan , jeffrey f. naughton , sailesh krishnamurthy , honguk woo , qiong luo , bruce g. lindsay",sigmod conference,2002
2207,atomicity versus anonymity : distributed transactions for electronic commerce,j. d. tygar,vldb,1998
2208,an adaptive data replication algorithm,"ouri wolfson , yixiu huang , sushil jajodia",acm trans . database syst .,1997
2209,temporal aggregation in active database rules,"iakovos motakis , carlo zaniolo",sigmod conference,1997
2210,generalized search trees for database systems,"jeffrey f. naughton , avi pfeffer , joseph m. hellerstein",vldb,1995
2211,editor 's notes,jennifer widom,sigmod record,1995
2212,fast-start : quick fault recovery in oracle,"ashok joshi , ron weiss , amit ganesh , tirthankar lahiri",sigmod conference,2001
2213,a toolkit for negotiation support interfaces to multi-dimensional data,"matthias jarke , stephan jacobs , michael gebhardt",sigmod conference,1997
2214,"announcements from nsf , nasa , and elsewhere",xiaolei qian,sigmod record,1994
2215,fractal prefetching b ± trees : optimizing both cache and disk performance,"phillip b. gibbons , gary valentin , todd c. mowry , shimin chen",sigmod conference,2002
2216,schema mapping as query discovery,"renée j. miller , mauricio a. hernández , laura m. haas",vldb,2000
2217,object-oriented features of db2 client/server,hamid pirahesh,sigmod conference,1994
2218,the n-tier hub technology,"rainer a. sommer , david bailey , thomas r. gulledge",sigmod record,2002
2219,integration of heterogeneous databases without common domains using queries based on textual similarity,william w. cohen,sigmod conference,1998
2220,new sampling-based summary statistics for improving approximate query answers,"phillip b. gibbons , yossi matias",sigmod conference,1998
2221,performance tradeoffs for client-server query processing,"donald kossmann , michael j. franklin , björn þór jónsson",sigmod conference,1996
2222,selective information dissemination in p2p networks : problems and solutions,"stratos idreos , manolis koubarakis , christos tryfonopoulos , yannis drougas",sigmod record,2003
2223,self-tuning histograms : building histograms without looking at data,"surajit chaudhuri , ashraf aboulnaga",sigmod conference,1999
2224,lore : a database management system for semistructured data,"roy goldman , serge abiteboul , jennifer widom , dallan quass , jason mchugh",sigmod record,1997
2225,db2 spatial extender - spatial data within the rdbms,david w. adler,vldb,2001
2226,identifying representative trends in massive time series data sets using sketches,"s. muthukrishnan , nick koudas , piotr indyk",vldb,2000
2227,warping indexes with envelope transforms for query by humming,"dennis shasha , yunyue zhu",sigmod conference,2003
2228,obk - an online high energy physics ' meta-data repository,"l. pedro , v. kotov , i. papadopoulos , l. mapelli , a. ribeiro , a. amorim , r. hart , m. nassiakou , h. wolters , n. parrington , d. liko , yu . ryabov , r. jones , i. alexandrov , l. lucio , i. soloviev , m. caprini , e. badescu , s. kolos , m. dobson , l. moneta , d. schweiger , m. barczyk , a. kazarov , d. burckhart-chromek , m. mineev , j. flammer",vldb,2002
2229,"data mining using two-dimensional optimized accociation rules : scheme , algorithms , and visualization","shinichi morishita , yasuhiko morimoto , takeshi tokuyama , takeshi fukuda",sigmod conference,1996
2230,a top-down approach for two level serializability,"n. l. belkhodja , mourad ouzzani , m. a. atroun",vldb,1994
2231,xcerpt and visxcerpt : from pattern-based to visual querying of xml and semistructured data,"sacha berger , christoph wieser , sebastian schaffert , françois bry",vldb,2003
2232,query unnesting in object-oriented databases,leonidas fegaras,sigmod conference,1998
2233,an evaluation of generic bulk loading techniques,"jochen van den bercken , bernhard seeger",vldb,2001
2234,scientific olap for the biotech domain,nam huyn,vldb,2001
2235,privacy-preserving data mining,"ramakrishnan srikant , rakesh agrawal",sigmod conference,2000
2236,evaluating probabilistic queries over imprecise data,"reynold cheng , dmitri v. kalashnikov , sunil prabhakar",sigmod conference,2003
2237,managing uncertainty in sensor database,"sunil prabhakar , reynold cheng",sigmod record,2003
2238,fault tolerant design of multimedia servers,"richard r. muntz , leana golubchik , steven berson",sigmod conference,1995
2239,edgar f. codd : a tribute and personal memoir,c. j. date,sigmod record,2003
2240,new tpc benchmarks for decision support and web commerce,"meikel pöss , chris floyd",sigmod record,2000
2241,energy and rate based mac protocol for wireless sensor networks,"ramaraju kalidindi , vijay kumar , rajgopal kannan , s. sitharama iyengar",sigmod record,2003
2242,distributed top-n query processing with possibly uncooperative local systems,"clement t. yu , weiyi meng , george philip",vldb,2003
2243,searching on the secondary structure of protein sequences,"jignesh m. patel , laurie hammel",vldb,2002
2244,guest editor 's introduction,karl aberer,sigmod record,2003
2245,efficient concurrency control for broadcast environments,"arvind nithrakashyap , rajendran m. sivasankaran , jayavel shanmugasundaram , krithi ramamritham",sigmod conference,1999
2246,mining generalized association rules,"ramakrishnan srikant , rakesh agrawal",vldb,1995
2247,mobile computing and databases : anything new ?,"margaret h. dunham , abdelsalam helal",sigmod record,1995
2248,research issues for data communication in mobile ad-hoc network database systems,"leslie d. fife , le gruenwald",sigmod record,2003
2249,association rules over interval data,"renée j. miller , yuping yang",sigmod conference,1997
2250,xpath processing in a nutshell,"reinhard pichler , christoph koch , georg gottlob",sigmod record,2003
2251,location-based spatial queries,"jun zhang , dimitris papadias , manli zhu , yufei tao , dik lun lee",sigmod conference,2003
2252,building and customizing data-intensive web sites using weave,"valérie issarny , patrick valduriez , khaled yagoub , daniela florescu",vldb,2000
2253,stholes : a multidimensional workload-aware histogram,"luis gravano , nicolas bruno , surajit chaudhuri",sigmod conference,2001
2254,contextualizing the information space in federated digital libraries,"jeroen hoppenbrouwers , mike p. papazoglou",sigmod record,1999
2255,a formal perspective on the view selection problem,"rada chirkova , dan suciu , alon y. halevy",vldb j.,2002
2256,databases and workflow management : what is it all about ? ( panel ),"jim gray , betty salzberg , stefano ceri , andreas reuter , gerhard weikum",vldb,1995
2257,industry perspectives,leonard j. seligman,sigmod record,1997
2258,quotient cube : how to summarize the semantics of a data cube,"laks v. s. lakshmanan , jian pei , jiawei han",vldb,2002
2259,finding generalized projected clusters in high dimensional spaces,"charu c. aggarwal , philip s. yu",sigmod conference,2000
2260,hector garcia-molina speaks out,marianne winslett,sigmod record,2002
2261,efficient maintenance of materialized mediated views,"james j. lu , guido moerkotte , joachim schü , v. s. subrahmanian",sigmod conference,1995
2262,improving performance in replicated databases through relaxed coherency,"rainer gallersdörfer , matthias nicola",vldb,1995
2263,supporting procedural constructs in sql compilers,nelson mendonça mattos,vldb,1996
2264,the zero latency enterprise,dave liles,vldb,2000
2265,an environmental sensor network to determine drinking water quality and security,"jeanne vanbriesen , paul s. fischbeck , christos faloutsos , anastassia ailamaki , mitchell j. small",sigmod record,2003
2266,top-k selection queries over relational databases : mapping strategies and performance evaluation,"surajit chaudhuri , nicolas bruno , luis gravano",acm trans . database syst .,2002
2267,indexing large metric spaces for similarity search queries,"z. meral özsoyoglu , tolga bozkaya",acm trans . database syst .,1999
2268,approximating multi-dimensional aggregate range queries over real attributes,"carlotta domeniconi , vassilis j. tsotras , george kollios , dimitrios gunopulos",sigmod conference,2000
2269,linking business to deliver value : a data management challenge,anand deshpande,vldb,2000
2270,visdb : a system for visualizing large databases,"hans-peter kriegel , daniel a. keim",sigmod conference,1995
2271,wavecluster : a multi-resolution clustering approach for very large spatial databases,"surojit chatterjee , gholamhosein sheikholeslami , aidong zhang",vldb,1998
2272,mpeg-7 standard for multimedia databases,john r. smith,sigmod conference,2001
2273,on effective multi-dimensional indexing for strings,"nick koudas , h. v. jagadish , divesh srivastava",sigmod conference,2000
2274,e-commerce database issues and experience,anand rajaraman,sigmod conference,1999
2275,entrans : a system for flexible consistency maintenance in directory applications,"anandi herlekar , atul deopujari , shaymsunder gopale , shridhar shukla , krithi ramamritham",vldb,2002
2276,the design of an acquisitional query processor for sensor networks,"samuel madden , wei hong , joseph m. hellerstein , michael j. franklin",sigmod conference,2003
2277,dynamic sample selection for approximate query processing,"gautam das , surajit chaudhuri , brian babcock",sigmod conference,2003
2278,changing the rules : transformations for rule-based optimizers,"mitch cherniack , stanley b. zdonik",sigmod conference,1998
2279,potter 's wheel : an interactive data cleaning system,"joseph m. hellerstein , vijayshankar raman",vldb,2001
2280,staircase join : teach a relational dbms to watch its ( axis ) steps,"jens teubner , torsten grust , maurice van keulen",vldb,2003
2281,near neighbor search in large metric spaces,sergey brin,vldb,1995
2282,robust estimation with sampling and approximate pre-aggregation,chris jermaine,vldb,2003
2283,jumping on the nii bandwagon,xiaolei qian,sigmod record,1994
2284,ominisearch : a method for searching dynamic content on the web,"henrique paques , ling liu , david buttler , calton pu",sigmod conference,2001
2285,mid-tier caching : the timesten approach,times-ten team,sigmod conference,2002
2286,"do n't be lazy , be consistent : postgres-r , a new way to implement database replication","bettina kemme , gustavo alonso",vldb,2000
2287,engineering federated information systems : report of efis '99 workshop,"fèlix saltor , uwe hohenstein , ralf-detlef kutsche , wilhelm hasselbring , gunter saake , stefan conrad , mark roantree",sigmod record,1999
