record_id,document_title,author_list,venue_name,creation_year
2482,self-organizing data sharing communities with sagres,"igor tatarinov , wai tak theodora yeung , shiori betzler , jing su , jayant madhavan , rachel pottinger , alon y. levy , ewa jaslikowska , stefan saroiu , qiong chen , zachary g. ives",sigmod conference,2000
2483,"turmoil at nasa , and numerous funding announcements",xiaolei qian,sigmod record,1995
2484,self-serv : a platform for rapid composition of web services in a peer-to-peer environment,"eileen oi-yan mak , quan z. sheng , boualem benatallah , marlon dumas",vldb,2002
2485,a componentized architecture for dynamic electronic markets,"israel ben-shaul , benny reich",sigmod record,1998
2486,database systems management and oracle8,c. gregory doherty,sigmod conference,1998
2487,on computing correlated aggregates over continual data streams,"divesh srivastava , flip korn , johannes gehrke",sigmod conference,2001
2488,storing semistructured data with stored,"alin deutsch , mary f. fernandez , dan suciu",sigmod conference,1999
2489,a pictorial query language for querying geographic databases using positional and olap operators,"elaheh pourabbas , maurizio rafanelli",sigmod record,2002
2490,an efficient cost-driven index selection tool for microsoft sql server,"surajit chaudhuri , vivek r. narasayya",vldb,1997
2491,sigmod program review,richard t. snodgrass,sigmod record,2000
2492,cache coherency in oracle parallel server,boris klots,vldb,1996
2493,"the new locking , logging , and recovery architecture of microsoft sql server 7.0",david campbell,vldb,1999
2494,exact : an extensible approach to active object-oriented databases,"arturo jaime , oscar díaz",vldb j.,1997
2495,optimizing queries across diverse data sources,"edward l. wimmers , donald kossmann , jun yang , laura m. haas",vldb,1997
2496,editor 's notes,ling liu,sigmod record,2003
2497,unisql/x unified relational and object-oriented database system,won kim,sigmod conference,1994
2498,order-of-magnitude advantage of tpc-c though massive parallelism,charles levine,sigmod conference,1995
2499,exploiting versions for handling updates in broadcast disks,"evaggelia pitoura , panos k. chrysanthis",vldb,1999
2500,an overview of db2 parallel edition,"walter g. wilson , ambuj goyal , sriram padmanabhan , gilles fecteau , anant jhingran , chaitanya k. baru , hui-i hsiao",sigmod conference,1995
2501,on xml and databases : where 's the beef ? ( panel abstract ),michael j. carey,sigmod conference,2000
2502,declarative specification of web sites with strudel,"alon y. levy , dan suciu , daniela florescu , mary f. fernandez",vldb j.,2000
2503,parallel mining algorithms for generalized association rules with classification hierarchy,"masaru kitsuregawa , takahiko shintani",sigmod conference,1998
2504,the database research group at eth zurich,"hans-jörg schek , moira c. norrie , gerhard weikum , stephen blott",sigmod record,1994
2505,extended ehemeral logging : log storage management for applications with long lived transactions,"john s. keen , william j. dally",acm trans . database syst .,1997
2506,who needs xml databases ?,sophie cluet,vldb,2003
2507,conceptual model of web service reputation,"munindar p. singh , e. michael maximilien",sigmod record,2002
2508,tods reviewers,richard t. snodgrass,sigmod record,2003
2509,editor 's notes,michael j. franklin,sigmod record,1999
2510,sting : a statistical information grid approach to spatial data mining,"wei wang , richard r. muntz , jiong yang",vldb,1997
2511,re-tree : an efficient index structure for regular expressions,"chee yong chan , minos n. garofalakis , rajeev rastogi",vldb j.,2003
2512,phoenix : making applications robust,"david b. lomet , roger s. barga",sigmod conference,1999
2513,"data management : lasting impact of the wild wild , wild , web",reed m. meseck,sigmod conference,2001
2514,xquery formal semantics : state and challenges,peter fankhauser,sigmod record,2001
2515,extending an ordbms : the statemachine module,"wolfgang mahnke , christian mathis , hans-peter steiert",vldb,2002
2516,contorting high dimensional data for efficient main memory processing,"beng chin ooi , bin cui , kian-lee tan , jianwen su",sigmod conference,2003
2517,genesys : a system for efficient spatial query processing,"thomas brinkhoff , hans-peter kriegel , ralf schneider , bernhard seeger",sigmod conference,1994
2518,storage and retrieval of xml data using relational databases,"surajit chaudhuri , kyuseok shim",vldb,2001
2519,asset : a system for supporting extended transactions,"narain h. gehani , krithi ramamritham , alexandros biliris , h. v. jagadish , shaul dar",sigmod conference,1994
2520,data mining with optimized two-dimensional association rules,"takeshi tokuyama , yasuhiko morimoto , shinichi morishita , takeshi fukuda",acm trans . database syst .,2001
2521,towards a cooperative transaction model - the cooperative activity model,"thomas tesch , peter muth , wolfgang klas , marek rusinkiewicz , jürgen wäsch",vldb,1995
2522,an active functionality service for e-business applications,"mariano cilia , alejandro p. buchmann",sigmod record,2002
2523,integrating the ub-tree into a database system kernel,"robert fenk , rudolf bayer , volker markl , martin zirkel , frank ramsak , klaus elhardt",vldb,2000
2524,indexing multimedia databases ( tutorial ),christos faloutsos,sigmod conference,1995
2525,estimating page fetches for index scans with finite lru buffers,"arun n. swami , k. bernhard schiefer",sigmod conference,1994
2526,similarity based retrieval of pictures using indices on spatial relationships,"chengwen liu , a. prasad sistla , clement t. yu , king liu",vldb,1995
2527,monitoring business processes through event correlation based on dependency model,"tali yatzkar-haham , asaf adi , david botzer , opher etzion",sigmod conference,2001
2528,a survey of logical models for olap databases,"timos k. sellis , panos vassiliadis",sigmod record,1999
2529,transaction chopping : algorithms and performance studies,"dennis shasha , eric simon , patrick valduriez , françois llirbat",acm trans . database syst .,1995
2530,of objects and databases : a decade of turmoil,"david j. dewitt , michael j. carey",vldb,1996
2531,scheduling for shared window joins over data streams,"michael j. franklin , moustafa a. hammad , ahmed k. elmagarmid , walid g. aref",vldb,2003
2532,optimizing queries on compressed bitmaps,"sihem amer-yahia , theodore johnson",vldb,2000
2533,report on the 13th brazilian symposium on database systems ( sbbd ' 98 ),"claudia bauzer medeiros , mario a. nascimento",sigmod record,1999
2534,memex : a browsing assistant for collaborative archiving and mining of surf trails,"mallela subramanyam , mitul tiwari , sandeep srivastava , soumen chakrabarti",vldb,2000
2535,microsoft site server ( commerce edition ),bassel ojjeh,sigmod conference,1999
2536,schemasql : an extension to sql for multidatabase interoperability,"fereidoon sadri , laks v. s. lakshmanan , subbu n. subramanian",acm trans . database syst .,2001
2537,data model for extensible support of explicit relationships in design databases,"joan peckham , bonnie mackellar , michael doherty",vldb j.,1995
2538,coma - a system for flexible combination of schema matching approaches,"erhard rahm , hong hai do",vldb,2002
2539,webview materialization,"nick roussopoulos , alexandros labrinidis",sigmod conference,2000
2540,join index hierarchies for supporting efficient navigations in object-oriented databases,"jiawei han , zhaohui xie",vldb,1994
2541,"sqlj part 0 , now known as sql/olb ( object-language bindings )","andrew eisenberg , jim melton",sigmod record,1998
2542,parallelising oodbms traversals : a performance evaluation,"jeffrey f. naughton , john c. shafer , david j. dewitt , shivakumar venkataraman",vldb j.,1996
2543,modelling temporal thematic map contents,"elaheh pourabbas , alberto d'onofrio",sigmod record,2003
2544,"data morphing : an adaptive , cache-conscious storage technique","richard a. hankins , jignesh m. patel",vldb,2003
2545,"research in databases and data-intensive applications - computer science department and fzi , university of karlsruhe","birgitta könig-ries , peter c. lockemann",sigmod record,1997
2546,infomaster : an information integration system,"arthur m. keller , michael r. genesereth , oliver m. duschka",sigmod conference,1997
2547,applications of the java programming language to database management,"v. wiktor marek , bradley f. burton",sigmod record,1998
2548,editor 's notes,jennifer widom,sigmod record,1996
2549,exposing undergraduate students to database system internals,"anastassia ailamaki , joseph m. hellerstein",sigmod record,2003
2550,guest editorial,malcolm p. atkinson,vldb j.,2000
2551,a product specification database for visual prototyping,"kouichi yasutake , kazutoshi sumiya , yoshihiko imai , hirohiko tanaka , norio sanada",vldb,1995
2552,discovery of multiple-level association rules from large databases,"jiawei han , yongjian fu",vldb,1995
2553,improving adaptable similarity query processing by using approximations,"hans-peter kriegel , bernhard braunmüller , thomas seidl , mihael ankerst",vldb,1998
2554,implementation and analysis of a parallel collection query language,dan suciu,vldb,1996
2555,structure and value synopses for xml data graphs,"neoklis polyzotis , minos n. garofalakis",vldb,2002
2556,a close look at the ifo data model,magdy s. hanna,sigmod record,1995
2557,the 3w model and algebra for unified data mining,"laks v. s. lakshmanan , raymond t. ng , theodore johnson",vldb,2000
2558,concurrency control in hierarchical multidatabase systems,"henry f. korth , abraham silberschatz , sharad mehrotra",vldb j.,1997
2559,privacy-enhanced data management for next-generation e-commerce,"irini fundulaki , daniel f. lieuwen , bharat kumar , richard hull , chris clifton , arnaud sahuguet",vldb,2003
2560,tip : a temporal extension to informix,"huacheng c. ying , jennifer widom , jun yang",sigmod conference,2000
2561,a general techniques for querying xml documents using a relational database system,"stratis viglas , eugene j. shekita , rajasekar krishnamurthy , jayavel shanmugasundaram , jeffrey f. naughton , jerry kiernan , igor tatarinov",sigmod record,2001
2562,tracing the lineage of view data in a warehousing environment,"janet l. wiener , yingwei cui , jennifer widom",acm trans . database syst .,2000
2563,qcluster : relevance feedback using adaptive clustering for content-based image retrieval,"deok-hwan kim , chin-wan chung",sigmod conference,2003
2564,memory requirements for query execution in highly constrained devices,"luc bouganim , nicolas anciaux , philippe pucheral",vldb,2003
2565,spectral bloom filters,"yossi matias , saar cohen",sigmod conference,2003
2566,digital library services in mobile computing,"evaggelia pitoura , melliyal annamalai , bharat k. bhargava",sigmod record,1995
2567,spatial operators,"eliseo clementini , paolino di felice",sigmod record,2000
2568,a research status report on adaptation for mobile data access,"brian noble , mahadev satyanarayanan",sigmod record,1995
2569,"the grna : a highly programmable infrastructure for prototyping , developing and deploying genomics-centric applications","sourav s. bhowmick , pedro cruz , dadabhai t. singh , george rajesh , amey v. laud",vldb,2002
2570,semantic integration in heterogeneous databases using neural networks,"chris clifton , wen-syan li",vldb,1994
2571,analysis of locking behavior in three real database systems,"alan jay smith , vigyan singhal",vldb j.,1997
2572,an interpolated volume data model,"amarnath gupta , tianqiu wang , simone santini",vldb,2003
2573,languages for multi-database interoperability,"laks v. s. lakshmanan , frédéric gingras , nematollaah shiri , despina papoulis , iyer n. subramanian",sigmod conference,1997
2574,report from the nsf workshop on workflow and process automation in information systems,"dimitrios georgakopoulos , stef joosten , marek rusinkiewicz , alexander l. wolf , walt scacchi , amit p. sheth , jack c. wileden",sigmod record,1996
2575,the oasis multidatabase prototype,"john murphy , mark roantree , wilhelm hasselbring",sigmod record,1999
2576,a database interface for file updates,"tova milo , serge abiteboul , sophie cluet",sigmod conference,1995
2577,data manager for evolvable real-time command and control systems,"eric hughes , roman ginis , bhavani m. thuraisingham , peter c. krupp , john a. maurer",vldb,1997
2578,data warehousing and olap for decision support ( tutorial ),"surajit chaudhuri , umeshwar dayal",sigmod conference,1997
2579,the distributed information search component ( disco ) and the world wide web,"olga kapitskaia , philippe bonnet , hubert naacke , anthony tomasic , louiqa raschid , rémy amouroux",sigmod conference,1997
2580,emergent semantics and the multimedia semantic web,"william i. grosky , farshad fotouhi , d. v. sreenath",sigmod record,2002
2581,icicles : self-tuning samples for approximate query answering,"venkatesh ganti , raghu ramakrishnan , mong-li lee",vldb,2000
2582,in memory of bob kooi ( 1951-1993 ),michael stonebraker,sigmod record,1994
2583,book review column,karl aberer,sigmod record,2001
2584,lachesis : robust database storage management based on device-specific performance characteristics,"anastassia ailamaki , jiri schindler , gregory r. ganger",vldb,2003
2585,to table or not to table : a hypertabular answer,"giuseppe santucci , laura tarantino",sigmod record,1996
2586,italian electronic identity card - principle and architecture,mario gentili,vldb,2001
2587,making b + - trees cache conscious in main memory,"kenneth a. ross , jun rao",sigmod conference,2000
2588,a content-based multimedia server for massively parallel architectures,"c. watson , g. linderman , euthimios panagos , t. walters , ion tim ieong , alexandros biliris , j. wang , s. choo , david schrader , p. colin , william o'connell , grace au",sigmod conference,1996
2589,eddies : continuously adaptive query processing,"ron avnur , joseph m. hellerstein",sigmod conference,2000
2590,olap + + : powerful and easy-to-use federations of olap and object databases,"junmin gu , arie shoshani , torben bach pedersen",vldb,2000
2591,xmdvtool : visual interactive data exploration and trend discovery of high-dimensional data sets,"elke a. rundensteiner , punit r. doshi , jing yang , matthew o. ward",sigmod conference,2002
2592,contracting in the days of ebusiness,"wolfgang hümmer , wolfgang lehner , hartmut wedekind",sigmod record,2002
2593,hash joins and hash teams in microsoft sql server,"shaun cooper , goetz graefe , ross bunker",vldb,1998
2594,treasurer 's message,joachim hammer,sigmod record,2000
2595,a foundation for multi-dimensional databases,"laks v. s. lakshmanan , marc gyssens",vldb,1997
2596,research issues in databases for arcs : active rapidly changing data systems,anindya datta,sigmod record,1994
2597,an open storage system for abstract objects,"lukas relly , stephen blott , hans-jörg schek",sigmod conference,1996
2598,a shrinking-based approach for multi-dimensional data analysis,"yuqing song , yong shi , aidong zhang",vldb,2003
2599,indexing images in oracle8i,"melliyal annamalai , samuel defazio , rajiv chopra",sigmod conference,2000
2600,integrating sql databases with content-specific search engines,"stefan deßloch , nelson mendonça mattos",vldb,1997
2601,reminiscences on influential papers,"kaladhar voruganti , renée j. miller , kenneth a. ross , flip korn",sigmod record,2002
2602,metu interoperable database system,"ebru kilic , pinar koksal , cem evrendilek , ugur halici , sema mancuhan , n. kesim , asuman dogac , cevdet dengi , sena nural , gökhan özhan , fatma ozcan , ismailcem budak arpinar",sigmod record,1995
2603,solving satisfiability and implication problems in database systems,"sha guo , mark allen weiss , wei sun",acm trans . database syst .,1996
2604,dynamic update cube for range-sum queries,"seok-ju chun , ju-hong lee , seok-lyong lee , chin-wan chung",vldb,2001
2605,eos : exactly-once e-service middleware,"gerhard weikum , david b. lomet , german shegalov , roger s. barga",vldb,2002
2606,heuristic and randomized optimization for the join ordering problem,"guido moerkotte , michael steinbrunn , alfons kemper",vldb j.,1997
2607,bulk loading into an oodb : a performance study,"jeffrey f. naughton , janet l. wiener",vldb,1994
2608,adam : a testbed for exploring the use of data mining in intrusion detection,"daniel barbará , sushil jajodia , ningning wu , julia couto",sigmod record,2001
2609,user-optimizer communication using abstract plans in sybase ase,"patrick valduriez , mihnea andrei",vldb,2001
2610,database research at nthu and itri,arbee l. p. chen,sigmod record,1994
2611,a simple algorithm for finding frequent elements in streams and bags,"scott shenker , christos h. papadimitriou , richard m. karp",acm trans . database syst .,2003
2612,sash : a self-adaptive histogram set for dynamically changing workloads,"lipyeow lim , min wang , jeffrey scott vitter",vldb,2003
2613,locally adaptive dimensionality reduction for indexing large time series databases,"kaushik chakrabarti , eamonn j. keogh , michael j. pazzani , sharad mehrotra",acm trans . database syst .,2002
2614,chair 's message,richard t. snodgrass,sigmod record,2001
2615,indexing and querying xml data for regular path expressions,"bongki moon , quanzhong li",vldb,2001
