acm_dblp_id,pub_location,study_title,yr
0,sigmod record,semantic integration of environmental models for application to global information systems and decision-making,1999
1,vldb,estimation of query-result distribution and its application in parallel-join load balancing,1996
2,vldb,incremental maintenance for non-distributive aggregate functions,2002
3,vldb,cost-based selection of path expression processing algorithms in object-oriented databases,1996
4,vldb,benchmarking spatial join operations with spatial output,1995
5,sigmod conference,efficient geometry-based similarity search of 3d spatial databases,1999
6,sigmod record,mining the world wide web : an information search approach - book review,2002
7,vldb j.,enhanced abstract data types in object-relational databases,1998
8,sigmod record,report on dart ' 96 : databases : active and real-time ( concepts meet practice ),1997
9,sigmod record,unisql 's next-generation object-relational database management system,1996
10,vldb,dual-buffering strategies in object bases,1994
11,sigmod conference,aurora : a data stream management system,2003
12,vldb j.,priority assignment in real-time active databases,1996
13,vldb j.,wavecluster : a wavelet based clustering approach for spatial data in very large databases,2000
14,vldb j.,approximate query mapping : accounting for translation closeness,2001
15,vldb,sprint : a scalable parallel classifier for data mining,1996
16,sigmod conference,snowball : a prototype system for extracting relations from large text collections,2001
17,sigmod conference,a framework for implementing hypothetical queries,1997
18,vldb j.,parametric query optimization,1997
19,vldb,lineage tracing for general data warehouse transformations,2001
20,sigmod record,report on the acm fourth international workshop on data warehousing and olap ( dolap 2001 ),2002
21,vldb,approximating aggregate queries about web pages via random walks,2000
22,sigmod record,a query language for a web-site management system,1997
23,vldb,supporting periodic authorizations and temporal reasoning in database access control,1996
24,sigmod conference,free parallel data mining,1998
25,vldb,high level indexing of user-defined types,1999
26,vldb,pc database systems - present and future,1994
27,vldb,form-based proxy caching for database-backed web sites,2001
28,vldb j.,a logical view of structured files,1998
29,sigmod record,dbglobe : a service-oriented p2p system for global computing,2003
30,sigmod conference,database patchwork on the internet,1999
31,vldb,scientific databases - state of the art and future directions,1994
32,vldb,a generic approach to bulk loading multidimensional index structures,1997
33,vldb,data bubbles for non-vector data : speeding-up hierarchical clustering in arbitrary metric spaces,2003
34,vldb,efficient snapshot differential algorithms for data warehousing,1996
35,vldb,integrating triggers and declarative constraints in sql database sytems,1996
36,vldb,efficient ir-style keyword search over relational databases,2003
37,vldb j.,indexing of now-relative spatio-bitemporal data,2002
38,sigmod conference,"temporal coalescing with now , granularity , and incomplete information",2003
39,sigmod record,database research at ut arlington,2003
40,sigmod record,why decision support fails and how to fix it,1995
41,vldb,a low-cost storage server for movie on demand databases,1994
42,vldb,generating call-level interfaces for advanced database application programming,1999
43,sigmod conference,clustering by pattern similarity in large data sets,2002
44,sigmod conference,mocha : a database middleware system featuring automatic deployment of application-specific functionality,2000
45,sigmod conference,fact : a learning based web query processing system,2000
46,sigmod record,sql multimedia and application packages ( sql/mm ),2001
47,vldb,bellcore 's adapt/x harness system for managing information on internet and intranets,1996
48,sigmod conference,xml data management go native or spruce up relational systems ? ( panel abstract ),2001
49,sigmod record,an overview of data warehousing and olap technology,1997
50,sigmod conference,staggered striping in multimedia information systems,1994
51,sigmod record,multimedia streaming in large-scale sensor networks with mobile swarms,2003
52,sigmod record,how to modify sql queries in order to guarantee sure answers,1994
53,vldb,materialization : a powerful and ubiquitous abstraction pattern,1994
54,sigmod conference,dynamic content acceleration : a caching solution to enable scalable dynamic web page generation,2001
55,sigmod record,data modelling in the large,1994
56,sigmod conference,updating xml,2001
57,sigmod record,research in information managment at dublin city university,2002
58,sigmod conference,the multidimensional database system rasdaman,1998
59,vldb,analyzing energy behavior of spatial access methods for memory-resident data,2001
60,vldb,the value of merge-join and hash-join in sql server,1999
61,sigmod conference,efficient execution of joins in a star schema,2002
62,vldb,picodmbs : scaling down database techniques for the smartcard,2000
63,vldb,multi-dimensional substring selectivity estimation,1999
64,vldb j.,the intrinsic problems of structural heterogeneity and an approach to their solution,1999
65,sigmod conference,a database perspective on lotus domino/notes,1999
66,sigmod record,"domains , relations and religious wars",1996
67,vldb,the data-centric revolution in networking,2003
68,sigmod conference,cache-and-query for wide area sensor databases,2003
69,vldb,a cost model for clustered object-oriented databases,1995
70,vldb,expiring data in a warehouse,1998
71,sigmod record,opportunities in information management and assurance,1997
72,vldb,finding data in the neighborhood,1997
73,sigmod conference,prefer : a system for the efficient execution of multi-parametric ranked queries,2001
74,sigmod record,editor 's notes,2002
75,sigmod conference,rainbow : mapping-driven xquery processing system,2002
76,vldb j.,algebraic query optimisation for database programming languages,1996
77,acm trans . database syst .,static analysis techniques for predicting the behavior of active database rules,1995
78,sigmod conference,the ores temporal database management system,1994
79,acm trans . database syst .,magic conditions,1996
80,vldb,l/mrp : a buffer management strategy for interactive continuous data flows in a multimedia dbms,1995
81,sigmod conference,"ubiquitous , self-tuning , scalable servers",1998
82,vldb,explaining differences in multidimensional aggregates,1999
83,vldb,a performance study of workfile disk management for concurrent mergesorts in a multiprocessor database system,1995
84,sigmod conference,database in crisis and transition : a technical agenda for the year 2001,1994
85,sigmod conference,"workflow automation : applications , technology , and research ( tutorial )",1995
86,sigmod record,"workshop on performance and architecture of web servers ( paws-2000 , held in conjection with sigmetrics-2000 )",2000
87,vldb,a scalable algorithm for answering queries using views,2000
88,sigmod record,why i like working in academia,2002
89,sigmod conference,efficient and tunable similar set retrieval,2001
90,vldb,fast and accurate text classification via multiple linear discriminant projections,2002
91,vldb,"business process coordination : state of the art , trends , and open issues",2001
92,vldb,work and information practices in the sciences of biodiversity,2000
93,sigmod conference,data modeling of time-based media,1994
94,acm trans . database syst .,space optimization in deductive databases,1995
95,sigmod record,chair 's message,2000
96,sigmod record,trade press news - announcement and preface,1994
97,sigmod conference,improving index performance through prefetching,2001
98,sigmod record,new programs at darpa and nsf,1996
99,vldb,investigation of algebraic query optimisation techniques for database programming languages,1994
100,vldb,"physical data independence , constraints , and optimization with universal plans",1999
101,sigmod conference,an adaptive query execution system for data integration,1999
102,vldb,the semantic web paving the way to the knowledge society,2001
103,vldb,parallel algorithms for high-dimensional similarity joins for data mining applications,1997
104,acm trans . database syst .,path sharing and predicate evaluation for high-performance xml filtering,2003
105,sigmod conference,processing set expressions over continuous update streams,2003
106,vldb,performance measurements of compressed bitmap indices,1999
107,vldb,hierarchical prefix cubes for range-sum queries,1999
108,acm trans . database syst .,removing permissions in the flexible authorization framework,2003
109,sigmod conference,ariadne : a system for constructing mediators for internet sources,1998
110,acm trans . database syst .,multiway spatial joins,2001
111,sigmod conference,implementing data cubes efficiently,1996
112,sigmod record,recent design trade-offs in sql3,1994
113,sigmod record,sqlj-part 1 : sql routines using the java programming language,1999
114,sigmod conference,similarity-based queries for time series data,1997
115,sigmod record,"a distributed scientific data archive using the web , xml and sql/med",1999
116,vldb,viator - a tool family for graphical networking and data view creation,2002
117,sigmod record,information warfare and security - book review,2001
118,vldb,the persistent cache : improving oid indexing in temporal object-oriented database systems,1999
119,vldb,estimating the selectivity of spatial queries using the ` correlation ' fractal dimension,1995
120,vldb j.,semantic heterogeneity resolution in federated databases by metadata implantation and stepwise evolution,1999
121,sigmod record,performance evaluation of a new distributed deadlock detection algorithm,1994
122,sigmod record,sql and management of external data,2001
123,vldb,"aquery : query language for ordered data , optimization techniques , and experiments",2003
124,vldb,resource scheduling in enhanced pay-per-view continuous media databases,1997
125,sigmod conference,review : a real time virtual walkthrough system,2001
126,acm trans . database syst .,a modified random perturbation method for database security,1994
127,sigmod conference,managing web data,1999
128,vldb,loading the data warehouse across various parallel architectures,1996
129,sigmod record,hodfa : an architectural framework for homogenizing heterogeneous legacy database,1995
130,vldb,"database tuning : principles , experiments , and troubleshooting techniques",2002
131,sigmod record,reminiscences an influential papers,2003
132,sigmod record,application of oodb and sgml techniques in text database : an electronic dictionary system,1995
133,sigmod conference,java and relational databases : sqlj ( tutorial ),1998
134,sigmod conference,covering indexes for branching path queries,2002
135,sigmod conference,semint : a system prototype for semantic integration in heterogeneous databases,1995
136,sigmod record,career-enhancing services at sigmod online,2001
137,sigmod conference,revisiting commit processing in distributed database systems,1997
138,acm trans . database syst .,type-checking oql queries in the odmg type systems,1999
139,sigmod conference,things every update replication customer should know,1995
140,sigmod record,in memory of gísli r. hjaltason,2003
141,vldb,query optimization by predicate move-around,1994
142,sigmod conference,catching the boat with strudel : experiences with a web-site management system,1998
143,sigmod conference,adaptable query optimization and evaluation in temporal middleware,2001
144,sigmod conference,birch : an efficient data clustering method for very large databases,1996
145,sigmod conference,time-parameterized queries in spatio-temporal databases,2002
146,sigmod conference,scalable parallel data mining for association rules,1997
147,acm trans . database syst .,an algebraic approach to static analysis of active database rules,2000
148,vldb,os support for vldbs : unix enhancements for the teradata data base,1995
149,sigmod conference,dwarf : shrinking the petacube,2002
150,sigmod conference,thinksheet : a tool for tailoring complex documents,1996
151,sigmod conference,on-line reorganization of sparsely-populated b + trees,1996
152,sigmod conference,handling very large databases with informix extended parallel server,2000
153,vldb,including group-by in query optimization,1994
154,vldb,value-cognizant speculative concurrency control,1995
155,sigmod record,data mining : practical machine learning tools and techniques - book review,2002
156,sigmod record,report on the 8th international workshop on knowledge representation meets databases ( krdb ),2001
157,sigmod conference,starts : stanford proposal for internet meta-searching ( experience paper ),1997
158,vldb,the x-tree : an index structure for high-dimensional data,1996
159,vldb,eliminating fuzzy duplicates in data warehouses,2002
160,vldb,a database striptease or how to manage your personal databases,2003
161,sigmod conference,an ebxml infrastructure implementation through uddi registries and rosettanet pips,2002
162,sigmod record,temporal database system implementations,1995
163,vldb,xsearch : a semantic search engine for xml,2003
164,vldb,opossum : desk-top schema management through customizable visualization,1995
165,acm trans . database syst .,atomicity and isolation for transactional processes,2002
166,sigmod conference,logical logging to extend recovery to new domains,1999
167,sigmod conference,the impress ddt : a database design toolbox based on a formal specification language,1994
168,sigmod conference,online aggregation,1997
169,sigmod conference,"semi-automatic , self-adaptive control of garbage collection rates in object databases",1996
170,vldb,a single pass computing engine for interactive analysis of vldbs,1998
171,vldb,fast nearest neighbor search in medical image databases,1996
172,sigmod record,metadata for digital media : introduction to the special issue,1994
173,sigmod record,"in reply to domains , relations and religious wars",1996
174,vldb,bank of america case study : the information currency advantage,1998
175,vldb j.,tree pattern query minimization,2002
176,sigmod conference,fine-grained sharing in a page server oodbms,1994
177,sigmod record,adept : an agent-based approach to business process management,1998
178,sigmod record,introduction to the career forum column,2001
179,sigmod conference,image mining in iris : integrated retinal information system,2000
180,sigmod conference,enterprise information architectures -- they 're finally changing,1994
181,vldb,integrating information for on demand computing,2003
182,vldb j.,thémis : a database programming language handling integrity constraints,1995
183,vldb j.,an introduction to deductive database languages and systems,1994
184,vldb,information management challenges from the aerospace industry,2002
185,sigmod conference,state of the art in workflow management research and products,1996
186,sigmod record,videoanywhere : a system for searching and managing distributed video assets,1999
187,sigmod record,phoenix project : fault-tolerant applications,2002
188,sigmod record,cluster validity methods : part i,2002
189,sigmod conference,directv and oracle rdb : the challenges of vldb transaction processing,1995
190,sigmod conference,ensuring relaxed atomicity for flexible transactions in multidatabase systems,1994
191,sigmod conference,"replication , consistency , and practicality : are these mutually exclusive ?",1998
192,vldb,a-topss - a publish/subscribe system supporting approximate matching,2002
193,acm trans . database syst .,searching in metric spaces with user-defined and approximate distances,2002
194,sigmod conference,algorithms for deferred view maintenance,1996
195,vldb,design and development of a stream service in a heterogenous client environment,2000
196,sigmod conference,cougar : the network is the database,2002
197,sigmod conference,the data that you wo n't find in databases : tutorial panel on data exchange formats,1995
198,vldb j.,effective timestamping in databases,2000
199,acm trans . database syst .,silkroute : a framework for publishing relational data in xml,2002
200,vldb,the tpr * - tree : an optimized spatio-temporal access method for predictive queries,2003
201,sigmod record,editor 's notes,1996
202,vldb,mapping adaptation under evolving schemas,2003
203,vldb,the nd-tree : a dynamic indexing technique for multidimensional non-ordered discrete data spaces,2003
204,sigmod conference,transactional publish / subscribe : the proactive multicast of database changes,1998
205,sigmod conference,exploiting constraint-like data characterizations in query optimization,2001
206,sigmod conference,metu interoperable database system,1996
207,vldb,clustering techniques for minimizing external path length,1996
208,vldb,the national medical knowledge bank,1998
209,vldb j.,guest editorial,2003
210,sigmod record,report on fqas 2002 : fifth international conference on flexible query answering systems,2003
211,vldb,an automated system for web portal personalization,2002
212,vldb,webfilter : a high-throughput xml-based publish and subscribe system,2001
213,sigmod record,ogdi : toward interoperability among geospatial databases,1997
214,sigmod record,editor 's notes,2000
215,sigmod conference,dimensionality reduction for similarity searching in dynamic databases,1998
216,vldb,push technology personalization through event correlation,2000
217,vldb,oracle industrial exhibit,1998
218,vldb,a one-pass algorithm for accurately estimating quantiles for disk-resident data,1997
219,sigmod record,editor 's notes,2001
220,vldb,translating web data,2002
221,sigmod conference,repository system engineering,1996
222,sigmod record,sigmod sister societies,2000
223,vldb j.,semantic integrity support in sql : 1999 and commercial ( object - ) relational database management systems,2001
224,vldb j.,"adaptable pointer swizzling strategies in object bases : design , realization , and quantitative analysis",1995
225,sigmod conference,implementing xquery,2002
226,vldb,mining surprising patterns using temporal description length,1998
227,sigmod conference,continually evaluating similarity-based pattern queries on a streaming time series,2002
228,vldb,efficient approximation of optimization queries under parametric aggregation constraints,2003
229,vldb j.,the aditi deductive database system,1994
230,sigmod conference,on random sampling over joins,1999
231,vldb,feedbackbypass : a new approach to interactive similarity query processing,2001
232,sigmod conference,a multimedia presentation algebra,1999
233,acm trans . database syst .,a structured approach for the definition of the semantics of active databases,1995
234,vldb,fast algorithms for mining association rules in large databases,1994
235,vldb,"large-scale , standards-based earth observation imagery and web mapping services",2003
236,sigmod conference,combinatorial pattern discovery for scientific data : some preliminary results,1994
237,sigmod conference,partition based spatial-merge join,1996
238,vldb,webservice composition with o'grape and osiris,2003
239,vldb,optimal grid-clustering : towards breaking the curse of dimensionality in high-dimensional clustering,1999
240,sigmod record,the database group at university of hagen ( fernuniversitaet ),1995
241,sigmod conference,extended wavelets for multiple measures,2003
242,vldb,business modelling using sql spreadsheets,2003
243,sigmod conference,optimal multi-step k-nearest neighbor search,1998
244,sigmod conference,"hierarchical subspace sampling : a unified framework for high dimensional data reduction , selectivity estimation and nearest neighbor search",2002
245,vldb j.,an experimental system for object-based sharing in federated databases,1996
246,sigmod conference,the lotus notes storage system,1995
247,vldb,schema-driven customization of web services,2003
248,acm trans . database syst .,evaluation of remote backup algorithms for transaction-processing systems,1994
249,sigmod conference,using schematically heterogeneous structures,1998
250,vldb,generalised hash teams for join and group-by,1999
251,sigmod conference,"tpc-ds , taking decision support benchmarking to the next level",2002
252,vldb,heterogeneous database query optimization in db2 universal datajoiner,1998
253,vldb,processing object-oriented queries with invertible late bound functions,1995
254,sigmod record,combining fuzzy information : an overview,2002
255,vldb,"nexusscout : an advanced location-based application on a distributed , open mediation platform",2003
256,vldb,incremental clustering for mining in a data warehousing environment,1998
257,sigmod conference,efficient similarity search and classification via rank aggregation,2003
258,vldb j.,using extended feature objects for partial similarity retrieval,1997
259,vldb j.,composing web services on the semantic web,2003
260,sigmod conference,irisnet : internet-scale resource-intensive sensor services,2003
261,sigmod conference,range queries in olap data cubes,1997
262,sigmod conference,a characterization of the sensitivity of query optimization to storage access cost parameters,2003
263,vldb,online dynamic reordering for interactive data processing,1999
264,vldb j.,progressive evaluation of nested aggregate queries,2000
265,acm trans . database syst .,the incinerate data model,1995
266,sigmod record,semantic interoperability in global information systems : a brief introduction to the research area and the special section,1999
267,sigmod conference,lambda-db : an odmg-based object-oriented dbms,2000
268,sigmod conference,data access for the masses through ole db,1996
269,sigmod conference,integration of spatial join algorithms for processing multiple inputs,1999
270,sigmod record,report on the mobile search workshop at www 2002,2002
271,sigmod conference,spatial hash-joins,1996
272,vldb j.,the tv-tree : an index structure for high-dimensional data,1994
273,vldb,cumulative updates,1994
274,sigmod record,report on the 17th brazilian symposium on database systems ( sbbd 2002 ),2003
275,sigmod record,accessibility of the database literature,2001
276,sigmod record,too much middleware,2002
277,sigmod conference,will database researchers have any role in data security ? ( panel abstract ),2001
278,sigmod conference,"50,000 users on an oracle8 universal server database",1998
279,vldb,approximate query translation across heterogeneous information sources,2000
280,vldb,media360 workflow-implementing a workflow engine inside a database,2000
281,sigmod conference,statistical schema matching across web query interfaces,2003
282,vldb j.,constant time permutation : an efficient block allocation strategy for variable-bit-rate continuous media data,1999
283,acm trans . database syst .,cache investment : integrating query optimization and distributed data placement,2000
284,sigmod record,editor 's notes,1997
285,sigmod record,information director 's message,1998
286,sigmod record,continuous queries over data streams,2001
287,sigmod record,converting relational to object-oriented databases,1997
288,sigmod conference,enhancing database correctness : a statistical approach,1995
289,sigmod record,constructing the next 100 database management systems,1994
290,sigmod conference,efficient computation of iceberg cubes with complex measures,2001
291,vldb,a fast index for semistructured data,2001
292,sigmod conference,a monte carlo algorithm for fast projective clustering,2002
293,sigmod record,towards a database body of knowledge : a study from spain,2003
294,vldb,bibfinder/statminer : effectively mining and using coverage and overlap statistics in data integration,2003
295,sigmod conference,software as a service : asp and asp aggregation,2002
296,vldb,cheetah : a lightweight transaction server for plug-and-play internet data management,2000
297,sigmod record,dimacs summer school tutorial on new frontiers in data mining,2001
298,vldb,principles of optimally placing data in tertiary storage libraries,1997
299,acm trans . database syst .,flexible support for multiple access control policies,2001
300,sigmod conference,aries/csa : a method for database recovery in client-server architectures,1994
301,sigmod conference,providing better support for a class of decision support queries,1996
302,vldb,spatio-temporal retrieval with rasdaman,1999
303,sigmod record,"tcp-d - the challenges , issues and results",1996
304,sigmod record,reminiscences on influential papers,2001
305,vldb,computing iceberg queries efficiently,1998
306,sigmod conference,paradise : a database system for gis applications,1995
307,vldb,"very large databases : how large , how different ?",1995
308,sigmod conference,automatic segmentation of text into structured records,2001
309,vldb,xperanto : middleware for publishing object-relational data as xml documents,2000
310,sigmod conference,bit-sliced index arithmetic,2001
311,sigmod record,treasurer 's message,2001
312,sigmod record,a hypertext query language for images,1994
313,sigmod conference,the bucky object-relational benchmark ( experience paper ),1997
314,vldb j.,view management in multimedia databases,2000
315,vldb,"declarative data cleaning : language , model , and algorithms",2001
316,vldb,banks : browsing and keyword searching in relational databases,2002
317,vldb j.,garbage collection in object-oriented databases using transactional cyclic reference counting,1998
318,sigmod conference,xpress : a queriable compression for xml data,2003
319,vldb,a novel index supporting high volume data warehouse insertion,1999
320,vldb,coloring away communication in parallel query optimization,1995
321,vldb,sensor data mining : similarity search and pattern analysis,2002
322,vldb,privacy-preserving indexing of documents on the network,2003
323,sigmod conference,serf : odmg-based generic re-structuring facility,1999
