acm_dblp_id,pub_location,study_title,yr
324,acm trans . database syst .,multiview access protocols for large-scale replication,1998
325,vldb,the case for enhanced abstract data types,1997
326,sigmod conference,"probe , count , and classify : categorizing hidden web databases",2001
327,vldb,the role of integrity constraints in database interoperation,1996
328,vldb,m-tree : an efficient access method for similarity search in metric spaces,1997
329,vldb j.,the oodb path-method generator ( pmg ) using access weights and precomputed access relevance,1998
330,sigmod record,metadata standards for data warehousing : open information model vs. common warehouse metamodel,2000
331,sigmod record,comprehension syntax,1994
332,sigmod conference,fast subsequence matching in time-series databases,1994
333,sigmod conference,querying structured text in an xml database,2003
334,vldb,online scaling in a highly available database,2001
335,sigmod conference,approximate computation of multidimensional aggregates of sparse data using wavelets,1999
336,vldb,discovering web services : an overview,2001
337,sigmod conference,coordinating backup/recovery and data consistency between database and file systems,2002
338,sigmod record,chair 's message,1997
339,vldb,an ultra highly available dbms,2000
340,vldb,progressive merge join : a generic and non-blocking sort-based join algorithm,2002
341,sigmod conference,implementation of magic-sets in a relational database system,1994
342,vldb j.,managing multiple and distributed ontologies on the semantic web,2003
343,sigmod conference,outlier detection for high dimensional data,2001
344,vldb j.,energy-performance trade-offs for spatial access methods on memory-resident data,2002
345,acm trans . database syst .,an execution model for limited ambiguity rules and its application to derived data update,1995
346,vldb,xquec : pushing queries to compressed xml data,2003
347,vldb,dynamic memory adjustment for external mergesort,1997
348,sigmod conference,filenet integrated document management database usage and issues,1998
349,vldb,data compression support in databases,1994
350,acm trans . database syst .,supporting valid-time indeterminacy,1998
351,vldb,architectures for internal web services deployment,2001
352,vldb,reducing the braking distance of an sql query engine,1998
353,sigmod conference,dec data distributor : for data replication and data warehousing,1994
354,sigmod conference,optimizing multidimensional index trees for main memory access,2001
355,sigmod record,an approach to confidence based page ranking for user oriented web search,2003
356,vldb,the design and implementation of a sequence database system,1996
357,sigmod conference,the ins and outs ( and everthing in between ) of data warehousing,1996
358,sigmod record,a multi-agent system infrastructure for software component market-place : an ontological perspective,2002
359,sigmod record,reminiscences on influential papers,2001
360,vldb,on the minimization of xpath queries,2003
361,vldb,datablitz : a high performance main-memory storage manager,1998
362,sigmod conference,enterprise java platform data access,1998
363,vldb j.,type-safe relaxing of schema consistency rules for flexible modeling in oodbms,1996
364,vldb j.,optimizing database architecture for the new bottleneck : memory access,2000
365,vldb,some issues in design of distributed deductive databases,1994
366,sigmod conference,optimization of dynamic query evaluation plans,1994
367,vldb,a database index to large biological sequences,2001
368,sigmod conference,fast parallel similarity search in multimedia databases,1997
369,vldb j.,join algorithm costs revisited,1996
370,sigmod conference,implementing database operations using simd instructions,2002
371,sigmod record,quasi-cubes : exploiting approximations in multidimensional databases,1997
372,sigmod record,database research at the university of oklahoma,1999
373,vldb,procedures in object-oriented query languages,1995
374,sigmod record,integrating contents and structure in text retrieval,1996
375,sigmod conference,practical predicate placement,1994
376,vldb j.,on applying hash filters to improving the execution of multi-join queries,1997
377,sigmod conference,the multiview project : object-oriented view technology and applications,1996
378,vldb j.,cost-driven vertical class partitioning for methods in object oriented databases,2003
379,sigmod conference,querying network directories,1999
380,vldb,koda - the architecture and interface of a data model independent kernel,1998
381,sigmod conference,the prototype of the dare system,2001
382,sigmod conference,a framework for change diagnosis of data streams,2003
383,vldb,avoiding ordering and grouping in query processing,2003
384,sigmod conference,multimediaminer : a system prototype for multimedia data mining,1998
385,sigmod conference,query optimization for selections using bitmaps,1999
386,sigmod record,book review column,2002
387,sigmod record,reminiscences on influential papers,2002
388,vldb,w3qs : a query system for the world-wide web,1995
389,sigmod record,two-body job searches,2003
390,sigmod conference,the nimble integration engine,2001
391,vldb,dynamic load balancing in hierarchical parallel database systems,1996
392,sigmod record,materialized views and data warehouses,1998
393,sigmod conference,data grid management systems,2003
394,sigmod record,efficient materialization and use of views in data warehouses,1999
395,vldb,french government activity in the conservation of data and electronic documents,2001
396,vldb,rainbow : distributed database system for classroom education and experimental research,2000
397,vldb,bulk-loading techniques for object databases and an application to relational data,1998
398,vldb,agflow : agent-based cross-enterprise workflow management system,2001
399,sigmod record,databases and transaction processing : an application-oriented approach - book review,2002
400,vldb j.,a survey of approaches to automatic schema matching,2001
401,sigmod conference,winmagic : subquery elimination using window aggregation,2003
402,vldb,objectivity industrial exhibit,1998
403,sigmod record,the aggregate data problem : a system for their definition and management,1996
404,sigmod conference,xsb as a deductive database,1994
405,sigmod record,information rules,2003
406,sigmod conference,the xxl search engine : ranked retrieval of xml data using indexes and ontologies,2002
407,sigmod record,supporting dynamic displays using active rules,1994
408,sigmod record,report on the second ieee metadata conference ( metadata ' 97 ),1998
409,vldb,unrolling cycles to decide trigger termination,1999
410,vldb,effective memory use in a media server,1997
411,sigmod conference,infosleuth : semantic integration of information in open and dynamic environments ( experience paper ),1997
412,sigmod conference,shore : combining the best features of oodbms and file systems,1995
413,vldb,zoo : a desktop experiment management environment,1996
414,sigmod record,a framework for providing consistent and recoverable agent-based access to heterogeneous in mobile databases,1995
415,vldb,sampling-based estimation of the number of distinct values of an attribute,1995
416,sigmod record,editor 's notes,1998
417,vldb,temporal integrity constraints with indeterminacy,2000
418,sigmod conference,the reach active oodbms,1995
419,vldb,architecture of oracle parallel server,1998
420,vldb,dwms : data warehouse management system,1996
421,sigmod record,"review of data on the web : from relational to semistructured data and xml by serge abiteboul , peter buneman , and dan suciu . morgan kaufmann 1999",2003
422,vldb,distributed search over the hidden web : hierarchical database sampling and selection,2002
423,sigmod conference,retina : a real-time traffic navigation system,2001
424,sigmod conference,beyond market baskets : generalizing association rules to correlations,1997
425,vldb j.,an authorization system for digital libraries,2002
426,vldb,memory-contention responsive hash joins,1994
427,sigmod record,a graphical query language for mobile information systems,2003
428,sigmod conference,securing xml documents : the author-x project demonstration,2001
429,vldb,panel : is generic metadata management feasible ?,2000
430,vldb,"the hbp-tree : a modified hb-tree supporting concurrency , recovery and node consolidation",1995
431,vldb j.,"scalable feature selection , classification and signature generation for organizing large text databases into hierarchical topic taxonomies",1998
432,sigmod conference,efficient mid-query re-optimization of sub-optimal query execution plans,1998
433,sigmod record,research activities in database management and information retrieval at the university of illinois at chicago,2002
434,sigmod conference,mining long sequential patterns in a noisy environment,2002
435,vldb,what can hierarchies do for data warehouses ?,1999
436,vldb,logical and physical versioning in main memory databases,1997
437,sigmod conference,efficient and transparent application recovery in client-server information systems,1998
438,sigmod conference,optimizing queries over multimedia repositories,1996
439,sigmod record,optimizing jan jannink 's implementation of b + - tree deletion,1995
440,sigmod conference,"world wide database - integrating the web , corba , and databases",1999
441,vldb,hierarchical compact cube for range-max queries,2000
442,sigmod conference,finding replicated web collections,2000
443,sigmod conference,change detection in hierarchically structured information,1996
444,sigmod conference,delaunay : a database visualization system,1997
445,acm trans . database syst .,safe stratified datalog with integer order does not have syntax,1998
446,sigmod record,data analysis and mining in the life sciences,2001
447,sigmod record,editor 's notes,1998
448,sigmod record,report on the first international workshop an efficient web-based information systems,2003
449,vldb j.,management of multidimensional discrete data,1994
450,sigmod record,constraint databases : a tutorial introduction,2000
451,sigmod record,calls for papers / announcements,1994
452,sigmod record,"report on the first international conference on ontologies , databases and applications of semantics",2003
453,sigmod record,sigmod ' 2000 program chair 's message,2000
454,sigmod conference,"proceedings of the 2003 acm sigmod international conference on management of data , san diego , california , usa , june 9-12 , 2003",2003
455,sigmod record,a consensus glossary of temporal database concepts,1994
456,vldb,spatial joins using r-trees : breadth-first traversal with global optimizations,1997
457,sigmod conference,supersql : an extended sql for database publishing and presentation,1998
458,vldb j.,a bayesian decision model for cost optimal record matching,2003
459,vldb,index concurrency control in firm real-time database systems,1995
460,acm trans . database syst .,temporal statement modifiers,2000
461,sigmod record,statement from the treasurer,1999
462,sigmod conference,"optimizing queries using materialized views : a practical , scalable solution",2001
463,sigmod conference,xml-based information mediation with mix,1999
464,vldb,exact indexing of dynamic time warping,2002
465,vldb,ibm 's db2 universal database demonstrations at vldb '98,1998
466,acm trans . database syst .,a cost model for query processing in high dimensional data spaces,2000
467,vldb j.,searching in metric spaces by spatial approximation,2002
468,sigmod conference,chain : operator scheduling for memory minimization in data stream systems,2003
469,sigmod conference,infoharness : a system for search and retrieval of heterogeneous information,1995
470,vldb,a database system for real-time event aggregation in telecommunication,1998
471,vldb j.,guest editorial,2002
472,sigmod record,reminiscences on influential papers,1998
473,sigmod conference,improving oltp data quality using data warehouse mechanisms,1999
474,vldb,fas - a freshness-sensitive coordination middleware for a cluster of olap components,2002
475,sigmod record,report on the edbt '02 panel on scientific data integration,2002
476,vldb,sideway value algebra for object-relational databases,2002
477,sigmod record,sigmod digital symposium collection ( disc ) editor 's message,2000
478,sigmod conference,using sets of feature vectors for similarity search on voxelized cad objects,2003
479,vldb j.,the gmap : a versatile tool for physical data independence,1996
480,vldb,plan selection based on query clustering,2002
481,sigmod record,wrapping web data into xml,2001
482,vldb j.,global transaction support for workflow management systems : from formal specification to practical implementation,2001
483,vldb,starting ( and sometimes ending ) a database company,1998
484,sigmod conference,optics : ordering points to identify the clustering structure,1999
485,acm trans . database syst .,specification and implementation of exceptions in workflow management systems,1999
486,sigmod record,new standard for stored procedures in sql,1996
487,vldb,optimization of run-time management of data intensive web-sites,1999
488,sigmod conference,dynamic xml documents with distribution and replication,2003
489,sigmod conference,database buffer size investigation for oltp workloads ( experience paper ),1997
490,sigmod record,reminiscences on influential papers,1999
491,sigmod conference,random sampling techniques for space efficient online computation of order statistics of large datasets,1999
492,vldb j.,new partnership with acm and update on the journal,2003
493,sigmod conference,integrating replacement policies in storm : an extensible approach,2000
494,sigmod conference,high availability of commercial applications,1995
495,vldb,modeling design versions,1996
496,sigmod conference,"high-dimensional index structures , database support for next decade 's applications ( tutorial )",1998
497,sigmod conference,lockx : a system for efficiently querying secure xml,2003
498,sigmod record,david dewitt speaks out,2002
499,sigmod conference,oracle rdb 's record caching model,1998
500,sigmod conference,a super scalar sort algorithm for risc processors,1996
501,acm trans . database syst .,fast algorithms for universal quantification in large databases,1995
502,sigmod record,chair 's message,1999
503,vldb,are web services the next revolution in e-commerce ? ( panel ),2001
504,vldb,decision tables : scalable classification exploring rdbms capabilities,2000
505,sigmod conference,reusing invariants : a new strategy for correlated queries,1998
506,vldb,telcordia 's database reconciliation and data quality analysis tool,2000
507,vldb,groupwise processing of relational queries,1997
508,vldb j.,anatomy of a native xml base management system,2002
509,sigmod conference,aqr-toolkit : an adaptive query routing middleware for distributed data intensive systems,2000
510,vldb j.,objectglobe : ubiquitous query processing on the internet,2001
511,sigmod record,beyond document similarity : understanding value-based search and browsing technologies,2000
512,sigmod conference,the mentor workbench for enterprise-wide workflow management,1997
513,sigmod conference,the effectiveness of gloss for the text database discovery problem,1994
514,vldb,technology and the future of commerce and finance ( abstract ),1998
515,vldb,using probabilistic information in data integration,1997
516,sigmod conference,compressing sql workloads,2002
517,vldb,coarse-grained optimization : techniques for rewriting sql statement sequences,2003
518,vldb j.,integrated document caching and prefetching in storage hierarchies based on markov-chain predictions,1998
519,sigmod record,report on the nsf workshop on building an infrastructure for mobile and wireless systems,2002
520,sigmod conference,are we working on the right problems ? ( panel ),1998
521,vldb,"ordering information , conference organizers , program committees , additional reviewers , additional demonstrations reviewers , sponsors , vldb endowment , preface , foreword",2000
522,acm trans . database syst .,understanding the global semantics of referential actions using logic rules,2002
